CIRCUNSCRIPCION,ID_ESTADO,NOMBRE_ESTADO,ID_DISTRITO_LOCAL,CABECERA_DISTRITAL_LOCAL,ID_MUNICIPIO,MUNICIPIO,ID_DEMARCACION_LOCAL,DEMARCACION_LOCAL,TIPO_DE_CANDIDATURA,NOMBRE_ACTOR POLITICO,NUMERO_LISTA,PERSONA CANDIDATA,IDENTIDAD_SEXO_GENERICA,ACCION AFIRMATIVA,RUTA_CONSTANCIA,PARTIDO
2,32,ZACATECAS,,,22,JUAN ALDAMA,,,REG_RP,PRI,3,MARICRUZ RIOS PEREZ,2,,,PRI
2,32,ZACATECAS,,,22,JUAN ALDAMA,,,REG_RP,PT,1,ROSAURA FABELA PEREZ,2,,,PT
2,32,ZACATECAS,,,23,JUCHIPILA,,,PRES_MUN,PT,1,JOSE MARIA CASTRO FELIX,1,,,PT
2,32,ZACATECAS,,,23,JUCHIPILA,,,SIND,PT,1,SUSANA SALAZAR ALVARADO,2,,,PT
2,32,ZACATECAS,,,23,JUCHIPILA,,,REG,PT,1,SERGIO FAVELA ESPINO,1,,,PT
2,32,ZACATECAS,,,23,JUCHIPILA,,,REG,PT,2,CINDIA RIVERA RODRIGUEZ,2,,,PT
2,32,ZACATECAS,,,23,JUCHIPILA,,,REG,PT,3,CARLOS DANIEL QUIRARTE GONZALEZ,1,CANDIDATURAS DE PERSONAS  JOVENES,,PT
2,32,ZACATECAS,,,23,JUCHIPILA,,,REG,PT,4,ANABEL ENRIQUEZ SERRANO,2,CANDIDATURAS DE PERSONAS  JOVENES,,PT
2,32,ZACATECAS,,,23,JUCHIPILA,,,REG,PT,5,JOSE HARO HARO,1,,,PT
2,32,ZACATECAS,,,23,JUCHIPILA,,,REG,PT,6,VIVIANA MIMITZIN ORTEGA ROMERO,2,,,PT
2,32,ZACATECAS,,,23,JUCHIPILA,,,REG_RP,PAN,1,MARIA CRUZ MEZA ROJAS,2,,,PAN
2,32,ZACATECAS,,,23,JUCHIPILA,,,REG_RP,PAN,2,GERARDO ESPARZA VELAZCO,1,,,PAN
2,32,ZACATECAS,,,23,JUCHIPILA,,,REG_RP,MORENA,1,DANIELA YAQUELINE BAÑUELOS COCOLAN,2,CANDIDATURAS DE PERSONAS  JOVENES,,MORENA
2,32,ZACATECAS,,,23,JUCHIPILA,,,REG_RP,PRI,1,VALERIA MELINDA CHAVEZ LUNA,2,,,PRI
2,32,ZACATECAS,,,24,LORETO,,,PRES_MUN,MORENA,1,ANTONIO TISCAREÑO DE ANDA,1,,,MORENA
2,32,ZACATECAS,,,24,LORETO,,,SIND,MORENA,1,ERIKA MAYELA ORENDAY GARCIA,2,,,MORENA
2,32,ZACATECAS,,,24,LORETO,,,REG,MORENA,1,DELFINO REYES MONREAL,1,,,MORENA
2,32,ZACATECAS,,,24,LORETO,,,REG,MORENA,2,MARIA FERNANDA PERALTA DELGADO,2,CANDIDATURAS DE PERSONAS  JOVENES,,MORENA
2,32,ZACATECAS,,,24,LORETO,,,REG,MORENA,3,ANDRIK DAVILA GUERRERO,1,,,MORENA
2,32,ZACATECAS,,,24,LORETO,,,REG,MORENA,4,ANA ISABEL RANGEL LUCIO,2,,,MORENA
2,32,ZACATECAS,,,24,LORETO,,,REG,MORENA,5,ERIK SINAI CALVILLO CAMARILLO,1,,,MORENA
2,32,ZACATECAS,,,24,LORETO,,,REG,MORENA,6,DULCE MARIA REYES LUEVANO,2,CANDIDATURAS DE PERSONAS  JOVENES,,MORENA
2,32,ZACATECAS,,,24,LORETO,,,REG,MORENA,7,OSCAR LIZANDRO GUEL ARAUJO,1,,,MORENA
2,32,ZACATECAS,,,24,LORETO,,,REG_RP,MC,1,CLARA ESTRELLA MEZA AGUILAR,2,,,MC
2,32,ZACATECAS,,,24,LORETO,,,REG_RP,MC,2,SERGIO HURTADO ESQUIVEL,1,,,MC
2,32,ZACATECAS,,,24,LORETO,,,REG_RP,RPZ,1,CANDIDA MARCELA RODRIGUEZ CHAVEZ,2,,,RPZ
2,32,ZACATECAS,,,24,LORETO,,,REG_RP,PRI,1,ARIADNA DELGADILLO GARCIA,2,,,PRI
2,32,ZACATECAS,,,24,LORETO,,,REG_RP,PVEM,1,NORMA ISABEL MONREAL MARTINEZ,2,,,PVEM
2,32,ZACATECAS,,,25,LUIS MOYA,,,PRES_MUN,PVEM_MORENA,1,JOSE GUADALUPE SILVA MEDINA,1,,,PVEM
2,32,ZACATECAS,,,25,LUIS MOYA,,,SIND,PVEM_MORENA,1,BRENDA PAOLA LUEVANO BASURTO,2,,,PVEM
2,32,ZACATECAS,,,25,LUIS MOYA,,,REG,PVEM_MORENA,1,JORGE LUIS LOPEZ PALAFOX,1,,,PVEM
2,32,ZACATECAS,,,25,LUIS MOYA,,,REG,PVEM_MORENA,2,MARIA NELY RODRIGUEZ MUÑOZ,2,CANDIDATURAS DE PERSONAS  JOVENES,,PVEM
2,32,ZACATECAS,,,25,LUIS MOYA,,,REG,PVEM_MORENA,3,JOSE MARTIN VASQUEZ GUERRERO,1,CANDIDATURAS DE PERSONAS  JOVENES,,PVEM
2,32,ZACATECAS,,,25,LUIS MOYA,,,REG,PVEM_MORENA,4,MARIBEL MURILLO HERNANDEZ,2,,,PVEM
2,32,ZACATECAS,,,25,LUIS MOYA,,,REG,PVEM_MORENA,5,GABRIEL LOPEZ ESTRADA,1,,,PVEM
2,32,ZACATECAS,,,25,LUIS MOYA,,,REG,PVEM_MORENA,6,ALEJANDRA VIANEY ALBA MARTINEZ,2,,,PVEM
2,32,ZACATECAS,,,25,LUIS MOYA,,,REG_RP,FMZ,1,VIVIANA MONTAÑEZ JAIME,2,CANDIDATURAS DE PERSONAS  JOVENES,,FMZ
2,32,ZACATECAS,,,25,LUIS MOYA,,,REG_RP,MC,3,NAJAIRA MARTINEZ PEREZ,2,,,MC
2,32,ZACATECAS,,,25,LUIS MOYA,,,REG_RP,PAN,2,MIGUEL ANGEL NAVARRO RODRIGUEZ,1,,,PAN
2,32,ZACATECAS,,,25,LUIS MOYA,,,REG_RP,PT,2,JOEL LUEVANO ORTIZ,1,,,PT
2,32,ZACATECAS,,,26,MAZAPIL,,,PRES_MUN,NAZ,1,MARIO MACIAS ZUÑIGA,1,,,NAZ
2,32,ZACATECAS,,,26,MAZAPIL,,,SIND,NAZ,1,SILVIA RUIZ LARA,2,,,NAZ
2,32,ZACATECAS,,,26,MAZAPIL,,,REG,NAZ,1,ANDRES RODRIGUEZ RIVAS,1,,,NAZ
2,32,ZACATECAS,,,26,MAZAPIL,,,REG,NAZ,2,GUADALUPE RIVERA ALVARADO,2,,,NAZ
2,32,ZACATECAS,,,26,MAZAPIL,,,REG,NAZ,3,JOSE USIEL GARCIA OLMOS,1,,,NAZ
2,32,ZACATECAS,,,26,MAZAPIL,,,REG,NAZ,4,VELIA PATRICIA CASTILLO BALDERAS,2,CANDIDATURAS DE PERSONAS  JOVENES,,NAZ
2,32,ZACATECAS,,,26,MAZAPIL,,,REG,NAZ,5,MARIO OSVALDO AGUILAR PINEDO,1,CANDIDATURAS DE PERSONAS  JOVENES,,NAZ
2,32,ZACATECAS,,,26,MAZAPIL,,,REG,NAZ,6,ROSA MARIA REYES ALEMAN,2,,,NAZ
2,32,ZACATECAS,,,26,MAZAPIL,,,REG_RP,PVEM,1,HILDA MARGARITA ESCOBEDO SANCHEZ,2,,,PVEM
2,32,ZACATECAS,,,26,MAZAPIL,,,REG_RP,PVEM,2,LUIS ENRIQUE HERRERA MORQUECHO,1,,,PVEM
2,32,ZACATECAS,,,26,MAZAPIL,,,REG_RP,MORENA,1,ESMERALDA MANCILLAS MEDINA,2,,,MORENA
2,32,ZACATECAS,,,26,MAZAPIL,,,REG_RP,MORENA,2,LUIS ANGEL VALDEZ GARCIA,1,CANDIDATURAS DE PERSONAS  JOVENES,,MORENA
2,32,ZACATECAS,,,27,MELCHOR OCAMPO,,,PRES_MUN,NAZ,1,RODOLFO CISNEROS GALLEGOS,1,,,NAZ
2,32,ZACATECAS,,,27,MELCHOR OCAMPO,,,SIND,NAZ,1,ISABEL MARGARITA MARTINEZ CARDONA,2,,,NAZ
2,32,ZACATECAS,,,27,MELCHOR OCAMPO,,,REG,NAZ,1,EDUARDO MARGARITO TREJO NAVA,1,CANDIDATURAS DE PERSONAS  JOVENES,,NAZ
2,32,ZACATECAS,,,27,MELCHOR OCAMPO,,,REG,NAZ,2,MARICELA ESPINOZA JAIME,2,,,NAZ
2,32,ZACATECAS,,,27,MELCHOR OCAMPO,,,REG,NAZ,3,TELESFORO RAMIREZ AREVALO,1,,,NAZ
2,32,ZACATECAS,,,27,MELCHOR OCAMPO,,,REG,NAZ,4,AMANDA ABIGAIL RAMIREZ MOTA,2,CANDIDATURAS DE PERSONAS  JOVENES,,NAZ
2,32,ZACATECAS,,,27,MELCHOR OCAMPO,,,REG_RP,MC,1,PAULINA YOATZIN MACIAS VALENCIANA,2,CANDIDATURAS DE PERSONAS  JOVENES,,PRD
2,32,ZACATECAS,,,27,MELCHOR OCAMPO,,,REG_RP,MC,2,PEDRO DE JESUS CARDONA CRUZ,1,,,PRD
2,32,ZACATECAS,,,28,MEZQUITAL DEL ORO,,,PRES_MUN,MORENA,1,MONICA RODARTE DAVILA,2,,,MORENA
2,32,ZACATECAS,,,28,MEZQUITAL DEL ORO,,,SIND,MORENA,1,GERARDO RODRIGUEZ MORENO,1,,,MORENA
2,32,ZACATECAS,,,28,MEZQUITAL DEL ORO,,,REG,MORENA,1,EVELYN CASTRO LEON,2,CANDIDATURAS DE PERSONAS  JOVENES,,MORENA
2,32,ZACATECAS,,,28,MEZQUITAL DEL ORO,,,REG,MORENA,2,JUAN MANUEL TADEO PADILLA,1,,,MORENA
2,32,ZACATECAS,,,28,MEZQUITAL DEL ORO,,,REG,MORENA,3,ROSALBA LUNA PEREZ,2,,,MORENA
2,32,ZACATECAS,,,28,MEZQUITAL DEL ORO,,,REG,MORENA,4,KEVIN YAIR LAMAS NUÑEZ,1,CANDIDATURAS DE PERSONAS  JOVENES,,MORENA
2,32,ZACATECAS,,,28,MEZQUITAL DEL ORO,,,REG_RP,PRD,1,LESLY ITZEL COMPARAN VELARDE,2,CANDIDATURAS DE PERSONAS  JOVENES,,PRD
2,32,ZACATECAS,,,28,MEZQUITAL DEL ORO,,,REG_RP,PRD,2,VICENTE ZARATE VELARDE,1,,,PRD
2,32,ZACATECAS,,,28,MEZQUITAL DEL ORO,,,REG_RP,PVEM,1,MARIA GUADALUPE HAROS FLORES,2,CANDIDATURAS DE PERSONAS  JOVENES,,PVEM
2,32,ZACATECAS,,,29,MIGUEL AUZA,,,PRES_MUN,PVEM_MORENA,1,ARTURO CALDERON RUEDA,1,,,MORENA
2,32,ZACATECAS,,,29,MIGUEL AUZA,,,SIND,PVEM_MORENA,1,MIREYA DEL ROSARIO GIACOMAN GARCIA,2,,,MORENA
2,32,ZACATECAS,,,29,MIGUEL AUZA,,,REG,PVEM_MORENA,1,LUIS ENRIQUE ALBA FLORES,1,,,MORENA
2,32,ZACATECAS,,,29,MIGUEL AUZA,,,REG,PVEM_MORENA,2,SOFIA GUADALUPE DIAZ PEREZ,2,CANDIDATURAS DE PERSONAS  JOVENES,,MORENA
2,32,ZACATECAS,,,29,MIGUEL AUZA,,,REG,PVEM_MORENA,3,PEDRO GIBRAN MARTINEZ SANCHEZ,1,,,MORENA
2,32,ZACATECAS,,,29,MIGUEL AUZA,,,REG,PVEM_MORENA,4,NOHELIA CHAVEZ ARELLANO,2,CANDIDATURAS DE PERSONAS  JOVENES,,MORENA
2,32,ZACATECAS,,,29,MIGUEL AUZA,,,REG,PVEM_MORENA,5,MIGUEL ANGEL NORMAN CASTAÑEDA,1,,,MORENA
2,32,ZACATECAS,,,29,MIGUEL AUZA,,,REG,PVEM_MORENA,6,ROSA MARIA SANCHEZ MUÑOZ,2,,,MORENA
2,32,ZACATECAS,,,29,MIGUEL AUZA,,,REG_RP,MC,1,MARIA GRISELDA FLORES DELGADO,2,,,MC
2,32,ZACATECAS,,,29,MIGUEL AUZA,,,REG_RP,MC,2,GENARO DE LA CRUZ ROBLES,1,,,MC
2,32,ZACATECAS,,,29,MIGUEL AUZA,,,REG_RP,PT,1,ELDA AGUSTINA PARRA RODRIGUEZ,2,,,PT
2,32,ZACATECAS,,,29,MIGUEL AUZA,,,REG_RP,FMZ,2,JESUS EFRAIN LERMA CARRERA,1,CANDIDATURAS DE PERSONAS  JOVENES,,FMZ
2,32,ZACATECAS,,,30,MOMAX,,,PRES_MUN,PAN,1,SALVADOR CABRAL MOTA,1,,,PAN
2,32,ZACATECAS,,,30,MOMAX,,,SIND,PAN,1,ESMERALDA LIZBETH FLORES ALVAREZ,2,CANDIDATURAS DE PERSONAS  JOVENES,,PAN
2,32,ZACATECAS,,,30,MOMAX,,,REG,PAN,1,JORGE LUIS RAMIREZ JARA,1,,,PAN
2,32,ZACATECAS,,,30,MOMAX,,,REG,PAN,2,JOVANA JULIETA GAETA LOPEZ,2,CANDIDATURAS DE PERSONAS  JOVENES,,PAN
2,32,ZACATECAS,,,30,MOMAX,,,REG,PAN,3,JESUS MANUEL LUNA ESTRADA,1,CANDIDATURAS DE PERSONAS  JOVENES,,PAN
2,32,ZACATECAS,,,30,MOMAX,,,REG,PAN,4,ELVIRA LOZANO ESCOBEDO,2,,,PAN
2,32,ZACATECAS,,,30,MOMAX,,,REG_RP,MORENA,1,NORMA PATRICIA ORTIZ MEZA,2,CANDIDATURAS DE PERSONAS  JOVENES,,MORENA
2,32,ZACATECAS,,,30,MOMAX,,,REG_RP,MORENA,2,JOEL IGNACIO ZENDEJAS ARELLANO,1,,,MORENA
2,32,ZACATECAS,,,30,MOMAX,,,REG_RP,PVEM,1,SILVIA YESENIA ALVAREZ MAGALLANES,2,,,PVEM
2,32,ZACATECAS,,,31,MONTE ESCOBEDO,,,PRES_MUN,PAN_PRI_PRD,1,MANUEL ACOSTA GALVAN,1,,,PRI
2,32,ZACATECAS,,,31,MONTE ESCOBEDO,,,SIND,PAN_PRI_PRD,1,MARIA DEL CARMEN SANCHEZ CARLOS,2,,,PRI
2,32,ZACATECAS,,,31,MONTE ESCOBEDO,,,REG,PAN_PRI_PRD,1,OCTAVIO SIGALA GUTIERREZ,1,,,PRI
2,32,ZACATECAS,,,31,MONTE ESCOBEDO,,,REG,PAN_PRI_PRD,2,ADRIANA LISBET SOLIS SOTO,2,CANDIDATURAS DE PERSONAS  JOVENES,,PRI
2,32,ZACATECAS,,,31,MONTE ESCOBEDO,,,REG,PAN_PRI_PRD,3,ERNESTO MUÑOZ BOCARDO,1,CANDIDATURAS DE PERSONAS  JOVENES,,PAN
2,32,ZACATECAS,,,31,MONTE ESCOBEDO,,,REG,PAN_PRI_PRD,4,MARIA CONCEPCION MUÑOZ ROBLES,2,,,PAN
2,32,ZACATECAS,,,31,MONTE ESCOBEDO,,,REG_RP,MORENA,1,TERESA GUADALUPE CARLOS QUIROZ,2,CANDIDATURAS DE PERSONAS  JOVENES,,MORENA
2,32,ZACATECAS,,,31,MONTE ESCOBEDO,,,REG_RP,MORENA,2,IGNACIO DANIEL SANCHEZ DE LA TORRE,1,CANDIDATURAS DE PERSONAS  JOVENES,,MORENA
2,32,ZACATECAS,,,31,MONTE ESCOBEDO,,,REG_RP,MC,1,VERONICA DE LA TORRE MARQUEZ,2,,,MC
2,32,ZACATECAS,,,32,MORELOS,,,PRES_MUN,PVEM_MORENA,1,SERGIO VAZQUEZ LUJAN,1,,,MORENA
2,32,ZACATECAS,,,32,MORELOS,,,SIND,PVEM_MORENA,1,FATIMA IYALY DELGADO MARTINEZ,2,,,MORENA
2,32,ZACATECAS,,,32,MORELOS,,,REG,PVEM_MORENA,1,JOSE CUPERTINO DELGADO ROSALES,1,,,MORENA
2,32,ZACATECAS,,,32,MORELOS,,,REG,PVEM_MORENA,2,MARIA NIEVES SIFUENTES SANCHEZ,2,,,MORENA
2,32,ZACATECAS,,,32,MORELOS,,,REG,PVEM_MORENA,3,ALVARO GARCIA FERNANDEZ,1,CANDIDATURAS DE PERSONAS  JOVENES,,MORENA
2,32,ZACATECAS,,,32,MORELOS,,,REG,PVEM_MORENA,4,MIRIAM BARRIOS HURTADO,2,,,MORENA
2,32,ZACATECAS,,,32,MORELOS,,,REG,PVEM_MORENA,5,OSWALDO ACUÑA VEYNA,1,,,MORENA
2,32,ZACATECAS,,,32,MORELOS,,,REG,PVEM_MORENA,6,BRENDA YARALIXZA NAVARRO MEDELLIN,2,CANDIDATURAS DE PERSONAS  JOVENES,,MORENA
2,32,ZACATECAS,,,32,MORELOS,,,REG_RP,FMZ,1,FAVIOLA AIBETH PADILLA GUTIERREZ,2,,,FMZ
2,32,ZACATECAS,,,32,MORELOS,,,REG_RP,MC,1,LAURA ITZEL MARQUEZ ARELLANO,2,,,MC
2,32,ZACATECAS,,,32,MORELOS,,,REG_RP,NAZ,2,EDUARDO DUQUE TORRES,1,,,NAZ
2,32,ZACATECAS,,,32,MORELOS,,,REG_RP,PRI,1,FATIMA DEL ROCIO CAMPA REYES,2,,,PRI
2,32,ZACATECAS,,,33,MOYAHUA DE ESTRADA,,,PRES_MUN,PVEM_MORENA,1,NORMA CASTAÑEDA ROMERO,1,,,MORENA
2,32,ZACATECAS,,,33,MOYAHUA DE ESTRADA,,,SIND,PVEM_MORENA,1,HECTOR SORIA TELLO,2,,,MORENA
2,32,ZACATECAS,,,33,MOYAHUA DE ESTRADA,,,REG,PVEM_MORENA,1,LIZBETH RUIZ MERCADO,1,CANDIDATURAS DE PERSONAS  JOVENES,,MORENA
2,32,ZACATECAS,,,33,MOYAHUA DE ESTRADA,,,REG,PVEM_MORENA,2,MANUEL REYNOSO QUINTERO,2,,,MORENA
2,32,ZACATECAS,,,33,MOYAHUA DE ESTRADA,,,REG,PVEM_MORENA,3,ANA MARIA FELIX ESPARZA,1,,,MORENA
2,32,ZACATECAS,,,33,MOYAHUA DE ESTRADA,,,REG,PVEM_MORENA,4,ERIK SANTIAGO BECERRA PEREZ,2,CANDIDATURAS DE PERSONAS  JOVENES,,MORENA
2,32,ZACATECAS,,,33,MOYAHUA DE ESTRADA,,,REG_RP,PRI,1,ANA BELLA HERRERA GONZALEZ,2,,,PRI
2,32,ZACATECAS,,,33,MOYAHUA DE ESTRADA,,,REG_RP,MC,1,ALEJANDRA SANDOVAL GARCIA,2,CANDIDATURAS DE PERSONAS  JOVENES,,MC
2,32,ZACATECAS,,,33,MOYAHUA DE ESTRADA,,,REG_RP,FMZ,2,SANTIAGO ARELLANO PEREZ,1,CANDIDATURAS DE PERSONAS  JOVENES,,FMZ
2,32,ZACATECAS,,,34,NOCHISTLAN DE MEJIA,,,PRES_MUN,PVEM_MORENA,1,JOSE MANUEL JIMENEZ FUENTES,1,,,MORENA
2,32,ZACATECAS,,,34,NOCHISTLAN DE MEJIA,,,SIND,PVEM_MORENA,1,ALEJANDRA RODRIGUEZ GONZALEZ,2,,,MORENA
2,32,ZACATECAS,,,34,NOCHISTLAN DE MEJIA,,,REG,PVEM_MORENA,1,RAUDEL DURAN TORRES,1,,,MORENA
2,32,ZACATECAS,,,34,NOCHISTLAN DE MEJIA,,,REG,PVEM_MORENA,2,ALEJANDRA MEJIA GARCIA,2,,,MORENA
2,32,ZACATECAS,,,34,NOCHISTLAN DE MEJIA,,,REG,PVEM_MORENA,4,ALEJANDRA NARVAEZ MEDINA,1,,,MORENA
2,32,ZACATECAS,,,34,NOCHISTLAN DE MEJIA,,,REG,PVEM_MORENA,5,JAIME OLMOS MARTINEZ,2,,,MORENA
2,32,ZACATECAS,,,34,NOCHISTLAN DE MEJIA,,,REG,PVEM_MORENA,6,ITZEL GONZALEZ YAÑEZ,1,CANDIDATURAS DE PERSONAS  JOVENES,,MORENA
2,32,ZACATECAS,,,34,NOCHISTLAN DE MEJIA,,,REG_RP,MC,2,ELISEO PEREZ DURAN,2,,,MC
2,32,ZACATECAS,,,34,NOCHISTLAN DE MEJIA,,,REG_RP,MC,4,TRISTAN CHRISTHER RAMIREZ GONZALEZ,2,CANDIDATURAS DE PERSONAS  JOVENES,,MC
2,32,ZACATECAS,,,34,NOCHISTLAN DE MEJIA,,,REG_RP,MC,1,MIROSLAVA ORNELAS RAMIREZ,2,,,MC
2,32,ZACATECAS,,,34,NOCHISTLAN DE MEJIA,,,REG_RP,PAN,1,REYNA VILLALOBOS PEREZ,2,,,PAN
2,32,ZACATECAS,,,35,NORIA DE ANGELES,,,PRES_MUN,MORENA,1,GABRIELA CUEVAS SILVA,2,,,MORENA
2,32,ZACATECAS,,,35,NORIA DE ANGELES,,,SIND,MORENA,1,JORGE CONTRERAS SERAFIN,1,,,MORENA
2,32,ZACATECAS,,,35,NORIA DE ANGELES,,,REG,MORENA,1,SONIA SOTO PRECIADO,2,,,MORENA
2,32,ZACATECAS,,,35,NORIA DE ANGELES,,,REG,MORENA,2,MANUEL CHAVARRIA CARDENAS,1,,,MORENA
2,32,ZACATECAS,,,35,NORIA DE ANGELES,,,REG,MORENA,3,EMILENNE CASTAÑEDA PARGA,2,CANDIDATURAS DE PERSONAS  JOVENES,,MORENA
2,32,ZACATECAS,,,35,NORIA DE ANGELES,,,REG,MORENA,4,RIGOBERTO LOPEZ MONTOYA,1,CANDIDATURAS DE PERSONAS  JOVENES,,MORENA
2,32,ZACATECAS,,,35,NORIA DE ANGELES,,,REG,MORENA,5,MA. TERESA CORTEZ ALONSO,2,,,MORENA
2,32,ZACATECAS,,,35,NORIA DE ANGELES,,,REG,MORENA,6,JUAN VALADEZ HERRADA,1,,,MORENA
2,32,ZACATECAS,,,35,NORIA DE ANGELES,,,REG_RP,PRI,1,MARISELA FRAUSTO MACIAS,2,,,PRI
2,32,ZACATECAS,,,35,NORIA DE ANGELES,,,REG_RP,PRI,2,MANUEL BECERRA DE LA ROSA,1,,,PRI
2,32,ZACATECAS,,,35,NORIA DE ANGELES,,,REG_RP,PRI,4,GUADALUPE SOTO RIOS,2,CANDIDATURAS DE PERSONAS  JOVENES,,PRI
2,32,ZACATECAS,,,35,NORIA DE ANGELES,,,REG_RP,RPZ,1,ADRIANA DIAZ DAVILA,2,,,RPZ
2,32,ZACATECAS,,,36,OJOCALIENTE,,,PRES_MUN,PRD,1,JUAN MANUEL ZAMBRANO JIMENEZ,1,,,PRD
2,32,ZACATECAS,,,36,OJOCALIENTE,,,SIND,PRD,1,OLIVIA ACOSTA REZA,2,,,PRD
2,32,ZACATECAS,,,36,OJOCALIENTE,,,REG,PRD,1,ALAN HUMBERTO MARTINEZ GAYTAN,1,CANDIDATURAS DE PERSONAS  JOVENES,,PRD
2,32,ZACATECAS,,,36,OJOCALIENTE,,,REG,PRD,2,KARINA JACKELINE FLORES GALLEGOS,2,CANDIDATURAS DE PERSONAS  JOVENES,,PRD
2,32,ZACATECAS,,,36,OJOCALIENTE,,,REG,PRD,3,SERGIO MERCADO MONTELLANO,1,CANDIDATURA DE LA DIVERSIDAD SEXUAL,,PRD
2,32,ZACATECAS,,,36,OJOCALIENTE,,,REG,PRD,4,MONICA GARCIA BARBOZA,2,,,PRD
2,32,ZACATECAS,,,36,OJOCALIENTE,,,REG,PRD,5,ALVARO MEDINA GAYTAN,1,,,PRD
2,32,ZACATECAS,,,36,OJOCALIENTE,,,REG,PRD,6,ARACELI RUIZ ROBLES,2,,,PRD
2,32,ZACATECAS,,,36,OJOCALIENTE,,,REG,PRD,7,RAMIRO MEDINA DE LUNA,1,,,PRD
2,32,ZACATECAS,,,36,OJOCALIENTE,,,REG_RP,MORENA,1,MARILU MAGDALY ZAMBRANO GUTIERREZ,2,,,MORENA
2,32,ZACATECAS,,,36,OJOCALIENTE,,,REG_RP,MORENA,2,FERNANDO DE JESUS RAMIREZ GALLEGOS,1,,,MORENA
2,32,ZACATECAS,,,36,OJOCALIENTE,,,REG_RP,MORENA,3,JUAN FRANCISCO MEDINA HERRERA,1,,,MORENA
2,32,ZACATECAS,,,36,OJOCALIENTE,,,REG_RP,PRI,1,GLENDY DE LA ROSA VAZQUEZ,2,,,PRI
2,32,ZACATECAS,,,36,OJOCALIENTE,,,REG_RP,RPZ,2,MA. DE JESUS HERNANDEZ ALEMAN,2,,,RPZ
2,32,ZACATECAS,,,37,PANUCO,,,PRES_MUN,PRI,1,JUAN RODRIGUEZ VALDEZ,1,,,PRI
2,32,ZACATECAS,,,37,PANUCO,,,SIND,PRI,1,PERLA YARITZA VAZQUEZ GUZMAN,2,CANDIDATURAS DE PERSONAS  JOVENES,,PRI
2,32,ZACATECAS,,,37,PANUCO,,,REG,PRI,1,EDGAR GIRON FIGUEROA,1,,,PRI
2,32,ZACATECAS,,,37,PANUCO,,,REG,PRI,2,MARICRUZ RAMIREZ PALACIOS,2,CANDIDATURAS DE DISCAPACIDAD,,PRI
2,32,ZACATECAS,,,37,PANUCO,,,REG,PRI,3,GONZALO REYES DE LA ROSA,1,,,PRI
2,32,ZACATECAS,,,37,PANUCO,,,REG,PRI,4,SILVIA GONZALEZ SANCHEZ,2,,,PRI
2,32,ZACATECAS,,,37,PANUCO,,,REG,PRI,5,JOSE ANTONIO CASTILLO CARDONA,1,,,PRI
2,32,ZACATECAS,,,37,PANUCO,,,REG,PRI,6,MARGARITA VALADES PUENTE,2,CANDIDATURAS DE PERSONAS  JOVENES,,PRI
2,32,ZACATECAS,,,37,PANUCO,,,REG_RP,MC,1,NALLELY MELINA ROBLES SOSA,2,,,MC
2,32,ZACATECAS,,,37,PANUCO,,,REG_RP,MC,2,J. MARCOS ORTIZ AGUILAR,1,,,MC
2,32,ZACATECAS,,,37,PANUCO,,,REG_RP,MORENA,1,YARETH MADARI CASTILLO SOLIS,2,,,MORENA
2,32,ZACATECAS,,,37,PANUCO,,,REG_RP,NAZ,1,YESENIA DE LIRA CARRILLO,2,,,NAZ
2,32,ZACATECAS,,,38,PINOS,,,PRES_MUN,MORENA,1,ARMANDO CONTRERAS MATA,1,,,MORENA
2,32,ZACATECAS,,,38,PINOS,,,SIND,MORENA,1,MARGARITA CARDONA ROQUE,2,,,MORENA
2,32,ZACATECAS,,,38,PINOS,,,REG,MORENA,1,JOSE DE JESUS JUAREZ JIMENEZ,1,,,MORENA
2,32,ZACATECAS,,,38,PINOS,,,REG,MORENA,2,ALTAGRACIA GUARDADO CONTRERAS,2,,,MORENA
2,32,ZACATECAS,,,38,PINOS,,,REG,MORENA,3,J FELIX HERNANDEZ CAMACHO,1,,,MORENA
2,32,ZACATECAS,,,38,PINOS,,,REG,MORENA,4,MILAGROS PAREDES PALOMO,2,CANDIDATURAS DE PERSONAS  JOVENES,,MORENA
2,32,ZACATECAS,,,38,PINOS,,,REG,MORENA,5,MIGUEL ANGEL ALONSO GOMEZ,1,,,MORENA
2,32,ZACATECAS,,,38,PINOS,,,REG,MORENA,6,ANGELINA DAVILA CASTAÑEDA,2,,,MORENA
2,32,ZACATECAS,,,38,PINOS,,,REG,MORENA,7,MIGUEL ANGEL HERNANDEZ PEREZ,1,,,MORENA
2,32,ZACATECAS,,,38,PINOS,,,REG,MORENA,8,FATIMA SELENE GALLEGOS MARTINEZ,2,CANDIDATURAS DE PERSONAS  JOVENES,,MORENA
2,32,ZACATECAS,,,38,PINOS,,,REG_RP,PRI,1,SUSANA PEREZ CARDONA,2,,,PRI
2,32,ZACATECAS,,,38,PINOS,,,REG_RP,PRI,3,NANCY CONTRERAS RANGEL,2,CANDIDATURAS DE PERSONAS  JOVENES,,PRI
2,32,ZACATECAS,,,38,PINOS,,,REG_RP,PRI,5,VERONICA REYES REYNA,2,,,PRI
2,32,ZACATECAS,,,38,PINOS,,,REG_RP,PRI,2,JOSE MANUEL MOLINA MUÑOZ,1,,,PRI
2,32,ZACATECAS,,,38,PINOS,,,REG_RP,PRI,4,ALVARO GARCIA BETANCOURT,1,,,PRI
2,32,ZACATECAS,,,38,PINOS,,,REG_RP,PRI,6,IVAN GERARDO ALONSO JIMENEZ,1,CANDIDATURAS DE PERSONAS  JOVENES,,PRI
2,32,ZACATECAS,,,39,RIO GRANDE,,,PRES_MUN,PRI,1,MARIO CORDOVA LONGORIA,1,,,PRI
2,32,ZACATECAS,,,39,RIO GRANDE,,,SIND,PRI,1,MA GABRIELA ALVARADO VAQUERA,2,,,PRI
2,32,ZACATECAS,,,39,RIO GRANDE,,,REG,PRI,1,HIGINIO AYALA VAZQUEZ,1,,,PRI
2,32,ZACATECAS,,,39,RIO GRANDE,,,REG,PRI,2,CARMEN LILIANA PORTILLO SAUCEDO,2,,,PRI
2,32,ZACATECAS,,,39,RIO GRANDE,,,REG,PRI,3,ERNESTO SANCHEZ ALMANZA,1,,,PRI
2,32,ZACATECAS,,,39,RIO GRANDE,,,REG,PRI,4,MIRIAM ARLETT LUNA NAVARRO,2,CANDIDATURAS DE PERSONAS  JOVENES,,PRI
2,32,ZACATECAS,,,39,RIO GRANDE,,,REG,PRI,5,ABEL PERALES MIRANDA,1,,,PRI
2,32,ZACATECAS,,,39,RIO GRANDE,,,REG,PRI,6,KARELY SANDOVAL ARANDA,2,CANDIDATURAS DE PERSONAS  JOVENES,,PRI
2,32,ZACATECAS,,,39,RIO GRANDE,,,REG,PRI,7,MA. LUISA RODRIGUEZ BAÑUELOS,2,,,PRI
2,32,ZACATECAS,,,39,RIO GRANDE,,,REG,PRI,8,LESLY JANETH RAMIREZ CANALES,2,CANDIDATURAS DE PERSONAS  JOVENES,,PRI
2,32,ZACATECAS,,,39,RIO GRANDE,,,REG_RP,MORENA,2,MIGUEL HERNANDEZ BADILLO,1,,,MORENA
2,32,ZACATECAS,,,39,RIO GRANDE,,,REG_RP,MORENA,4,ELDER JAVIER DE LUCIO CASTRO,1,CANDIDATURAS DE PERSONAS  JOVENES,,MORENA
2,32,ZACATECAS,,,39,RIO GRANDE,,,REG_RP,MORENA,1,METZLY MARYEL GONZALEZ MORENO,2,CANDIDATURAS DE PERSONAS  JOVENES,,MORENA
2,32,ZACATECAS,,,39,RIO GRANDE,,,REG_RP,PT,2,JULIO CESAR RAMIREZ LOPEZ,1,,,PT
2,32,ZACATECAS,,,39,RIO GRANDE,,,REG_RP,PT,1,KAREN MARIAN RAMIREZ LONGORIA,2,CANDIDATURAS DE PERSONAS  JOVENES,,PT
2,32,ZACATECAS,,,39,RIO GRANDE,,,REG_RP,PRD,2,MANUEL ESPARZA VAQUERA,1,,,PRD
2,32,ZACATECAS,,,40,SAIN ALTO,,,PRES_MUN,PRI,1,IGNACIO GOMEZ ALMARAZ,1,,,PRI
2,32,ZACATECAS,,,40,SAIN ALTO,,,SIND,PRI,1,MONICA LUCIA CASTILLO NATERA,2,,,PRI
2,32,ZACATECAS,,,40,SAIN ALTO,,,REG,PRI,1,AVELINO CORREA CASTRO,1,,,PRI
2,32,ZACATECAS,,,40,SAIN ALTO,,,REG,PRI,2,SANDRA FERNANDEZ ZAMORA,2,,,PRI
2,32,ZACATECAS,,,40,SAIN ALTO,,,REG,PRI,3,FELIPE CERNA LOPEZ,1,,,PRI
2,32,ZACATECAS,,,40,SAIN ALTO,,,REG,PRI,4,DANNIA BERENICE RODRIGUEZ SALAS,2,CANDIDATURAS DE PERSONAS  JOVENES,,PRI
2,32,ZACATECAS,,,40,SAIN ALTO,,,REG,PRI,5,ALBERTO VARELA FERNANDEZ,1,,,PRI
2,32,ZACATECAS,,,40,SAIN ALTO,,,REG,PRI,6,CARMEN GUADALUPE LONGORIA ORDAZ,2,CANDIDATURAS DE PERSONAS  JOVENES,,PRI
2,32,ZACATECAS,,,40,SAIN ALTO,,,REG_RP,MORENA,1,ANA KARINA PORTILLO CANALES,2,,,MORENA
2,32,ZACATECAS,,,40,SAIN ALTO,,,REG_RP,MORENA,1,JOSE EDUARDO LIRA SANTOS,1,CANDIDATURAS DE PERSONAS  JOVENES,,MORENA
2,32,ZACATECAS,,,40,SAIN ALTO,,,REG_RP,PRD,1,GALILEA LIBERTAD CASAS DE LA FUENTE,2,CANDIDATURAS DE PERSONAS  JOVENES,,PRD
2,32,ZACATECAS,,,40,SAIN ALTO,,,REG_RP,PVEM,2,JUAN OZIEL VACIO CASTRO,1,CANDIDATURAS DE PERSONAS  JOVENES,,PVEM
2,32,ZACATECAS,,,41,EL SALVADOR,,,PRES_MUN,PVEM,1,MIGUEL CORONADO GAMEZ,1,,,PVEM
2,32,ZACATECAS,,,41,EL SALVADOR,,,SIND,PVEM,1,YADIRA MILDRET URESTI TELLO,2,,,PVEM
2,32,ZACATECAS,,,41,EL SALVADOR,,,REG,PVEM,1,LUIS ANGEL MEDINA TREJO,1,CANDIDATURAS DE PERSONAS  JOVENES,,PVEM
2,32,ZACATECAS,,,41,EL SALVADOR,,,REG,PVEM,2,YADIRA CARIAGA ALVARADO,2,,,PVEM
2,32,ZACATECAS,,,41,EL SALVADOR,,,REG,PVEM,3,CARLOS EDUARDO DE JESUS LOPEZ,1,CANDIDATURAS DE PERSONAS  JOVENES,,PVEM
2,32,ZACATECAS,,,41,EL SALVADOR,,,REG,PVEM,4,SILVIA REYNOSA VERASTEGUI,2,CANDIDATURAS DE PERSONAS  JOVENES,,PVEM
2,32,ZACATECAS,,,41,EL SALVADOR,,,REG_RP,MORENA,1,LAURA MALDONADO AMADOR,2,,,MORENA
2,32,ZACATECAS,,,41,EL SALVADOR,,,REG_RP,MORENA,3,MAGALY ESTEFANIA HERNANDEZ RAMIREZ,2,CANDIDATURAS DE PERSONAS  JOVENES,,MORENA
2,32,ZACATECAS,,,41,EL SALVADOR,,,REG_RP,MORENA,2,IVAN TERESO CHAVEZ CASTILLO,1,,,MORENA
2,32,ZACATECAS,,,42,SOMBRERETE,,,PRES_MUN,PVEM_MORENA,1,J. SANTOS RAMIRO HINOJOZA AGUAYO,1,,,MORENA
2,32,ZACATECAS,,,42,SOMBRERETE,,,SIND,PVEM_MORENA,1,ALMA DELIA RIOS GARCIA,2,,,MORENA
2,32,ZACATECAS,,,42,SOMBRERETE,,,REG,PVEM_MORENA,1,HECTOR SERRANO ESCALANTE,1,,,MORENA
2,32,ZACATECAS,,,42,SOMBRERETE,,,REG,PVEM_MORENA,2,VALERIA SARAHI LOZANO GARAY,2,CANDIDATURAS DE PERSONAS  JOVENES,,MORENA
2,32,ZACATECAS,,,42,SOMBRERETE,,,REG,PVEM_MORENA,3,MANUEL VELAZQUEZ VALDEZ,1,,,MORENA
2,32,ZACATECAS,,,42,SOMBRERETE,,,REG,PVEM_MORENA,4,JESSIKA SANTOS CONTRERAS,2,,,MORENA
2,32,ZACATECAS,,,42,SOMBRERETE,,,REG,PVEM_MORENA,5,MANUEL SOLIS CASTILLO,1,,,MORENA
2,32,ZACATECAS,,,42,SOMBRERETE,,,REG,PVEM_MORENA,6,NEYRA STEPHANIE ANDRADE REYES,2,,,MORENA
2,32,ZACATECAS,,,42,SOMBRERETE,,,REG,PVEM_MORENA,7,JORGE LUIS JACQUEZ MERCADO,1,CANDIDATURAS DE PERSONAS  JOVENES,,MORENA
2,32,ZACATECAS,,,42,SOMBRERETE,,,REG,PVEM_MORENA,8,ZITA ISELA GARCIA MONREAL,2,,,MORENA
2,32,ZACATECAS,,,42,SOMBRERETE,,,REG_RP,PRI,1,IVETH CRISTINA LAZALDE LERMA,2,,,PRI
2,32,ZACATECAS,,,42,SOMBRERETE,,,REG_RP,PRI,3,JAZMIN CORONADO ESTUPIÑAN,2,CANDIDATURAS DE PERSONAS  JOVENES,,PRI
2,32,ZACATECAS,,,42,SOMBRERETE,,,REG_RP,PRI,2,JORGE ALBERTO SEGOVIA BAÑALES,1,,,PRI
2,32,ZACATECAS,,,42,SOMBRERETE,,,REG_RP,PRI,4,ADRIAN CUEVAS MADRID,1,,,PRI
2,32,ZACATECAS,,,42,SOMBRERETE,,,REG_RP,PAN,1,MAYRA ALEJANDRA OLVERA FRAIRE,2,,,PAN
2,32,ZACATECAS,,,42,SOMBRERETE,,,REG_RP,PAN,2,ARTURO FERNANDO MORALES LIRA,1,CANDIDATURAS DE PERSONAS  JOVENES,,PAN
2,32,ZACATECAS,,,43,SUSTICACAN,,,PRES_MUN,PAN_PRI_PRD,1,FABIOLA RODRIGUEZ SALDIVAR,2,,,PRI
2,32,ZACATECAS,,,43,SUSTICACAN,,,SIND,PAN_PRI_PRD,1,MARCOS MARIN SANCHEZ,1,,,PRI
2,32,ZACATECAS,,,43,SUSTICACAN,,,REG,PAN_PRI_PRD,1,MA. DE JESUS DE LA ROSA SANCHEZ,2,,,PRI
2,32,ZACATECAS,,,43,SUSTICACAN,,,REG,PAN_PRI_PRD,2,JUAN LUIS DE SANTIAGO GONZALEZ,1,,,PRI
2,32,ZACATECAS,,,43,SUSTICACAN,,,REG,PAN_PRI_PRD,3,STEPHANY CARRILLO VALENZUELA,2,CANDIDATURAS DE PERSONAS  JOVENES,,PRI
2,32,ZACATECAS,,,43,SUSTICACAN,,,REG,MC,2,JUAN JOSE HERNANDEZ SANCHEZ,1,CANDIDATURAS DE DISCAPACIDAD,,MC
2,32,ZACATECAS,,,43,SUSTICACAN,,,REG_RP,PT,2,FERNANDO ANTONIO FLORES FLORES,1,CANDIDATURAS DE PERSONAS  JOVENES,,PT
2,32,ZACATECAS,,,44,TABASCO,,,PRES_MUN,PAN,1,CARLOS FABIAN VERA LOERA,1,,,PAN
2,32,ZACATECAS,,,44,TABASCO,,,SIND,PAN,1,MA. GUADALUPE BAUTISTA TORRES,2,,,PAN
2,32,ZACATECAS,,,44,TABASCO,,,REG,PAN,1,ERNESTO RUIZ RUIZ,1,,,PAN
2,32,ZACATECAS,,,44,TABASCO,,,REG,PAN,2,VICTORIA LOURDES NIEVES RODRIGUEZ,2,,,PAN
2,32,ZACATECAS,,,44,TABASCO,,,REG,PAN,3,DANIEL SOLIS AVILA,1,CANDIDATURAS DE PERSONAS  JOVENES,,PAN
2,32,ZACATECAS,,,44,TABASCO,,,REG,PAN,4,LILIA LIZBETH SERNA CONTRERAS,2,CANDIDATURAS DE PERSONAS  JOVENES,,PAN
2,32,ZACATECAS,,,44,TABASCO,,,REG,PAN,5,EMMANUEL RUVALCABA MURO,1,,,PAN
2,32,ZACATECAS,,,44,TABASCO,,,REG,PAN,6,ELVIA LIZETH VERA MURILLO,2,,,PAN
2,32,ZACATECAS,,,44,TABASCO,,,REG_RP,MC,1,NEREYDA LIZETH MARTINEZ CASTRO,2,,,MC
2,32,ZACATECAS,,,44,TABASCO,,,REG_RP,MC,2,ANTONIO MURILLO BRISEÑO,1,,,MC
2,32,ZACATECAS,,,44,TABASCO,,,REG_RP,MORENA,1,LETICIA GALVEZ ALMARAZ,2,,,MORENA
2,32,ZACATECAS,,,44,TABASCO,,,REG_RP,PT,3,JOSE MANUEL ROSALES CARRILLO,1,CANDIDATURAS DE PERSONAS  JOVENES,,PT
2,32,ZACATECAS,,,45,TEPECHITLAN,,,PRES_MUN,PT_NAZ_PES,1,ADOLFO CORTEZ SANTILLAN,1,,,PES
2,32,ZACATECAS,,,45,TEPECHITLAN,,,SIND,PT_NAZ_PES,1,ELSA LUNA ARELLANO,2,CANDIDATURAS DE PERSONAS  JOVENES,,PES
2,32,ZACATECAS,,,45,TEPECHITLAN,,,REG,PT_NAZ_PES,1,EMILIO CAMACHO ALVARADO,1,,,PT
2,32,ZACATECAS,,,45,TEPECHITLAN,,,REG,PT_NAZ_PES,2,JESSICA SALAS MUÑOZ,2,CANDIDATURAS DE PERSONAS  JOVENES,,PT
2,32,ZACATECAS,,,45,TEPECHITLAN,,,REG,PT_NAZ_PES,3,HUGO DANIEL DE LOS SANTOS JUAREZ,1,CANDIDATURAS DE PERSONAS  JOVENES,,NAZ
2,32,ZACATECAS,,,45,TEPECHITLAN,,,REG,MORENA,,,,,,MORENA
2,32,ZACATECAS,,,45,TEPECHITLAN,,,REG_RP,PRI,1,MANUELA AVILA VALLE,2,,,
2,32,ZACATECAS,,,46,TEPETONGO,,,PRES_MUN,PVEM_MORENA,1,FILIBERTO VENEGAS NAVA,1,,,MORENA
2,32,ZACATECAS,,,46,TEPETONGO,,,SIND,PVEM_MORENA,1,LORENA GUADALUPE RAMIREZ BETANCOURT,2,,,MORENA
2,32,ZACATECAS,,,46,TEPETONGO,,,REG,PVEM_MORENA,1,ROBERTO MURILLO IBARRA,1,,,MORENA
2,32,ZACATECAS,,,46,TEPETONGO,,,REG,PVEM_MORENA,2,EVELYN DEL REFUGIO SALAZAR BERUMEN,2,CANDIDATURAS DE PERSONAS  JOVENES,,MORENA
2,32,ZACATECAS,,,46,TEPETONGO,,,REG,PVEM_MORENA,3,JUAN ANGEL SILVA APARICIO,1,CANDIDATURAS DE PERSONAS  JOVENES,,MORENA
2,32,ZACATECAS,,,46,TEPETONGO,,,REG,PVEM_MORENA,4,YESENIA GRACIANO ULTRERAS,2,,,MORENA
2,32,ZACATECAS,,,46,TEPETONGO,,,REG_RP,PRI,1,PERLA CRISTINA VELAZQUEZ RAYGOZA,2,,,PRI
2,32,ZACATECAS,,,46,TEPETONGO,,,REG_RP,PRI,2,CUAUHTEMOC DE LA TORRE FLORES,1,,,PRI
2,32,ZACATECAS,,,46,TEPETONGO,,,REG_RP,PRD,1,DANIELA FLORES DE LEON,2,CANDIDATURAS DE PERSONAS  JOVENES,,PRD
2,32,ZACATECAS,,,47,TEUL DE GONZALEZ ORTEGA,,,PRES_MUN,PT,1,FRANCISCO REYES TORRES PEREZ,1,,,PT
2,32,ZACATECAS,,,47,TEUL DE GONZALEZ ORTEGA,,,SIND,PT,1,BERENA CARRILLO JIMENEZ,2,,,PT
2,32,ZACATECAS,,,47,TEUL DE GONZALEZ ORTEGA,,,REG,PT,1,MANUEL CORREA CARRILLO,1,CANDIDATURAS DE PERSONAS  JOVENES,,PT
2,32,ZACATECAS,,,47,TEUL DE GONZALEZ ORTEGA,,,REG,PT,2,GEMA LILIANA ESCOBEDO GAMEZ,2,,,PT
2,32,ZACATECAS,,,47,TEUL DE GONZALEZ ORTEGA,,,REG,PT,3,RIGOBERTO BAÑUELOS COVARRUBIAS,1,CANDIDATURAS DE PERSONAS  JOVENES,,PT
