CIRCUNSCRIPCION,ID_ESTADO,NOMBRE_ESTADO,ID_DISTRITO_LOCAL,CABECERA_DISTRITAL_LOCAL,ID_MUNICIPIO,MUNICIPIO,ID_DEMARCACION_LOCAL,DEMARCACION_LOCAL,TIPO_DE_CANDIDATURA,NOMBRE_ACTOR POLITICO,NUMERO_LISTA,PERSONA CANDIDATA,IDENTIDAD_SEXO_GENERICA,ACCION AFIRMATIVA,RUTA_CONSTANCIA,PARTIDO
2,32,ZACATECAS,1,ZACATECAS,,,,,DIP_LOC_MR,PVEM_MORENA,1,RUTH CALDERON BABUN,2,,,MORENA
2,32,ZACATECAS,2,ZACATECAS,,,,,DIP_LOC_MR,PVEM_MORENA,1,SANTOS ANTONIO GONZALEZ HUERTA,1,,,MORENA
2,32,ZACATECAS,3,GUADALUPE,,,,,DIP_LOC_MR,PAN_PRI_PRD,1,MA TERESA LOPEZ GARCIA,2,,,PAN
2,32,ZACATECAS,4,GUADALUPE,,,,,DIP_LOC_MR,PVEM_MORENA,1,SAUL DE JESUS CORDERO BECERRIL ,1,,,MORENA
2,32,ZACATECAS,5,GUADALUPE,,,,,DIP_LOC_MR,PVEM_MORENA,1,SUSANA ANDREA BARRAGAN ESPINOSA,2,,,MORENA
2,32,ZACATECAS,6,FRESNILLO,,,,,DIP_LOC_MR,PAN_PRI_PRD,1,JESUS EDUARDO BADILLO MENDEZ,1,,,PAN
2,32,ZACATECAS,7,FRESNILLO,,,,,DIP_LOC_MR,PVEM_MORENA,1,MARTIN ALVAREZ CASIO,1,,,MORENA
2,32,ZACATECAS,8,FRESNILLO,,,,,DIP_LOC_MR,PAN_PRI_PRD,1,ELEUTERIO RAMOS LEAL,1,,,PRI
2,32,ZACATECAS,9,CALERA,,,,,DIP_LOC_MR,PVEM_MORENA,1,GEORGIA FERNANDA MIRANDA HERRERA,2,,,PVEM
2,32,ZACATECAS,10,JEREZ DE GARCIA SALINAS,,,,,DIP_LOC_MR,PVEM_MORENA,1,JOSE LUIS GONZALEZ OROZCO,1,,,MORENA
2,32,ZACATECAS,11,OJOCALIENTE,,,,,DIP_LOC_MR,PAN_PRI_PRD,1,DAYANNE CRUZ HERNANDEZ,2,,,PRI
2,32,ZACATECAS,12,VILLA DE COS,,,,,DIP_LOC_MR,PAN_PRI_PRD,1,JOSE DAVID GONZALEZ HERNANDEZ,1,,,PRI
2,32,ZACATECAS,13,LORETO,,,,,DIP_LOC_MR,MORENA,1,IMELDA MAURICIO ESPARZA,2,,,MORENA
2,32,ZACATECAS,14,PINOS,,,,,DIP_LOC_MR,MORENA,1,OSCAR RAFAEL NOVELLA MACIAS,1,,,MORENA
2,32,ZACATECAS,15,JALPA,,,,,DIP_LOC_MR,PVEM_MORENA,1,MARIBEL VILLALPANDO HARO,2,,,MORENA
2,32,ZACATECAS,16,TLALTENANGO DE SANCHEZ ROMAN,,,,,DIP_LOC_MR,PVEM_MORENA,1,LYNDIANA ELIZABETH BUGARIN CORTES,2,,,PVEM
2,32,ZACATECAS,17,RIO GRANDE,,,,,DIP_LOC_MR,PVEM_MORENA,1,JAIME MANUEL ESQUIVEL HURTADO,1,,,MORENA
2,32,ZACATECAS,18,SOMBRERETE,,,,,DIP_LOC_MR,PVEM_MORENA,1,JESUS PADILLA ESTRADA,1,,,MORENA
2,32,ZACATECAS,,,,,,,DIP_LOC_RP,PAN,1,KARLA GUADALUPE ESTRADA GARCIA,2,,,PAN
2,32,ZACATECAS,,,,,,,DIP_LOC_RP,PRI,2,GUADALUPE ISADORA SANTIVAÑEZ RIOS,2,,,PRI
2,32,ZACATECAS,,,,,,,DIP_LOC_RP,PRI,1,CARLOS AURELIO PEÑA BADILLO,1,,,PRI
2,32,ZACATECAS,,,,,,,DIP_LOC_RP,PRI,11,ROBERTO LAMAS ALVARADO,1,,,PRI
2,32,ZACATECAS,,,,,,,DIP_LOC_RP,PRD,1,MA. ELENA CANALES CASTAÑEDA,2,,,PRD
2,32,ZACATECAS,,,,,,,DIP_LOC_RP,PT,2,RENATA LIBERTAD AVILA VALADEZ,2,,,PT
2,32,ZACATECAS,,,,,,,DIP_LOC_RP,PT,1,ALFREDO FEMAT BAÑUELOS,1,,,PT
2,32,ZACATECAS,,,,,,,DIP_LOC_RP,PAN,2,PEDRO MARTINEZ FLORES,1,,,PAN
2,32,ZACATECAS,,,,,,,DIP_LOC_RP,MC,1,ANA MARIA ROMO FONSECA,2,,,MC
2,32,ZACATECAS,,,,,,,DIP_LOC_RP,MC,2,MARCO VINICIO FLORES GUERRERO,1,,,MC
2,32,ZACATECAS,,,,,,,DIP_LOC_RP,MORENA,11,MARIA DOLORES TREJO CALZADA,2,,,MORENA
2,32,ZACATECAS,,,,,,,DIP_LOC_RP,NAZ,2,KARLA ESMERALDA RIVERA RODRIGUEZ,2,,,NAZ
2,32,ZACATECAS,,,1,APOZOL,,,PRES_MUN,PVEM_MORENA,1,GABRIELA ARELLANO QUEZADA ,2,,,MORENA
2,32,ZACATECAS,,,1,APOZOL,,,SIND,PVEM_MORENA,1,FERNANDO CHAVEZ LEDEZMA,1,,,MORENA
2,32,ZACATECAS,,,1,APOZOL,,,REG,PVEM_MORENA,1,ARANZA QUETZALLY AVILA VALDEZ ,2,CANDIDATURAS DE PERSONAS  JOVENESES,,MORENA
2,32,ZACATECAS,,,1,APOZOL,,,REG,PVEM_MORENA,2,J. JESUS COVARRUBIAS MACIAS ,1,,,MORENA
2,32,ZACATECAS,,,1,APOZOL,,,REG,PVEM_MORENA,3,ANA KARINA NUNGARAY CALZADA,2,CANDIDATURAS DE PERSONAS  JOVENES,,MORENA
2,32,ZACATECAS,,,1,APOZOL,,,REG,PVEM_MORENA,4,JOSE CARLOS SANDOVAL RAMIREZ ,1,,,PVEM
2,32,ZACATECAS,,,1,APOZOL,,,REG_RP,PAN,1,BEATRIZ ELENA GARCÍA QUEZADA,2,,,PAN
2,32,ZACATECAS,,,1,APOZOL,,,REG_RP,PAN,3,CARMEN POLETH HERNANDEZ TORRES,2,,,PAN
2,32,ZACATECAS,,,1,APOZOL,,,REG_RP,PAN,2,GAMALIEL GONZALEZ ESTRADA,1,,,PAN
2,32,ZACATECAS,,,2,APULCO,,,PRES_MUN,MC,1,MAURO YURIEL JAUREGUI MUÑOZ,1,CANDIDATURAS DE PERSONAS  JOVENES,,MC
2,32,ZACATECAS,,,2,APULCO,,,SIND,MC,1,LUZ DEL CARMEN SALDIVAR CRUZ,2,,,MC
2,32,ZACATECAS,,,2,APULCO,,,REG,MC,1,JOSE LUIS DURAN SALDIVAR,1,CANDIDATURAS DE PERSONAS  JOVENES,,MC
2,32,ZACATECAS,,,2,APULCO,,,REG,MC,2,DIANA LAURA MARIN TORRES,2,CANDIDATURAS DE PERSONAS  JOVENES,,MC
2,32,ZACATECAS,,,2,APULCO,,,REG,MC,3,MANUEL CAMPA SANCHEZ,1,CANDIDATURA DE LA DIVERSIDAD SEXUAL,,MC
2,32,ZACATECAS,,,2,APULCO,,,REG,MC,4,MARTHA CECILIA LOPEZ MARIN,2,,,MC
2,32,ZACATECAS,,,2,APULCO,,,REG_RP,MAZ,1,GABRIELA GOMEZ SALUDES,2,CANDIDATURAS DE PERSONAS  JOVENES,,MAZ
2,32,ZACATECAS,,,2,APULCO,,,REG_RP,MAZ,2,JOSE SOCORRO RAMIREZ HERNANDEZ,1,,,MAZ
2,32,ZACATECAS,,,2,APULCO,,,REG_RP,PRI,1,MARIA ANGELICA RODRIGUEZ ZAMARRON,2,,,PRI
2,32,ZACATECAS,,,3,ATOLINGA,,,PRES_MUN,PVEM_MORENA,1,TERESITA DE JESUS ARTEAGA PEREZ,2,,,PVEM
2,32,ZACATECAS,,,3,ATOLINGA,,,SIND,PVEM_MORENA,1,ARMANDO FLORES OROZCO,1,,,MORENA
2,32,ZACATECAS,,,3,ATOLINGA,,,REG,PVEM_MORENA,1,BIANCA YESENIA MARTINEZ ESTRADA,2,CANDIDATURAS DE PERSONAS  JOVENES,,MORENA
2,32,ZACATECAS,,,3,ATOLINGA,,,REG,PVEM_MORENA,2,ADAN RODRIGUEZ OLVERA,1,,,PVEM
2,32,ZACATECAS,,,3,ATOLINGA,,,REG,PVEM_MORENA,4,NOE REYES LUNA,1,,,MORENA
2,32,ZACATECAS,,,3,ATOLINGA,,,REG_RP,PAN,1,TERESITA QUEZADA SALINAS,2,,,PAN
2,32,ZACATECAS,,,3,ATOLINGA,,,REG_RP,PAN,2,ELIAZAR PADILLA ARTEAGA,1,,,PAN
2,32,ZACATECAS,,,3,ATOLINGA,,,REG_RP,PRI,1,MA. DE JESUS PALLARES RIVERA,2,,,PRI
2,32,ZACATECAS,,,4,BENITO JUAREZ,,,PRES_MUN,PVEM_MORENA,1,FORTINO CORTES RAMIREZ,1,,,PVEM
2,32,ZACATECAS,,,4,BENITO JUAREZ,,,SIND,PVEM_MORENA,1,REINA NEREIDA RODRIGUEZ ARELLANO,2,,,PVEM
2,32,ZACATECAS,,,4,BENITO JUAREZ,,,REG,PVEM_MORENA,1,MARIO ALEJANDRO CORREA CORREA,1,,,PVEM
2,32,ZACATECAS,,,4,BENITO JUAREZ,,,REG,PVEM_MORENA,2,MARIA GUADALUPE FLORES VARGAS,2,,,PVEM
2,32,ZACATECAS,,,4,BENITO JUAREZ,,,REG,PVEM_MORENA,3,MIGUEL CAMPOS FLORES,1,CANDIDATURAS DE PERSONAS  JOVENES,,PVEM
2,32,ZACATECAS,,,4,BENITO JUAREZ,,,REG,PVEM_MORENA,4,MILEYVI POLANCO ROBLES,2,CANDIDATURAS DE PERSONAS  JOVENES,,MORENA
2,32,ZACATECAS,,,4,BENITO JUAREZ,,,REG_RP,PAN,1,EVALIA CORREA ARELLANO,2,,,PAN
2,32,ZACATECAS,,,4,BENITO JUAREZ,,,REG_RP,PAN,2,ADRIAN ROBLES BERNAL,1,,,PAN
2,32,ZACATECAS,,,4,BENITO JUAREZ,,,REG_RP,PES,1,TERESA SANDOVAL RAMIREZ,2,CANDIDATURAS DE PERSONAS  JOVENES,,PES
2,32,ZACATECAS,,,5,CALERA,,,PRES_MUN,PT_NAZ_PES,1,MIGUEL ANGEL MURILLO GARCIA,1,,,PT
2,32,ZACATECAS,,,5,CALERA,,,SIND,PT_NAZ_PES,1,MARIA FERNANDA MURO GOMEZ,2,,,PT
2,32,ZACATECAS,,,5,CALERA,,,REG,PT_NAZ_PES,1,RAMIRO GARCIA RODRIGUEZ,1,,,PT
2,32,ZACATECAS,,,5,CALERA,,,REG,PT_NAZ_PES,2,BLANCA SUSANA LARA HERNANDEZ,2,,,PES
2,32,ZACATECAS,,,5,CALERA,,,REG,PT_NAZ_PES,3,BRAYAN GALVAN GARCIA,1,CANDIDATURAS DE PERSONAS  JOVENES,,NAZ
2,32,ZACATECAS,,,5,CALERA,,,REG,PT_NAZ_PES,4,MARTHA LILIANA LUNA VALDEZ,2,,,PT
2,32,ZACATECAS,,,5,CALERA,,,REG,PT_NAZ_PES,5,HORACIO MEJIA CAPETILLO,1,,,PES
2,32,ZACATECAS,,,5,CALERA,,,REG,PT_NAZ_PES,6,CLAUDIA PATRICIA ROJAS PADILLA,2,,,PT
2,32,ZACATECAS,,,5,CALERA,,,REG,PT_NAZ_PES,7,VICTOR EMMANUEL MARTINEZ RICO,1,CANDIDATURAS DE PERSONAS  JOVENES,,PT
2,32,ZACATECAS,,,5,CALERA,,,REG_RP,PAN,1,LIZET MURILLO DE LA  TORRE,2,,,PAN
2,32,ZACATECAS,,,5,CALERA,,,REG_RP,PAN,2,RAUL HERNALDO ENCISO RINCON,1,,,PAN
2,32,ZACATECAS,,,5,CALERA,,,REG_RP,PAN,4,JOSE ANGEL IBARRA QUEZADA,1,,,PAN
2,32,ZACATECAS,,,5,CALERA,,,REG_RP,MORENA,1,SILVIA ALEJANDRA PARRA BAEZ,2,,,MORENA
2,32,ZACATECAS,,,5,CALERA,,,REG_RP,PRI,2,FRANCISCA MARTINEZ HERNANDEZ,2,,,PRI
2,32,ZACATECAS,,,6,CAÑITAS DE FELIPE PESCADOR,,,PRES_MUN,PRD,1,OSWALDO SABAG HAMADANI,1,,,PRD
2,32,ZACATECAS,,,6,CAÑITAS DE FELIPE PESCADOR,,,SIND,PRD,1,IRIANA DARLEN AGUILAR RODARTE,2,CANDIDATURAS DE PERSONAS  JOVENES,,PRD
2,32,ZACATECAS,,,6,CAÑITAS DE FELIPE PESCADOR,,,REG,PRD,1,JUAN ALEJANDRO NAVA LUNA,1,CANDIDATURAS DE PERSONAS  JOVENES,,PRD
2,32,ZACATECAS,,,6,CAÑITAS DE FELIPE PESCADOR,,,REG,PRD,2,OLGA LOPEZ LOERA,2,,,PRD
2,32,ZACATECAS,,,6,CAÑITAS DE FELIPE PESCADOR,,,REG,PRD,3,JOSE CRUZ VALTIERRA GUTIERREZ,1,,,PRD
2,32,ZACATECAS,,,6,CAÑITAS DE FELIPE PESCADOR,,,REG,PRD,4,NADIA ARACELI DE LA CRUZ SOLIS,2,CANDIDATURAS DE PERSONAS  JOVENES,,PRD
2,32,ZACATECAS,,,6,CAÑITAS DE FELIPE PESCADOR,,,REG_RP,NAZ,1,MA ESPERANZA CASTRUITA SALAZAR,2,,,NAZ
2,32,ZACATECAS,,,6,CAÑITAS DE FELIPE PESCADOR,,,REG_RP,PVEM,1,MARIA DANAYA CASTILLO MARTINEZ,2,CANDIDATURAS DE PERSONAS  JOVENES,,PVEM
2,32,ZACATECAS,,,6,CAÑITAS DE FELIPE PESCADOR,,,REG_RP,PT,1,MA DEL SOCORRO CORTEZ MUÑOZ,2,,,PT
2,32,ZACATECAS,,,7,CONCEPCION DEL ORO,,,PRES_MUN,NAZ,1,JOSE LUIS MARTINEZ LOPEZ,1,,,NAZ
2,32,ZACATECAS,,,7,CONCEPCION DEL ORO,,,SIND,NAZ,1,DORA ELIA GUADALUPE MONCADA ROCHA,2,,,NAZ
2,32,ZACATECAS,,,7,CONCEPCION DEL ORO,,,REG,NAZ,1,CRUZ EDUARDO DE LA ROSA JIMENEZ,1,,,NAZ
2,32,ZACATECAS,,,7,CONCEPCION DEL ORO,,,REG,NAZ,2,MARIA ABIGAIL ROJAS ARREDONDO,2,CANDIDATURAS DE PERSONAS  JOVENES,,NAZ
2,32,ZACATECAS,,,7,CONCEPCION DEL ORO,,,REG,NAZ,3,GERARDO DE JESUS GUTIERREZ RAMOS,1,CANDIDATURAS DE PERSONAS  JOVENES,,NAZ
2,32,ZACATECAS,,,7,CONCEPCION DEL ORO,,,REG,NAZ,4,FRANCIS ANEL HERNANDEZ FRIAS,2,CANDIDATURAS DE PERSONAS  JOVENES,,NAZ
2,32,ZACATECAS,,,7,CONCEPCION DEL ORO,,,REG,NAZ,5,JESUS ALEJANDRO GONZALEZ ALVAREZ,1,CANDIDATURAS DE PERSONAS  JOVENES,,NAZ
2,32,ZACATECAS,,,7,CONCEPCION DEL ORO,,,REG,NAZ,6,KARLA JANETH GARCIA ROSALES,2,,,NAZ
2,32,ZACATECAS,,,7,CONCEPCION DEL ORO,,,REG_RP,PRI,1,ANDREA CECILIA ROJAS CARREON,2,CANDIDATURAS DE PERSONAS  JOVENES,,PRI
2,32,ZACATECAS,,,7,CONCEPCION DEL ORO,,,REG_RP,PRI,2,OLIVIER ALEJANDRO BRIONES PATIÑO,1,,,PRI
2,32,ZACATECAS,,,7,CONCEPCION DEL ORO,,,REG_RP,PRI,4,JESUS ANSELMO CARRILLO MUÑOZ,1,,,PRI
2,32,ZACATECAS,,,7,CONCEPCION DEL ORO,,,REG_RP,MORENA,1,CAROLINA DE JESUS RODRIGUEZ MONTEJANO,2,,,PT
2,32,ZACATECAS,,,8,CUAUHTEMOC,,,PRES_MUN,PVEM_MORENA,1,FRANCISCO JAVIER ARCOS RUIZ,1,,,PVEM
2,32,ZACATECAS,,,8,CUAUHTEMOC,,,SIND,PVEM_MORENA,1,WENDY JANNET CAPUCHINO ACOSTA,2,,,PVEM
2,32,ZACATECAS,,,8,CUAUHTEMOC,,,REG,PVEM_MORENA,1,GERMAN GAYTAN QUINTERO,1,CANDIDATURAS DE PERSONAS  JOVENES,,PVEM
2,32,ZACATECAS,,,8,CUAUHTEMOC,,,REG,PVEM_MORENA,2,SARA LOPEZ FRIAS,2,,,PVEM
2,32,ZACATECAS,,,8,CUAUHTEMOC,,,REG,PVEM_MORENA,3,EFREN REYES HERRERA,1,,,PVEM
2,32,ZACATECAS,,,8,CUAUHTEMOC,,,REG,PVEM_MORENA,4,MARI CARMEN DELGADO ACOSTA,2,,,PVEM
2,32,ZACATECAS,,,8,CUAUHTEMOC,,,REG,PVEM_MORENA,5,DAGOBERTO HERRERA LOPEZ,1,,,PVEM
2,32,ZACATECAS,,,8,CUAUHTEMOC,,,REG,PVEM_MORENA,6,MARIA AZUCENA SANTANA DEL TORO,2,CANDIDATURAS DE PERSONAS  JOVENES,,MORENA
2,32,ZACATECAS,,,8,CUAUHTEMOC,,,REG_RP,PRD,1,NORMA DAISY FLORES VERA,2,,,PRD
2,32,ZACATECAS,,,8,CUAUHTEMOC,,,REG_RP,PRD,3,DULCE MARIA GONZALEZ ESQUIVEL,2,CANDIDATURAS DE PERSONAS  JOVENES,,PRD
2,32,ZACATECAS,,,8,CUAUHTEMOC,,,REG_RP,PRD,2,JOSE DE JESUS GUTIERREZ RAMIREZ,1,,,PRD
2,32,ZACATECAS,,,8,CUAUHTEMOC,,,REG_RP,PRD,4,JAIME ROBLES ELIAS,1,,,PRD
2,32,ZACATECAS,,,9,CHALCHIHUITES,,,PRES_MUN,PAN_PRI_PRD,1,PEDRO MIRANDA MORALES,1,,,PRI
2,32,ZACATECAS,,,9,CHALCHIHUITES,,,SIND,PAN_PRI_PRD,1,CLAUDIA JANET SERRATO ANDRADE,2,,,PRI
2,32,ZACATECAS,,,9,CHALCHIHUITES,,,REG,PAN_PRI_PRD,1,ANTONIO ALANIZ MORENO,1,,,PRI
2,32,ZACATECAS,,,9,CHALCHIHUITES,,,REG,PAN_PRI_PRD,2,MAYRA INES ROSALES SAUCEDO,2,,,PAN
2,32,ZACATECAS,,,9,CHALCHIHUITES,,,REG,PAN_PRI_PRD,3,JULIO CESAR BRISEÑO ARREOLA,1,,,PRI
2,32,ZACATECAS,,,9,CHALCHIHUITES,,,REG,PAN_PRI_PRD,4,ARIANA ZULEMA ALDAVA APARICIO,2,CANDIDATURAS DE PERSONAS  JOVENES,,PRI
2,32,ZACATECAS,,,9,CHALCHIHUITES,,,REG,PAN_PRI_PRD,5,VICTOR ESCALANTE PEREZ,1,,,PRI
2,32,ZACATECAS,,,9,CHALCHIHUITES,,,REG,PAN_PRI_PRD,6,JULIA ALICIA DURAN RODRIGUEZ,2,CANDIDATURAS DE PERSONAS  JOVENES,,PRI
2,32,ZACATECAS,,,9,CHALCHIHUITES,,,REG_RP,MORENA,1,SUSANA OCHOA ESPARZA,2,,,MORENA
2,32,ZACATECAS,,,9,CHALCHIHUITES,,,REG_RP,MORENA,3,JAZMIN GUTIERREZ MARTINEZ,2,CANDIDATURAS DE PERSONAS  JOVENES,,MORENA
2,32,ZACATECAS,,,9,CHALCHIHUITES,,,REG_RP,MORENA,2,PEDRO ANTONIO ROSALES MATA,1,,,MORENA
2,32,ZACATECAS,,,9,CHALCHIHUITES,,,REG_RP,MORENA,4,SAULO JOSE TREVIÑO AMADOR,1,,,MORENA
2,32,ZACATECAS,,,10,FRESNILLO,,,PRES_MUN,PAN_PRI_PRD,1,JAVIER TORRES RODRIGUEZ,1,,,PRI
2,32,ZACATECAS,,,10,FRESNILLO,,,SIND,PAN_PRI_PRD,1,MARCELA DEL COJO GOMEZ,2,,,PRI
2,32,ZACATECAS,,,10,FRESNILLO,,,REG,PAN_PRI_PRD,1,AMADO TRINIDAD RODRIGUEZ,1,,,PRD
2,32,ZACATECAS,,,10,FRESNILLO,,,REG,PAN_PRI_PRD,2,NANCY BERENICE HERNANDEZ TOVAR,2,CANDIDATURAS DE PERSONAS  JOVENES,,PRI
2,32,ZACATECAS,,,10,FRESNILLO,,,REG,PAN_PRI_PRD,3,ROGELIO BELTRAN CAZARES,1,,,PRI
2,32,ZACATECAS,,,10,FRESNILLO,,,REG,PAN_PRI_PRD,4,CLAUDIA IMELDA MARMOLEJO MARTINEZ,2,,,PRI
2,32,ZACATECAS,,,10,FRESNILLO,,,REG,PAN_PRI_PRD,5,LUIS ALBERTO MUÑOZ MEDINA,1,CANDIDATURAS DE PERSONAS  JOVENES,,PRI
2,32,ZACATECAS,,,10,FRESNILLO,,,REG,PAN_PRI_PRD,6,ANAELENA LOPEZ PATIÑO,2,,,PRI
2,32,ZACATECAS,,,10,FRESNILLO,,,REG,PAN_PRI_PRD,7,RICARDO JAVIER VENECIA CARRERA,1,,,PAN
2,32,ZACATECAS,,,10,FRESNILLO,,,REG,PAN_PRI_PRD,8,ESTHELA GUERRERO SIFUENTES,2,,,PAN
2,32,ZACATECAS,,,10,FRESNILLO,,,REG_RP,MORENA,1,GRISELDA MARTINEZ ESPARZA,2,,,MORENA
2,32,ZACATECAS,,,10,FRESNILLO,,,REG_RP,MORENA,2,BAUDEL CRUZ REYES,1,,,MORENA
2,32,ZACATECAS,,,10,FRESNILLO,,,REG_RP,MORENA,4,JUAN ALBERTO ALVARADO HERNANDEZ,1,,,MORENA
2,32,ZACATECAS,,,10,FRESNILLO,,,REG_RP,MORENA,6,OMAR RODARTE GARCIA,1,,,MORENA
2,32,ZACATECAS,,,10,FRESNILLO,,,REG_RP,MC,1,STEPHANIA FLORES RODRIGUEZ,2,,,MC
2,32,ZACATECAS,,,10,FRESNILLO,,,REG_RP,PVEM,1,SUSANA ZACARIAS SANCHEZ,2,,,PVEM
2,32,ZACATECAS,,,11,TRINIDAD GARCIA DE LA CADENA,,,PRES_MUN,PAN_PRI_PRD,1,ARMIDA NUÑEZ GUZMAN,2,,,PAN
2,32,ZACATECAS,,,11,TRINIDAD GARCIA DE LA CADENA,,,SIND,PAN_PRI_PRD,1,JOSE EDUARDO TOVAR GONZALEZ,1,CANDIDATURAS DE PERSONAS  JOVENES,,PAN
2,32,ZACATECAS,,,11,TRINIDAD GARCIA DE LA CADENA,,,REG,PAN_PRI_PRD,1,SANDRA CASTRO ROBLES,2,CANDIDATURAS DE PERSONAS  JOVENES,,PAN
2,32,ZACATECAS,,,11,TRINIDAD GARCIA DE LA CADENA,,,REG,PAN_PRI_PRD,2,RAFAEL GUZMAN VELARDE,1,,,PAN
2,32,ZACATECAS,,,11,TRINIDAD GARCIA DE LA CADENA,,,REG,PAN_PRI_PRD,3,DULCE MARIA GONZALEZ ,2,,,PAN
2,32,ZACATECAS,,,11,TRINIDAD GARCIA DE LA CADENA,,,REG,PAN_PRI_PRD,4,ALEJANDRO GAMBOA HERNANDEZ,1,,,PRI
2,32,ZACATECAS,,,11,TRINIDAD GARCIA DE LA CADENA,,,REG_RP,FMZ,1,NORMA ALICIA HERNANDEZ ALVAREZ,2,,,FMZ
2,32,ZACATECAS,,,11,TRINIDAD GARCIA DE LA CADENA,,,REG_RP,PVEM,1,SILVIA GUZMAN GUZMAN,1,,,PVEM
2,32,ZACATECAS,,,12,GENARO CODINA,,,PRES_MUN,PVEM_MORENA,1,ERICK HERNANDEZ SAUCEDO,1,CANDIDATURAS DE PERSONAS  JOVENES,,MORENA
2,32,ZACATECAS,,,12,GENARO CODINA,,,SIND,PVEM_MORENA,1,MARIA ELIZABETH DEL VILLAR MACIAS,2,,,MORENA
2,32,ZACATECAS,,,12,GENARO CODINA,,,REG,PVEM_MORENA,2,DELIA FRAGOZA GARCIA,2,,,MORENA
2,32,ZACATECAS,,,12,GENARO CODINA,,,REG,PVEM_MORENA,3,ADRIAN MUÑOZ VALDEZ,1,,,MORENA
2,32,ZACATECAS,,,12,GENARO CODINA,,,REG,PVEM_MORENA,4,LINA JIMENEZ VELA,2,,,MORENA
2,32,ZACATECAS,,,12,GENARO CODINA,,,REG_RP,NAZ,2,OTONIEL CHAVEZ NORATO,1,,,NAZ
2,32,ZACATECAS,,,12,GENARO CODINA,,,REG_RP,PT,2,BRAULIO RUIZ REYES,1,,,PT
2,32,ZACATECAS,,,12,GENARO CODINA,,,REG_RP,MC,1,SONIA ALEJANDRA JACOBO CAMPOS,2,CANDIDATURAS DE PERSONAS  JOVENES,,MC
2,32,ZACATECAS,,,13,GENERAL ENRIQUE ESTRADA,,,PRES_MUN,PVEM_MORENA,1,MARTHA MILAGROS DE LOERA RODRIGUEZ,2,,,PVEM
2,32,ZACATECAS,,,13,GENERAL ENRIQUE ESTRADA,,,SIND,PVEM_MORENA,1,RAUDEL FLORES RODRIGUEZ,1,,,PVEM
2,32,ZACATECAS,,,13,GENERAL ENRIQUE ESTRADA,,,REG,PVEM_MORENA,1,DULCE MARIA BAÑUELOS ALVARADO,2,CANDIDATURAS DE PERSONAS  JOVENES,,PVEM
2,32,ZACATECAS,,,13,GENERAL ENRIQUE ESTRADA,,,REG,PVEM_MORENA,2,JOSE FRANCISCO CARRILLO ARELLANO ,1,CANDIDATURAS DE PERSONAS  JOVENES,,PVEM
2,32,ZACATECAS,,,13,GENERAL ENRIQUE ESTRADA,,,REG,PVEM_MORENA,3,MA. DEL SOCORRO REYES HERRERA,2,,,PVEM
2,32,ZACATECAS,,,13,GENERAL ENRIQUE ESTRADA,,,REG,PVEM_MORENA,4,ABEL ALEJANDRO GONZALEZ RAMIREZ,1,,,PVEM
2,32,ZACATECAS,,,13,GENERAL ENRIQUE ESTRADA,,,REG_RP,MC,1,YAZMIN ALEJANDRA REVELES CASTAÑEDA,2,CANDIDATURAS DE PERSONAS  JOVENES,,MC
2,32,ZACATECAS,,,13,GENERAL ENRIQUE ESTRADA,,,REG_RP,MC,2,RAMIRO ARMENTA FLORES,1,CANDIDATURAS DE PERSONAS  JOVENES,,MC
2,32,ZACATECAS,,,13,GENERAL ENRIQUE ESTRADA,,,REG_RP,PAN,1,NORMA NOEMI DE LUNA GAETA,2,CANDIDATURAS DE PERSONAS  JOVENES,,PAN
2,32,ZACATECAS,,,14,GENERAL FRANCISCO R. MURGUIA ,,,PRES_MUN,PAN_PRI_PRD,1,JOSE NIEVES BALDERAS SANCHEZ,1,,,PRI
2,32,ZACATECAS,,,14,GENERAL FRANCISCO R. MURGUIA ,,,SIND,PAN_PRI_PRD,1,JESSICA ESPARZA RAMIREZ,2,,,PRI
2,32,ZACATECAS,,,14,GENERAL FRANCISCO R. MURGUIA ,,,REG,PAN_PRI_PRD,1,ADAN OVALLE OCHOA,1,,,PRD
2,32,ZACATECAS,,,14,GENERAL FRANCISCO R. MURGUIA ,,,REG,PAN_PRI_PRD,2,MAGALI HERNANDEZ BALDERAS,2,CANDIDATURAS DE PERSONAS  JOVENES,,PAN
2,32,ZACATECAS,,,14,GENERAL FRANCISCO R. MURGUIA ,,,REG,PAN_PRI_PRD,3,JESUS MACIAS DEHUMA,1,,,PRI
2,32,ZACATECAS,,,14,GENERAL FRANCISCO R. MURGUIA ,,,REG,PAN_PRI_PRD,4,DULCE SUSANA LOERA ESPINO,2,,,PRI
2,32,ZACATECAS,,,14,GENERAL FRANCISCO R. MURGUIA ,,,REG,PAN_PRI_PRD,5,YOMIRA ALEJANDRA ROJAS ROJAS,2,CANDIDATURAS DE PERSONAS  JOVENES,,PRI
2,32,ZACATECAS,,,14,GENERAL FRANCISCO R. MURGUIA ,,,REG,PAN_PRI_PRD,6,MA GUADALUPE GONZALEZ LOPEZ,2,,,PRI
2,32,ZACATECAS,,,14,GENERAL FRANCISCO R. MURGUIA ,,,REG_RP,MORENA,2,BERNARDINO CASTRO LOPEZ,1,,,MORENA
2,32,ZACATECAS,,,14,GENERAL FRANCISCO R. MURGUIA ,,,REG_RP,MORENA,3,BRENDA LILIANA CRUZ MIRELES,2,CANDIDATURAS DE PERSONAS  JOVENES,,MORENA
2,32,ZACATECAS,,,14,GENERAL FRANCISCO R. MURGUIA ,,,REG_RP,MORENA,1,MAYRA TRINIDAD MARTINEZ NEAVE,2,,,MORENA
2,32,ZACATECAS,,,14,GENERAL FRANCISCO R. MURGUIA ,,,REG_RP,PVEM,1,EVELYN NAHIARA GARCIA RODRIGUEZ,2,CANDIDATURAS DE PERSONAS  JOVENES,,PVEM
2,32,ZACATECAS,,,15,EL PLATEADO DE JOAQUIN AMARO,,,PRES_MUN,PVEM,1,JAIRO CUEVAS PEREZ,1,,,PVEM
2,32,ZACATECAS,,,15,EL PLATEADO DE JOAQUIN AMARO,,,SIND,PVEM,1,ESTEPHANIA MONTALVO SALDAÑA,2,CANDIDATURAS DE PERSONAS  JOVENES,,PVEM
2,32,ZACATECAS,,,15,EL PLATEADO DE JOAQUIN AMARO,,,REG,PVEM,1,GERARDO ORTEGA VILLEGAS,1,,,PVEM
2,32,ZACATECAS,,,15,EL PLATEADO DE JOAQUIN AMARO,,,REG,PVEM,2,OLIVIA ALVAREZ SALDAÑA,2,,,PVEM
2,32,ZACATECAS,,,15,EL PLATEADO DE JOAQUIN AMARO,,,REG,PVEM,3,ANTONIO VILLA LEAÑOS,1,,,PVEM
2,32,ZACATECAS,,,15,EL PLATEADO DE JOAQUIN AMARO,,,REG,PVEM,4,MARIA DEL CARMEN ROMERO RAYGOZA,2,CANDIDATURAS DE PERSONAS  JOVENES,,PVEM
2,32,ZACATECAS,,,15,EL PLATEADO DE JOAQUIN AMARO,,,REG_RP,MORENA,1,MARA ZULEMA YOVANE LOZANO,2,,,MORENA
2,32,ZACATECAS,,,15,EL PLATEADO DE JOAQUIN AMARO,,,REG_RP,MORENA,2,MARIA GUADALUPE CHAVEZ MARQUEZ,2,CANDIDATURAS DE PERSONAS  JOVENES,,MORENA
2,32,ZACATECAS,,,15,EL PLATEADO DE JOAQUIN AMARO,,,REG_RP,PES,1,LIZBETH SOLIS LOPEZ,2,CANDIDATURAS DE PERSONAS  JOVENES,,PES
2,32,ZACATECAS,,,16,GENERAL PANFILO NATERA,,,PRES_MUN,PT_NAZ_PES,1,FREDY GONZALEZ VAZQUEZ,1,,,NAZ
2,32,ZACATECAS,,,16,GENERAL PANFILO NATERA,,,SIND,PT_NAZ_PES,1,MAROLI SALAS ORTIZ,2,,,NAZ
2,32,ZACATECAS,,,16,GENERAL PANFILO NATERA,,,REG,PT_NAZ_PES,1,JUAN DIEGO RODRIGUEZ ACOSTA,1,CANDIDATURAS DE PERSONAS  JOVENES,,NAZ
2,32,ZACATECAS,,,16,GENERAL PANFILO NATERA,,,REG,PT_NAZ_PES,2,MARIA DEL REFUGIO MENDEZ LUEVANO,2,CANDIDATURAS DE PERSONAS  JOVENES,,NAZ
2,32,ZACATECAS,,,16,GENERAL PANFILO NATERA,,,REG,PT_NAZ_PES,3,FLORENTINO SALAS MARTINEZ,1,,,NAZ
2,32,ZACATECAS,,,16,GENERAL PANFILO NATERA,,,REG,PT_NAZ_PES,4,RAQUEL GALLEGOS ALONSO,2,,,NAZ
2,32,ZACATECAS,,,16,GENERAL PANFILO NATERA,,,REG,PT_NAZ_PES,5,FRANCISCO JAVIER MAURICIO MARTINEZ,1,,,NAZ
2,32,ZACATECAS,,,16,GENERAL PANFILO NATERA,,,REG,PT_NAZ_PES,6,JOSEFINA MONTOYA CORONADO,2,,,NAZ
2,32,ZACATECAS,,,16,GENERAL PANFILO NATERA,,,REG_RP,MORENA,1,MA. DE LA LUZ MENDEZ LOPEZ,2,,,MORENA
2,32,ZACATECAS,,,16,GENERAL PANFILO NATERA,,,REG_RP,MORENA,2,IVAN SALDAÑA PARRA,1,CANDIDATURAS DE PERSONAS  JOVENES,,MORENA
2,32,ZACATECAS,,,16,GENERAL PANFILO NATERA,,,REG_RP,MORENA,4,EMMANUEL MARTINEZ CONTRERAS,1,CANDIDATURAS DE PERSONAS  JOVENES,,MORENA
2,32,ZACATECAS,,,16,GENERAL PANFILO NATERA,,,REG_RP,PVEM,1,SANJUANA RODRIGUEZ TOVAR,2,,,PVEM
2,32,ZACATECAS,,,17,GUADALUPE,,,PRES_MUN,PVEM_MORENA,1,JOSE SALDIVAR ALCALDE,1,,,MORENA
2,32,ZACATECAS,,,17,GUADALUPE,,,SIND,PVEM_MORENA,1,ANALI INFANTE MORALES,2,,,MORENA
2,32,ZACATECAS,,,17,GUADALUPE,,,REG,PVEM_MORENA,1,FRANCISCO JAVIER SOLIS GAMBOA,1,,,MORENA
2,32,ZACATECAS,,,17,GUADALUPE,,,REG,PVEM_MORENA,2,MARIA DE LOURDES MARTINEZ PEREZ,2,,,MORENA
2,32,ZACATECAS,,,17,GUADALUPE,,,REG,PVEM_MORENA,3,ELEAZAR MOISES LIMONES VENEGAS,1,,,MORENA
2,32,ZACATECAS,,,17,GUADALUPE,,,REG,PVEM_MORENA,4,DIANA ELIZABETH GALAVIZ TINAJERO,2,,,MORENA
2,32,ZACATECAS,,,17,GUADALUPE,,,REG,PVEM_MORENA,5,OMAR DIONICIO GARCIA MUÑOZ,1,,,MORENA
2,32,ZACATECAS,,,17,GUADALUPE,,,REG,PVEM_MORENA,6,MARIA ELENA MARQUEZ MARTINEZ,2,,,MORENA
2,32,ZACATECAS,,,17,GUADALUPE,,,REG,PVEM_MORENA,7,CRISTOPHER CIRO LICONA RAMIREZ,1,CANDIDATURAS DE PERSONAS  JOVENES,,MORENA
2,32,ZACATECAS,,,17,GUADALUPE,,,REG,PVEM_MORENA,8,DIANA KARINA TRUJILLO ORTEGA,2,CANDIDATURAS DE PERSONAS  JOVENES,,MORENA
2,32,ZACATECAS,,,17,GUADALUPE,,,REG_RP,PRI,1,ARACELI GUERRERO ESQUIVEL,2,,,PRI
2,32,ZACATECAS,,,17,GUADALUPE,,,REG_RP,PRI,2,ENRIQUE GUADALUPE FLORES MENDOZA,1,,,PRI
2,32,ZACATECAS,,,17,GUADALUPE,,,REG_RP,PRI,4,RODOLFO RUELAS DURAN,1,,,PRI
2,32,ZACATECAS,,,17,GUADALUPE,,,REG_RP,PAN,1,MARIA PATRICIA MOLINA DURAN,2,,,PAN
2,32,ZACATECAS,,,17,GUADALUPE,,,REG_RP,PAN,2,FELIPE REYES MARTINEZ,1,,,PAN
2,32,ZACATECAS,,,17,GUADALUPE,,,REG_RP,MC,1,LAURA ALEJANDRA RUELAS GUTIERREZ,2,,,MC
2,32,ZACATECAS,,,18,HUANUSCO,,,PRES_MUN,PAN_PRI_PRD,1,JULIETA ISAMAR CAMACHO GARCIA,2,,,PAN
2,32,ZACATECAS,,,18,HUANUSCO,,,SIND,PAN_PRI_PRD,1,ISAIAS OLIVER RUIZ HERNANDEZ,1,,,PAN
2,32,ZACATECAS,,,18,HUANUSCO,,,REG,PAN_PRI_PRD,1,HOSANA SILVA SILVA,2,,,PAN
2,32,ZACATECAS,,,18,HUANUSCO,,,REG,PAN_PRI_PRD,2,FERNANDO MARQUEZ CASTAÑEDA,2,,,PAN
2,32,ZACATECAS,,,18,HUANUSCO,,,REG,PAN_PRI_PRD,3,VANESSA MARGARITA ALVAREZ GUERRERO,1,,,PRI
2,32,ZACATECAS,,,18,HUANUSCO,,,REG,PAN_PRI_PRD,4,IVAN RODRIGUEZ RENTERIA,1,,,PAN
2,32,ZACATECAS,,,18,HUANUSCO,,,REG_RP,MORENA,1,PATRICIA MARQUEZ RUIZ,2,,,MORENA
2,32,ZACATECAS,,,18,HUANUSCO,,,REG_RP,MORENA,3,XIMENA GARCIA VELASCO,1,CANDIDATURAS DE PERSONAS  JOVENES,,MORENA
2,32,ZACATECAS,,,18,HUANUSCO,,,REG_RP,MORENA,2,ALAN ANDRE VENEGAS PEREZ,2,CANDIDATURAS DE PERSONAS  JOVENES,,MORENA
2,32,ZACATECAS,,,19,JALPA,,,PRES_MUN,PAN_PRI_PRD,1,OLEGARIO VIRAMONTES GOMEZ,1,,,PAN
2,32,ZACATECAS,,,19,JALPA,,,SIND,PAN_PRI_PRD,1,IRENE RODRIGUEZ ESCOT,2,,,PAN
2,32,ZACATECAS,,,19,JALPA,,,REG,PAN_PRI_PRD,1,ROBERTO ELIZALDE TOSTADO,1,,,PAN
2,32,ZACATECAS,,,19,JALPA,,,REG,PAN_PRI_PRD,2,NYDIA IBETH GRIJALVA ROMO,2,,,PAN
2,32,ZACATECAS,,,19,JALPA,,,REG,PAN_PRI_PRD,3,JOSE ANTONIO GOMEZ MEDINA,1,CANDIDATURAS DE PERSONAS  JOVENES,,PAN
2,32,ZACATECAS,,,19,JALPA,,,REG,PAN_PRI_PRD,4,SAYRA HERNANDEZ MELCHOR,2,CANDIDATURAS DE PERSONAS  JOVENES,,PRI
2,32,ZACATECAS,,,19,JALPA,,,REG,PAN_PRI_PRD,5,ARNULFO HERNANDEZ JIMENEZ,1,,,PRI
2,32,ZACATECAS,,,19,JALPA,,,REG,PAN_PRI_PRD,6,AZUCENA LEDEZMA HERNANDEZ,2,,,PRI
2,32,ZACATECAS,,,19,JALPA,,,REG_RP,MORENA,1,PAMELA  VIRIDIANA VALENZUELA CISNEROS,2,CANDIDATURAS DE PERSONAS  JOVENES,,MORENA
2,32,ZACATECAS,,,19,JALPA,,,REG_RP,MORENA,1,ALBERTO JAVIER REYES PINELO,1,,,MORENA
2,32,ZACATECAS,,,19,JALPA,,,REG_RP,PT,1,ANA ELIZABETH LLAMAS MOJARRO,2,,,PT
2,32,ZACATECAS,,,19,JALPA,,,REG_RP,MC,1,LORENA VALDEZ MARTINEZ,2,,,MC
2,32,ZACATECAS,,,20,JEREZ,,,PRES_MUN,PRD,1,RODRIGO UREÑO BAÑUELOS,1,,,PRD
2,32,ZACATECAS,,,20,JEREZ,,,SIND,PRD,1,SUSANA DE LA TORRE ARGÜELLES,2,,,PRD
2,32,ZACATECAS,,,20,JEREZ,,,REG,PRD,1,HEBERT HORACIO HERRERA CORONEL,1,CANDIDATURAS DE PERSONAS  JOVENES,,PRD
2,32,ZACATECAS,,,20,JEREZ,,,REG,PRD,2,HARAYDEE LOZANO GOMEZ,2,CANDIDATURAS DE PERSONAS  JOVENES,,PRD
2,32,ZACATECAS,,,20,JEREZ,,,REG,PRD,3,JAVIER LUNA PEREZ,1,,,PRD
2,32,ZACATECAS,,,20,JEREZ,,,REG,PRD,4,MARIA DEL CARMEN LOZANO DIAZ,2,,,PRD
2,32,ZACATECAS,,,20,JEREZ,,,REG,PRD,5,VICTOR MARIN GAMBOA,1,,,PRD
2,32,ZACATECAS,,,20,JEREZ,,,REG,PRD,6,SOLEDAD SALAS FLORES,2,,,PRD
2,32,ZACATECAS,,,20,JEREZ,,,REG,PRD,7,JUAN MANUEL GARCIA GARCIA,1,,,PRD
2,32,ZACATECAS,,,20,JEREZ,,,REG_RP,PAN,1,FABIOLA SALAZAR DELGADO,2,,,PAN
2,32,ZACATECAS,,,20,JEREZ,,,REG_RP,PAN,2,DIONICIO SALDIVAR,1,CANDIDATURA DE LA DIVERSIDAD SEXUAL,,PAN
2,32,ZACATECAS,,,20,JEREZ,,,REG_RP,MORENA,1,MYRIAM CARRILLO GARAY,2,CANDIDATURAS DE PERSONAS  JOVENES,,MORENA
2,32,ZACATECAS,,,20,JEREZ,,,REG_RP,PRI,2,MARIA REYES SIFUENTES CARRERA,2,,,PRI
2,32,ZACATECAS,,,20,JEREZ,,,REG_RP,FMZ,2,JAVIER CABRAL HERNANDEZ,1,,,FMZ
2,32,ZACATECAS,,,21,JIMENEZ DEL TEUL ,,,PRES_MUN,PT,1,DANIEL CISNEROS ESPARZA,1,,,PT
2,32,ZACATECAS,,,21,JIMENEZ DEL TEUL ,,,SIND,PT,1,MARIA PIÑA ACEVEDO,2,,,PT
2,32,ZACATECAS,,,21,JIMENEZ DEL TEUL ,,,REG,PT,1,VICENTE CHAVEZ HERNANDEZ,1,,,PT
2,32,ZACATECAS,,,21,JIMENEZ DEL TEUL ,,,REG,PT,2,IRMA RODARTE SANCHEZ,2,,,PT
2,32,ZACATECAS,,,21,JIMENEZ DEL TEUL ,,,REG,PT,3,RAMIRO AGUIRRE CISNEROS,1,CANDIDATURAS DE PERSONAS  JOVENES,,PT
2,32,ZACATECAS,,,21,JIMENEZ DEL TEUL ,,,REG,PT,4,JOANA CRISTINA TORRES GALLEGOS,2,CANDIDATURAS DE PERSONAS  JOVENES,,PT
2,32,ZACATECAS,,,21,JIMENEZ DEL TEUL ,,,REG_RP,PRI,1,DIANA LAURA ROSALES CHAVEZ,2,CANDIDATURAS DE PERSONAS  JOVENES,,PRI
2,32,ZACATECAS,,,21,JIMENEZ DEL TEUL ,,,REG_RP,PRI,2,ANGEL BRAYAN RODRIGUEZ CAMPOS,1,CANDIDATURAS DE PERSONAS  JOVENES,,PRI
2,32,ZACATECAS,,,21,JIMENEZ DEL TEUL ,,,REG_RP,MORENA,1,MARICELA HERRERA VAZQUEZ,2,,,MORENA
2,32,ZACATECAS,,,22,JUAN ALDAMA,,,PRES_MUN,PVEM_MORENA,1,MARIA GRISELDA ROMERO ZUÑIGA,2,,,MORENA
2,32,ZACATECAS,,,22,JUAN ALDAMA,,,SIND,PVEM_MORENA,1,GENARO AZAEL VALLES ARREDONDO,1,CANDIDATURAS DE PERSONAS  JOVENES,,MORENA
2,32,ZACATECAS,,,22,JUAN ALDAMA,,,REG,PVEM_MORENA,1,CECILIA ORTEGA SERRANO,2,,,MORENA
2,32,ZACATECAS,,,22,JUAN ALDAMA,,,REG,PVEM_MORENA,2,SILVERIO MISSAEL ESPINOSA SANDOVAL,1,CANDIDATURAS DE PERSONAS  JOVENES,,MORENA
2,32,ZACATECAS,,,22,JUAN ALDAMA,,,REG,PVEM_MORENA,3,SUSANA YANETH NIÑO GARCIA,2,CANDIDATURAS DE PERSONAS  JOVENES,,MORENA
2,32,ZACATECAS,,,22,JUAN ALDAMA,,,REG,PVEM_MORENA,4,MIGUEL SOTO FRAIRE,1,,,MORENA
2,32,ZACATECAS,,,22,JUAN ALDAMA,,,REG,PVEM_MORENA,5,KARLA YOLANDA RIOS ENRIQUEZ,2,,,MORENA
2,32,ZACATECAS,,,22,JUAN ALDAMA,,,REG,PVEM_MORENA,6,IRWING JOSE GUERRERO RAMOS,1,CANDIDATURAS DE PERSONAS  JOVENES,,MORENA
2,32,ZACATECAS,,,22,JUAN ALDAMA,,,REG_RP,PRI,1,SONIA SERRANO HERRERA,2,,,PRI
2,32,ZACATECAS,,,22,JUAN ALDAMA,,,REG_RP,PRI,2,EDGAR ROBERTO CHAIREZ GARCIA,1,,,PRI
