CIRCUNSCRIPCION,ID_ESTADO,NOMBRE_ESTADO,ID_DISTRITO_LOCAL,CABECERA_DISTRITAL_LOCAL,ID_MUNICIPIO,MUNICIPIO,ID_DEMARCACION_LOCAL,DEMARCACION_LOCAL,TIPO_DE_CANDIDATURA,NOMBRE_ACTOR POLITICO,NUMERO_LISTA,PERSONA CANDIDATA,IDENTIDAD_SEXO_GENERICA,ACCION AFIRMATIVA,RUTA_CONSTANCIA,PARTIDO
2,32,ZACATECAS,,,47,TEUL DE GONZALEZ ORTEGA,,,REG,PT,4,ALEJANDRA ZACNITEE RAMIREZ ARELLANO,2,CANDIDATURAS DE PERSONAS  JOVENES,,PT
2,32,ZACATECAS,,,47,TEUL DE GONZALEZ ORTEGA,,,REG_RP,PVEM,1,CYNTHIA GISELLE NAVARRO ACOSTA,2,,,PVEM
2,32,ZACATECAS,,,47,TEUL DE GONZALEZ ORTEGA,,,REG_RP,NAZ,1,RUBITH LIZANDRA ARELLANO MURO,2,CANDIDATURAS DE PERSONAS  JOVENES,,NAZ
2,32,ZACATECAS,,,47,TEUL DE GONZALEZ ORTEGA,,,REG_RP,PRI,2,JORGE HUMBERTO SANDOVAL GONZALEZ,1,,,PRI
2,32,ZACATECAS,,,48,TLALTENANGO DE SANCHEZ ROMAN,,,PRES_MUN,PVEM_MORENA,1,FRANCISCO DELGADO MIRAMONTES,1,,,MORENA
2,32,ZACATECAS,,,48,TLALTENANGO DE SANCHEZ ROMAN,,,SIND,PVEM_MORENA,1,VANIA KARINA QUIROZ ARTEAGA,2,,,MORENA
2,32,ZACATECAS,,,48,TLALTENANGO DE SANCHEZ ROMAN,,,REG,PVEM_MORENA,1,LUIS ALONSO VILLARREAL HARO,1,,,MORENA
2,32,ZACATECAS,,,48,TLALTENANGO DE SANCHEZ ROMAN,,,REG,PVEM_MORENA,2,JESSICA MUÑETON DAMIAN,2,CANDIDATURAS DE PERSONAS  JOVENES,,MORENA
2,32,ZACATECAS,,,48,TLALTENANGO DE SANCHEZ ROMAN,,,REG,PVEM_MORENA,3,RICARDO MAGALLANES CORREA,1,,,MORENA
2,32,ZACATECAS,,,48,TLALTENANGO DE SANCHEZ ROMAN,,,REG,PVEM_MORENA,4,ZENAIDA SEGUNDO LOMA,2,,,MORENA
2,32,ZACATECAS,,,48,TLALTENANGO DE SANCHEZ ROMAN,,,REG,PVEM_MORENA,5,JOVANI RAMIREZ FIGUEROA,1,CANDIDATURAS DE PERSONAS  JOVENES,,MORENA
2,32,ZACATECAS,,,48,TLALTENANGO DE SANCHEZ ROMAN,,,REG,PVEM_MORENA,6,GLORIA YOZETH RUVALCABA AYALA,2,,,MORENA
2,32,ZACATECAS,,,48,TLALTENANGO DE SANCHEZ ROMAN,,,REG_RP,PAN,1,KARLA VANESSA GABRIEL CORVERA,2,,,PAN
2,32,ZACATECAS,,,48,TLALTENANGO DE SANCHEZ ROMAN,,,REG_RP,PAN,2,ABEL CASAS CORNEJO,1,,,PAN
2,32,ZACATECAS,,,48,TLALTENANGO DE SANCHEZ ROMAN,,,REG_RP,PRI,1,MAYRA ACOSTA ORTIZ,2,,,PRI
2,32,ZACATECAS,,,49,VALPARAISO,,,PRES_MUN,PVEM_MORENA,1,MARIA GUADALUPE ORTIZ ROBLES,2,,,MORENA
2,32,ZACATECAS,,,49,VALPARAISO,,,SIND,PVEM_MORENA,1,RAMON GUADALUPE ACUÑA ESCOBEDO,1,,,MORENA
2,32,ZACATECAS,,,49,VALPARAISO,,,REG,PVEM_MORENA,1,ANA MARIA RAMIREZ MEDINA,2,,,MORENA
2,32,ZACATECAS,,,49,VALPARAISO,,,REG,PVEM_MORENA,3,FRANCISCA BARRIOS PITONES,2,,,MORENA
2,32,ZACATECAS,,,49,VALPARAISO,,,REG,PVEM_MORENA,4,JAVIER IVAN RODRIGUEZ RAMIREZ,1,,,MORENA
2,32,ZACATECAS,,,49,VALPARAISO,,,REG,PVEM_MORENA,5,VERENICE CARDENAS JUAREZ,2,CANDIDATURAS DE PERSONAS  JOVENES,,MORENA
2,32,ZACATECAS,,,49,VALPARAISO,,,REG,PVEM_MORENA,6,MARCO ANTONIO PASILLAS RIVAS,1,CANDIDATURAS DE PERSONAS  JOVENES,,MORENA
2,32,ZACATECAS,,,49,VALPARAISO,,,REG,PVEM_MORENA,7,VANESSA BURCIAGA VARGAS,2,,,MORENA
2,32,ZACATECAS,,,49,VALPARAISO,,,REG,PRI,2,JUAN HERNANDEZ FACIO,1,,,PRI
2,32,ZACATECAS,,,49,VALPARAISO,,,REG_RP,PAN,2,LUIS ANGEL MUÑOZ PACHECO,1,,,PAN
2,32,ZACATECAS,,,50,VETAGRANDE,,,PRES_MUN,FMZ,1,JUAN ANTONIO HERRERA MORUA,1,,,FMZ
2,32,ZACATECAS,,,50,VETAGRANDE,,,SIND,FMZ,1,LETICIA CAMPOS ALVARADO,2,,,FMZ
2,32,ZACATECAS,,,50,VETAGRANDE,,,REG,FMZ,1,JOSE DE JESUS AHUMADA MARQUEZ,1,CANDIDATURAS DE PERSONAS  JOVENES,,FMZ
2,32,ZACATECAS,,,50,VETAGRANDE,,,REG,FMZ,2,MA. EUGENIA REYES MAURICIO,2,CANDIDATURAS DE PERSONAS  JOVENES,,FMZ
2,32,ZACATECAS,,,50,VETAGRANDE,,,REG,FMZ,3,ALAN ELISARDO ZAMARRIPA RODRIGUEZ,1,,,FMZ
2,32,ZACATECAS,,,50,VETAGRANDE,,,REG,FMZ,4,MA ELENA VAZQUEZ MARTINEZ,2,,,FMZ
2,32,ZACATECAS,,,50,VETAGRANDE,,,REG,FMZ,5,JOSE ARTURO SANDOVAL NUÑEZ,1,CANDIDATURAS DE PERSONAS  JOVENES,,FMZ
2,32,ZACATECAS,,,50,VETAGRANDE,,,REG,FMZ,6,ALEJANDRA GAYTAN JASSO,2,CANDIDATURAS DE PERSONAS  JOVENES,,FMZ
2,32,ZACATECAS,,,50,VETAGRANDE,,,REG_RP,NAZ,1,MARIA DEL ROCIO ARTEAGA FLORES,2,,,NAZ
2,32,ZACATECAS,,,50,VETAGRANDE,,,REG_RP,NAZ,2,CONRADO RODRIGUEZ ALVARADO,1,,,NAZ
2,32,ZACATECAS,,,50,VETAGRANDE,,,REG_RP,MORENA,1,VANESSA RAMOS SANTOS,2,,,MORENA
2,32,ZACATECAS,,,50,VETAGRANDE,,,REG_RP,PAN,2,JONATHAN GAEL FLORES BERNAL,1,CANDIDATURAS DE PERSONAS  JOVENES,,PAN
2,32,ZACATECAS,,,51,VILLA DE COS,,,PRES_MUN,PAN_PRI_PRD,1,PIER MICHEL RIOS RUIZ,1,,,PRD
2,32,ZACATECAS,,,51,VILLA DE COS,,,SIND,PAN_PRI_PRD,1,MARIBEL LOPEZ RODRIGUEZ,2,,,PRI
2,32,ZACATECAS,,,51,VILLA DE COS,,,REG,PAN_PRI_PRD,1,HUMBERTO RIVERA DELGADILLO,1,,,PAN
2,32,ZACATECAS,,,51,VILLA DE COS,,,REG,PAN_PRI_PRD,2,SITA MOLINA LOPEZ,2,,,PRI
2,32,ZACATECAS,,,51,VILLA DE COS,,,REG,PAN_PRI_PRD,3,JUAN MANUEL DOMINGUEZ GALVEZ,1,CANDIDATURAS DE PERSONAS  JOVENES,,PAN
2,32,ZACATECAS,,,51,VILLA DE COS,,,REG,PAN_PRI_PRD,4,MARIA FERNANDA ANGUIANO RAMOS,2,CANDIDATURAS DE PERSONAS  JOVENES,,PAN
2,32,ZACATECAS,,,51,VILLA DE COS,,,REG,PAN_PRI_PRD,5,VICTOR HUGO JUAREZ SANCHEZ,1,,,PRI
2,32,ZACATECAS,,,51,VILLA DE COS,,,REG,PAN_PRI_PRD,6,MARTINA ESQUIVEL RIOS,2,,,PRI
2,32,ZACATECAS,,,51,VILLA DE COS,,,REG,PAN_PRI_PRD,7,CESAR PARGA TORRES,1,,,PRD
2,32,ZACATECAS,,,51,VILLA DE COS,,,REG_RP,PT,1,KAREN ELIZABETH HERNANDEZ GARCIA,2,,,PT
2,32,ZACATECAS,,,51,VILLA DE COS,,,REG_RP,PT,2,ABELARDO PINALES CHAIREZ,1,,,PT
2,32,ZACATECAS,,,51,VILLA DE COS,,,REG_RP,NAZ,1,SARA CELAYA PARRA,2,,,NAZ
2,32,ZACATECAS,,,51,VILLA DE COS,,,REG_RP,NAZ,2,ERNESTO REYES MARTINEZ,1,,,NAZ
2,32,ZACATECAS,,,51,VILLA DE COS,,,REG_RP,MORENA,1,DIANA LAURA MARTINEZ ALVARADO,2,CANDIDATURAS DE PERSONAS  JOVENES,,MORENA
2,32,ZACATECAS,,,52,VILLA GARCIA,,,PRES_MUN,MC,1,JOSE ERNESTO MORA HURTADO,1,,,MC
2,32,ZACATECAS,,,52,VILLA GARCIA,,,SIND,MC,1,MA. GUADALUPE SERRANO CHAVARRIA,2,,,MC
2,32,ZACATECAS,,,52,VILLA GARCIA,,,REG,MC,1,MARIA GUADALUPE DE LIRA VERDEJA,2,,,MC
2,32,ZACATECAS,,,52,VILLA GARCIA,,,REG,MC,2,ANTONIO CHIQUITO DIAZ DE LEON,1,,,MC
2,32,ZACATECAS,,,52,VILLA GARCIA,,,REG,MC,3,JESSICA ZACARIAS CUEVAS,2,CANDIDATURAS DE PERSONAS  JOVENES,,MC
2,32,ZACATECAS,,,52,VILLA GARCIA,,,REG,MC,4,FAVIAN DIAZ HERRERA,1,,,MC
2,32,ZACATECAS,,,52,VILLA GARCIA,,,REG,MC,5,MAYRA FABIOLA ESQUIVEL ESQUIVEL,2,,,MC
2,32,ZACATECAS,,,52,VILLA GARCIA,,,REG,MC,6,J. GUADALUPE SANTOS FLORES,1,,,MC
2,32,ZACATECAS,,,52,VILLA GARCIA,,,REG_RP,MORENA,1,BERTHA ESQUIVEL PONCE,2,,,MORENA
2,32,ZACATECAS,,,52,VILLA GARCIA,,,REG_RP,MORENA,1,EDGAR FELIPE DE JESUS RINCON CAMPOS,1,,,MORENA
2,32,ZACATECAS,,,52,VILLA GARCIA,,,REG_RP,PRI,1,MARIA ANGELICA SANTOS RODRIGUEZ,2,,,PRI
2,32,ZACATECAS,,,52,VILLA GARCIA,,,REG_RP,PRI,2,ROGELIO GUZMAN GUERRERO,1,,,PRI
2,32,ZACATECAS,,,53,VILLA GONZALEZ ORTEGA,,,PRES_MUN,MORENA,1,MARIA MAGDALENA ALVARADO GARCIA,2,,,MORENA
2,32,ZACATECAS,,,53,VILLA GONZALEZ ORTEGA,,,SIND,MORENA,1,J. ISABEL GONZALEZ REYES,1,,,MORENA
2,32,ZACATECAS,,,53,VILLA GONZALEZ ORTEGA,,,REG,MORENA,1,MARIA FATIMA ALONSO SALAS,2,CANDIDATURAS DE PERSONAS  JOVENES,,MORENA
2,32,ZACATECAS,,,53,VILLA GONZALEZ ORTEGA,,,REG,MORENA,2,AGUSTIN RIVERA IBARRA,1,,,MORENA
2,32,ZACATECAS,,,53,VILLA GONZALEZ ORTEGA,,,REG,MORENA,3,PERLA MARITZA MARTINEZ MARTINEZ,2,,,MORENA
2,32,ZACATECAS,,,53,VILLA GONZALEZ ORTEGA,,,REG,MORENA,4,LAURO VINICIO RODRIGUEZ HERNANDEZ,1,CANDIDATURAS DE PERSONAS  JOVENES,,MORENA
2,32,ZACATECAS,,,53,VILLA GONZALEZ ORTEGA,,,REG,MORENA,5,CINTHIA YANELI RIVERA DELGADO,2,,,MORENA
2,32,ZACATECAS,,,53,VILLA GONZALEZ ORTEGA,,,REG,MORENA,6,GILBERTO MARTINEZ CASTRO,1,,,MORENA
2,32,ZACATECAS,,,53,VILLA GONZALEZ ORTEGA,,,REG_RP,PRD,1,LITZY YARELI BRISEÑO OLIVARES,2,CANDIDATURAS DE PERSONAS  JOVENES,,PRD
2,32,ZACATECAS,,,53,VILLA GONZALEZ ORTEGA,,,REG_RP,MC,1,ELIZABETH MARTINEZ MARTINEZ,2,,,MC
2,32,ZACATECAS,,,53,VILLA GONZALEZ ORTEGA,,,REG_RP,PAN,1,ELIZABETH MAURICIO GONZALEZ,2,,,PAN
2,32,ZACATECAS,,,53,VILLA GONZALEZ ORTEGA,,,REG_RP,FMZ,1,TALIA NAJLA MONSERRAT DELGADILLO GARCIA,2,,,FMZ
2,32,ZACATECAS,,,54,VILLA HIDALGO,,,PRES_MUN,MORENA,1,ELEAZAR GARZA ESCAMILLA,1,,,MORENA
2,32,ZACATECAS,,,54,VILLA HIDALGO,,,SIND,MORENA,1,ANA KARINA ARRIAGA RIVERA,2,,,MORENA
2,32,ZACATECAS,,,54,VILLA HIDALGO,,,REG,MORENA,1,CRISTIAN HUERTA ORTIZ,1,CANDIDATURAS DE PERSONAS  JOVENES,,MORENA
2,32,ZACATECAS,,,54,VILLA HIDALGO,,,REG,MORENA,2,MARTHA ALFARO PALOMO,2,,,MORENA
2,32,ZACATECAS,,,54,VILLA HIDALGO,,,REG,MORENA,3,JUAN SANCHEZ SANCHEZ,1,,,MORENA
2,32,ZACATECAS,,,54,VILLA HIDALGO,,,REG,MORENA,4,ELIZABETH TORRES DELGADO,2,,,MORENA
2,32,ZACATECAS,,,54,VILLA HIDALGO,,,REG,MORENA,5,JUAN MANUEL SALAS BARRON,1,,,MORENA
2,32,ZACATECAS,,,54,VILLA HIDALGO,,,REG,MORENA,6,ROSA ELIZABETH ESCAMILLA SANCHEZ,2,CANDIDATURAS DE PERSONAS  JOVENES,,MORENA
2,32,ZACATECAS,,,54,VILLA HIDALGO,,,REG_RP,PRI,1,REYNA NALLELY PEREZ ESCOGIDO,2,,,PRI
2,32,ZACATECAS,,,54,VILLA HIDALGO,,,REG_RP,PRI,3,TELMA MICHEL PEREZ ESCOGIDO,2,CANDIDATURAS DE PERSONAS  JOVENES,,PRI
2,32,ZACATECAS,,,54,VILLA HIDALGO,,,REG_RP,PRI,2,RENE MARIN SANCHEZ,1,,,PRI
2,32,ZACATECAS,,,54,VILLA HIDALGO,,,REG_RP,PRI,1,GERARDO SANCHEZ VERGARA,1,CANDIDATURAS DE PERSONAS  JOVENES,,PRI
2,32,ZACATECAS,,,55,VILLANUEVA,,,PRES_MUN,PVEM_MORENA,1,ROGELIO GONZALEZ ALVAREZ,1,,,MORENA
2,32,ZACATECAS,,,55,VILLANUEVA,,,SIND,PVEM_MORENA,1,SANDRA HERNANDEZ ESCOBEDO,2,,,MORENA
2,32,ZACATECAS,,,55,VILLANUEVA,,,REG,PVEM_MORENA,1,OMAR AVILA RODRIGUEZ,1,,,MORENA
2,32,ZACATECAS,,,55,VILLANUEVA,,,REG,PVEM_MORENA,2,ALEJANDRA REYES ORTEGA,2,CANDIDATURAS DE PERSONAS  JOVENES,,MORENA
2,32,ZACATECAS,,,55,VILLANUEVA,,,REG,PVEM_MORENA,3,JUAN LEYVA ALBINO,1,,,MORENA
2,32,ZACATECAS,,,55,VILLANUEVA,,,REG,PVEM_MORENA,4,MAYRA GONZALEZ FERNANDEZ,2,,,MORENA
2,32,ZACATECAS,,,55,VILLANUEVA,,,REG,PVEM_MORENA,5,ADRIEL GUADALUPE MEDINA DE LEON,1,CANDIDATURAS DE PERSONAS  JOVENES,,MORENA
2,32,ZACATECAS,,,55,VILLANUEVA,,,REG,PVEM_MORENA,6,NORMA MELENDREZ ALMARAZ,2,,,MORENA
2,32,ZACATECAS,,,55,VILLANUEVA,,,REG,PVEM_MORENA,1,MANUEL MURILLO ORTEGA,1,,,MORENA
2,32,ZACATECAS,,,55,VILLANUEVA,,,REG_RP,PRD,1,JUANA YESENIA ORENDAY PASILLAS,2,,,PRD
2,32,ZACATECAS,,,55,VILLANUEVA,,,REG_RP,PRD,3,MAYRA VAZQUEZ JAIMES,2,,,PRD
2,32,ZACATECAS,,,55,VILLANUEVA,,,REG_RP,PRD,2,CARLOS EDUARDO TORRES PEREZ,1,CANDIDATURAS DE PERSONAS  JOVENES,,PRD
2,32,ZACATECAS,,,55,VILLANUEVA,,,REG_RP,PRD,4,SAMUEL ROBLES SALAMANCA,1,,,PRD
2,32,ZACATECAS,,,55,VILLANUEVA,,,REG_RP,PAN,1,KARINA AGUAYO MURO,2,,,PAN
2,32,ZACATECAS,,,56,ZACATECAS,,,PRES_MUN,PAN_PRI_PRD,1,MIGUEL ANGEL VARELA PINEDO,1,,,PAN
2,32,ZACATECAS,,,56,ZACATECAS,,,SIND,PAN_PRI_PRD,1,WENDY GUADALUPE VALDEZ ORGANISTA,2,,,PAN
2,32,ZACATECAS,,,56,ZACATECAS,,,REG,PAN_PRI_PRD,1,REGINALDO AVILA ARCINIAGA,1,,,PRI
2,32,ZACATECAS,,,56,ZACATECAS,,,REG,PAN_PRI_PRD,2,CLAUDIA ANAYA VAZQUEZ,2,,,PRD
2,32,ZACATECAS,,,56,ZACATECAS,,,REG,PAN_PRI_PRD,3,BERNARDO IBARRA JUAREZ,1,,,PRI
2,32,ZACATECAS,,,56,ZACATECAS,,,REG,PAN_PRI_PRD,4,MARIANA ANAYA MOTA,2,,,PRI
2,32,ZACATECAS,,,56,ZACATECAS,,,REG,PAN_PRI_PRD,5,CARMEN ANGELICA LIRA SANDOVAL,2,CANDIDATURAS DE PERSONAS  JOVENES,,
2,32,ZACATECAS,,,56,ZACATECAS,,,REG,PAN_PRI_PRD,6,ANDREA LOPEZ DE LARA FUENTES,2,CANDIDATURAS DE PERSONAS  JOVENES,,
2,32,ZACATECAS,,,56,ZACATECAS,,,REG,PAN_PRI_PRD,7,OSCAR CONTRERAS VAZQUEZ,1,,,
2,32,ZACATECAS,,,56,ZACATECAS,,,REG,PAN_PRI_PRD,8,MARCELA ALATORRE ZESATI,2,,,
2,32,ZACATECAS,,,56,ZACATECAS,,,REG_RP,MORENA,2,CHRISTIAN MARTINEZ ROSALES,1,,,MORENA
2,32,ZACATECAS,,,56,ZACATECAS,,,REG_RP,MORENA,1,SANDRA VERONICA BAEZ ALMANZA,2,,,MORENA
2,32,ZACATECAS,,,56,ZACATECAS,,,REG_RP,MC,2,DAVID ARTURO GARCIA LIRA,1,,,MC
2,32,ZACATECAS,,,56,ZACATECAS,,,REG_RP,MC,1,JESSICA ASTRID JAYME MAGAÑA,2,,,MC
2,32,ZACATECAS,,,56,ZACATECAS,,,REG_RP,PVEM,2,JUAN CARLOS GONZALEZ GANDARA,1,CANDIDATURAS DE PERSONAS  JOVENES,,PVEM
2,32,ZACATECAS,,,56,ZACATECAS,,,REG_RP,FMZ,1,JUAN DIEGO GARCIA CRUZ,1,CANDIDATURAS DE PERSONAS  JOVENES,,FMZ
2,32,ZACATECAS,,,57,TRANCOSO,,,PRES_MUN,PT,1,ANTONIO ROCHA ROMO,1,,,PT
2,32,ZACATECAS,,,57,TRANCOSO,,,SIND,PT,1,NIDIA CAROLINA BARRON BORREGO,2,,,PT
2,32,ZACATECAS,,,57,TRANCOSO,,,REG,PT,1,LUIS DANIEL DE LA TORRE JUAREZ,1,CANDIDATURAS DE PERSONAS  JOVENES,,PT
2,32,ZACATECAS,,,57,TRANCOSO,,,REG,PT,2,PETRA PIÑA LOPEZ,2,,,PT
2,32,ZACATECAS,,,57,TRANCOSO,,,REG,PT,3,BENJAMIN RUVALCABA OROZCO,1,CANDIDATURAS DE PERSONAS  JOVENES,,PT
2,32,ZACATECAS,,,57,TRANCOSO,,,REG,PT,4,BEATRIZ ADRIANA MARTINEZ GALLARDO,2,,,PT
2,32,ZACATECAS,,,57,TRANCOSO,,,REG,PT,5,MARIA DEL REFUGIO VELAZQUEZ JACOBO,1,,,PT
2,32,ZACATECAS,,,57,TRANCOSO,,,REG,PT,6,MARIA CONCEPCION LOPEZ CUEVAS,2,CANDIDATURAS DE PERSONAS  JOVENES,,PT
2,32,ZACATECAS,,,57,TRANCOSO,,,REG_RP,MORENA,2,ISSAC DE JESUS RIVERA CORTEZ,1,CANDIDATURAS DE PERSONAS  JOVENES,,MORENA
2,32,ZACATECAS,,,57,TRANCOSO,,,REG_RP,MORENA,1,CLAUDIA ILDA OLIVA LOPEZ,2,,,MORENA
2,32,ZACATECAS,,,57,TRANCOSO,,,REG_RP,PRD,1,LAURA ALICIA HERNANDEZ CORDERO,2,,,PRD
2,32,ZACATECAS,,,58,SANTA MARIA DE LA PAZ,,,PRES_MUN,MC,1,YOALLI MAGALLANES VELAZQUEZ,2,CANDIDATURAS DE PERSONAS  JOVENES,,MC
2,32,ZACATECAS,,,58,SANTA MARIA DE LA PAZ,,,SIND,MC,1,JORGE LUIS ESCOBEDO MEDINA,1,,,MC
2,32,ZACATECAS,,,58,SANTA MARIA DE LA PAZ,,,REG,MC,1,MAGDALENA IBAÑEZ NUÑEZ,2,,,MC
2,32,ZACATECAS,,,58,SANTA MARIA DE LA PAZ,,,REG,MC,2,JOEL ARTURO DE LA ROSA RAMIREZ,1,CANDIDATURAS DE PERSONAS  JOVENES,,MC
2,32,ZACATECAS,,,58,SANTA MARIA DE LA PAZ,,,REG,MC,3,ISAMAR GONZALEZ BAÑUELOS,2,CANDIDATURAS DE PERSONAS  JOVENES,,MC
2,32,ZACATECAS,,,58,SANTA MARIA DE LA PAZ,,,REG,MC,4,ARMANDO CERVANTES GOMEZ,1,,,MC
2,32,ZACATECAS,,,58,SANTA MARIA DE LA PAZ,,,REG_RP,PAN,2,ESTELA CARLOS CARLOS,2,,,PAN
2,32,ZACATECAS,,,58,SANTA MARIA DE LA PAZ,,,REG_RP,PAN,1,JOSE MANUEL GONZALEZ DORADO,1,CANDIDATURA DE LA DIVERSIDAD SEXUAL,,PAN
