CIRCUNSCRIPCION,ID_ESTADO,NOMBRE_ESTADO,ID_DISTRITO_LOCAL,CABECERA_DISTRITAL_LOCAL,ID_MUNICIPIO,MUNICIPIO,ID_DEMARCACION_LOCAL,DEMARCACION_LOCAL,TIPO_DE_CANDIDATURA,NOMBRE_ACTOR_POLITICO,NUMERO_LISTA,PERSONA_CANDIDATA,IDENTIDAD_SEXO_GENERICA,ACCION_AFIRMATIVA,RUTA_CONSTANCIA,PARTIDO_POLITICO
1,14,JALISCO,,,,,,,GOB,MC,1,JESUS PABLO LEMUS NAVARRO,1,,,MC
1,14,JALISCO,1,TEQUILA,,,,,DIP_LOC_MR,PVEM_PT_MORENA_HAGAMOS_FUTURO,1,SERGIO MIGUEL MARTIN CASTELLANOS,1,,,PT
1,14,JALISCO,2,LAGOS DE MORENO,,,,,DIP_LOC_MR,PAN_PRI_PRD,1,JULIO CESAR HURTADO LUNA,1,,,PAN
1,14,JALISCO,3,TEPATITLAN DE MORELOS,,,,,DIP_LOC_MR,PAN_PRI_PRD,1,MARCO TULIO MOYA DIAZ,1,,,PAN
1,14,JALISCO,4,ZAPOPAN,,,,,DIP_LOC_MR,PVEM_PT_MORENA_HAGAMOS_FUTURO,1,TONANTZIN ELUSAY CARDENAS MENDEZ,2,,,FUTURO
1,14,JALISCO,5,PUERTO VALLARTA,,,,,DIP_LOC_MR,PVEM_PT_MORENA_HAGAMOS_FUTURO,1,YUSSARA ELIZABETH CANALES GONZALEZ,2,,,PVEM
1,14,JALISCO,6,ZAPOPAN,,,,,DIP_LOC_MR,MC,1,LAURA GABRIELA CARDENAS RODRIGUEZ,2,,,MC
1,14,JALISCO,7,TONALA,,,,,DIP_LOC_MR,PVEM_PT_MORENA_HAGAMOS_FUTURO,1,MARTA ESTELA ARIZMENDI FOMBONA,2,,,MORENA
1,14,JALISCO,8,GUADALAJARA,,,,,DIP_LOC_MR,MC,1,PRISCILLA FRANCO BARBA,2,,,MC
1,14,JALISCO,9,GUADALAJARA,,,,,DIP_LOC_MR,PVEM_PT_MORENA_HAGAMOS_FUTURO,1,ITZUL BARRERA RODRIGUEZ,2,,,MORENA
1,14,JALISCO,10,ZAPOPAN,,,,,DIP_LOC_MR,MC,1,MONICA PAOLA MAGAÑA MENDOZA,2,,,MC
1,14,JALISCO,11,GUADALAJARA,,,,,DIP_LOC_MR,PVEM_PT_MORENA_HAGAMOS_FUTURO,1,ITZCOATL TONATIUH BRAVO PADILLA,1,,,HAGAMOS
1,14,JALISCO,12,TLAJOMULCO DE ZUÑIGA,,,,,DIP_LOC_MR,MC,1,ADRIANA GABRIELA MEDINA ORTIZ,2,,,MC
1,14,JALISCO,13,SAN PEDRO TLAQUEPAQUE,,,,,DIP_LOC_MR,PVEM_PT_MORENA_HAGAMOS_FUTURO,1,LEONARDO ALMAGUER CASTAÑEDA,1,,,PT
1,14,JALISCO,14,TLAJOMULCO DE ZUÑIGA,,,,,DIP_LOC_MR,PVEM_PT_MORENA_HAGAMOS_FUTURO,1,MARIANA CASILLAS GUERRERO,2,CANDIDATURAS DE PERSONAS JOVENES,,FUTURO
1,14,JALISCO,15,LA BARCA,,,,,DIP_LOC_MR,PAN_PRI_PRD,1,JOSE AURELIO FONSECA OLIVARES,1,,,PRI
1,14,JALISCO,16,SAN PEDRO TLAQUEPAQUE,,,,,DIP_LOC_MR,PVEM_PT_MORENA_HAGAMOS_FUTURO,1,ALBERTO ALFARO GARCIA,1,,,MORENA
1,14,JALISCO,17,JOCOTEPEC,,,,,DIP_LOC_MR,PVEM_PT_MORENA_HAGAMOS_FUTURO,1,JOSE GUADALUPE BUENROSTRO MARTINEZ,1,,,PVEM
1,14,JALISCO,18,AUTLAN DE NAVARRO,,,,,DIP_LOC_MR,PVEM_PT_MORENA_HAGAMOS_FUTURO,1,EDGAR ENRIQUE VELAZQUEZ GONZALEZ,1,,,HAGAMOS
1,14,JALISCO,19,ZAPOTLAN EL GRANDE,,,,,DIP_LOC_MR,PVEM_PT_MORENA_HAGAMOS_FUTURO,1,ALEJANDRO BARRAGAN SANCHEZ,1,,,MORENA
1,14,JALISCO,20,TONALA,,,,,DIP_LOC_MR,PVEM_PT_MORENA_HAGAMOS_FUTURO,1,VALERIA GUADALUPE AVILA GUTIERREZ,2,,,HAGAMOS
1,14,JALISCO,3,TEPATITLAN DE MORELOS,,,,,DIP_LOC_RP,PVEM_PT_MORENA_HAGAMOS_FUTURO,1,MARTIN FRANCO CUEVAS,1,,,MORENA
1,14,JALISCO,4,ZAPOPAN,,,,,DIP_LOC_RP,MC,1,ALEJANDRA MARGARITA GIADANS VALENZUELA,2,,,MC
1,14,JALISCO,8,GUADALAJARA,,,,,DIP_LOC_RP,PAN_PRI_PRD,1,CESAR OCTAVIO MADRIGAL DIAZ,1,,,PAN
1,14,JALISCO,12,TLAJOMULCO DE ZUÑIGA,,,,,DIP_LOC_RP,PVEM_PT_MORENA_HAGAMOS_FUTURO,1,BRENDA GUADALUPE CARRERA GARCIA,2,,,MORENA
1,14,JALISCO,14,TLAJOMULCO DE ZUÑIGA,,,,,DIP_LOC_RP,MC,1,LUIS OCTAVIO VIDRIO MARTINEZ,1,,,MC
1,14,JALISCO,,,,,,,DIP_LOC_RP,MORENA,1,MARIA CANDELARIA OCHOA AVALOS,2,,,MORENA
1,14,JALISCO,,,,,,,DIP_LOC_RP,MORENA,2,EMMANUEL ALEJANDRO PUERTO COVARRUBIAS,1,CANDIDATURAS DE PERSONAS JOVENES,,MORENA
1,14,JALISCO,,,,,,,DIP_LOC_RP,MORENA,5,NORMA LOPEZ RAMIREZ,2,CANDIDATURAS DE LA DIVERSIDAD SEXUAL,,MORENA
1,14,JALISCO,,,,,,,DIP_LOC_RP,MORENA,4,MIGUEL DE LA ROSA FIGUEROA,1,,,MORENA
1,14,JALISCO,,,,,,,DIP_LOC_RP,MC,1,VERONICA MAGDALENA JIMENEZ VAZQUEZ,2,,,MC
1,14,JALISCO,,,,,,,DIP_LOC_RP,MC,2,SALVADOR ZAMORA ZAMORA,1,,,MC
1,14,JALISCO,,,,,,,DIP_LOC_RP,MC,4,JOSE LUIS TOSTADO BASTIDAS,1,,,MC
1,14,JALISCO,,,,,,,DIP_LOC_RP,MC,5,ESTHER MONTSERRAT PEREZ CISNEROS,2,CANDIDATURAS DE LA DIVERSIDAD SEXUAL,,MC
1,14,JALISCO,,,,,,,DIP_LOC_RP,MC,6,OMAR ENRIQUE CERVANTES RIVERA,1,,,MC
1,14,JALISCO,,,,,,,DIP_LOC_RP,PAN,1,CLAUDIA MURGUIA TORRES,2,,,PAN
1,14,JALISCO,,,,,,,DIP_LOC_RP,PAN,2,ISAIAS CORTES BERUMEN,1,,,PAN
1,14,JALISCO,,,,,,,DIP_LOC_RP,PRI,1,MARIA DEL REFUGIO CAMARENA JAUREGUI,2,,,PRI
1,14,JALISCO,,,,,,,DIP_LOC_RP,PRI,3,ALONDRA GETSEMANY FAUSTO DE LEON,2,,,PRI
1,14,JALISCO,,,1,ACATIC,,,PRES_MUN,MC,1,SANDRA CASTAÑEDA ALATORRE,2,,,MC
1,14,JALISCO,,,1,ACATIC,,,REG_MR,MC,2,RAMON PAREDES GUERRERO,1,,,MC
1,14,JALISCO,,,1,ACATIC,,,REG_MR,MC,3,CONSUELO PEREZ MUÑOZ,2,,,MC
1,14,JALISCO,,,1,ACATIC,,,REG_MR,MC,4,RAFAEL HERNANDEZ LOPEZ,1,,,MC
1,14,JALISCO,,,1,ACATIC,,,SIND_MR,MC,5,SUSANA CONCEPCION ALVARADO RAYGOZA,2,,,MC
1,14,JALISCO,,,1,ACATIC,,,REG_MR,MC,6,ESTEBAN ANTONIO MALDONADO RIVERA,1,CANDIDATURAS DE PERSONAS JOVENES,,MC
1,14,JALISCO,,,1,ACATIC,,,REG_MR,MC,7,KAREN DAYANA NAVARRO ALVARADO,2,,,MC
1,14,JALISCO,,,1,ACATIC,,,REG_RP,PAN_PRI_PRD,1,OLIVERIO ESAU MOYA DIAZ,1,CANDIDATURAS DE PERSONAS JOVENES,,PAN
1,14,JALISCO,,,1,ACATIC,,,REG_RP,PAN_PRI_PRD,2,MARIA DEL REFUGIO GUTIERREZ HERNANDEZ,2,,,PAN
1,14,JALISCO,,,1,ACATIC,,,REG_RP,PVEM_PT_MORENA_HAGAMOS_FUTURO,1,CLAUDIA CECILIA FLORES SALCEDO,2,,,HAGAMOS
1,14,JALISCO,,,1,ACATIC,,,REG_RP,PVEM_PT_MORENA_HAGAMOS_FUTURO,2,J JESUS DIAZ REAL,1,,,HAGAMOS
1,14,JALISCO,,,2,ACATLAN DE JUAREZ,,,PRES_MUN,MC,1,JAIME ENRIQUE VELASCO LOPEZ,1,,,MC
1,14,JALISCO,,,2,ACATLAN DE JUAREZ,,,SIND_MR,MC,2,ITSEL ESTEFANIA SEDANO MORENO,2,CANDIDATURAS DE PERSONAS JOVENES,,MC
1,14,JALISCO,,,2,ACATLAN DE JUAREZ,,,REG_MR,MC,3,JUAN CARLOS MOSQUEDA GARCIA,1,,,MC
1,14,JALISCO,,,2,ACATLAN DE JUAREZ,,,REG_MR,MC,4,NARDA MARIBEL MONTES ECHAURY,2,,,MC
1,14,JALISCO,,,2,ACATLAN DE JUAREZ,,,REG_MR,MC,5,CRISTHIAN OMAR DE LA O MARTINEZ,1,,,MC
1,14,JALISCO,,,2,ACATLAN DE JUAREZ,,,REG_MR,MC,6,ALEJANDRA ELIZABETH GARCIA FLORES,2,,,MC
1,14,JALISCO,,,2,ACATLAN DE JUAREZ,,,REG_MR,MC,7,J GUADALUPE GONZALEZ PONCE,1,,,MC
1,14,JALISCO,,,2,ACATLAN DE JUAREZ,,,REG_RP,PAN_PRI_PRD,2,GABRIELA TORRES ROMAN,2,,,PAN
1,14,JALISCO,,,2,ACATLAN DE JUAREZ,,,REG_RP,MORENA,1,MARIA DE LA LUZ SANTANA MONTES,2,,,MORENA
1,14,JALISCO,,,2,ACATLAN DE JUAREZ,,,REG_RP,PT,1,JUAN CARLOS GARCIA IBARRA,1,CANDIDATURAS DE PERSONAS JOVENES,,PT
1,14,JALISCO,,,2,ACATLAN DE JUAREZ,,,REG_RP,PVEM,1,HECTOR HERNANDEZ MORENO,1,,,PVEM
1,14,JALISCO,,,3,AHUALULCO DE MERCADO,,,PRES_MUN,MC,1,JOSE BLADIMIR ARREOLA ALVAREZ,1,,,MC
1,14,JALISCO,,,3,AHUALULCO DE MERCADO,,,REG_MR,MC,2,MARIA NOELIA VALDEZ ARANDA,2,,,MC
1,14,JALISCO,,,3,AHUALULCO DE MERCADO,,,REG_MR,MC,3,FRANCISCO RAFAEL HERNANDEZ JIMENEZ,1,CANDIDATURAS DE PERSONAS JOVENES,,MC
1,14,JALISCO,,,3,AHUALULCO DE MERCADO,,,REG_MR,MC,4,LORENA CASTILLO RUIZ,2,,,MC
1,14,JALISCO,,,3,AHUALULCO DE MERCADO,,,REG_MR,MC,5,JESSICA FAVIOLA SANDOVAL PEREZ,2,,,MC
1,14,JALISCO,,,3,AHUALULCO DE MERCADO,,,SIND_MR,MC,6,MARIA LORENA TAPIA RANGEL,2,,,MC
1,14,JALISCO,,,3,AHUALULCO DE MERCADO,,,REG_MR,MC,7,ABEL GALLEGOS MEDINA,1,,,MC
1,14,JALISCO,,,3,AHUALULCO DE MERCADO,,,REG_RP,PAN_PRI_PRD,1,CESAR ARTURO COBIAN LOPEZ,1,,,PRI
1,14,JALISCO,,,3,AHUALULCO DE MERCADO,,,REG_RP,PAN_PRI_PRD,2,LILIA CAMACHO NUÑO,2,,,PRI
1,14,JALISCO,,,3,AHUALULCO DE MERCADO,,,REG_RP,PAN_PRI_PRD,3,LUIS ANTONIO SANCHEZ OROZCO,1,CANDIDATURAS DE PERSONAS JOVENES,,PRI
1,14,JALISCO,,,3,AHUALULCO DE MERCADO,,,REG_RP,PVEM_PT_MORENA_HAGAMOS_FUTURO,1,PEDRO RAMSES LUPERCIO HERNANDEZ,1,CANDIDATURAS DE PERSONAS JOVENES,,MORENA
1,14,JALISCO,,,4,AMACUECA,,,PRES_MUN,MC,1,NERI QUINTERO BARRAGAN,1,,,MC
1,14,JALISCO,,,4,AMACUECA,,,REG_MR,MC,2,JOSEFINA GARCIA BARRAGAN,2,,,MC
1,14,JALISCO,,,4,AMACUECA,,,REG_MR,MC,3,ROBERTO CASTILLO VILLAVICENCIO,1,,,MC
1,14,JALISCO,,,4,AMACUECA,,,SIND_MR,MC,4,MA GUADALUPE CRISTOBAL HERNANDEZ,2,,,MC
1,14,JALISCO,,,4,AMACUECA,,,REG_MR,MC,5,SALVADOR FLORES FAJARDO,1,,,MC
1,14,JALISCO,,,4,AMACUECA,,,REG_MR,MC,6,MARIBEL ELIAZER SANTANA ASENCIO,2,,,MC
1,14,JALISCO,,,4,AMACUECA,,,REG_MR,MC,7,FRANCISCO JAVIER ROBLES MARTINEZ,1,CANDIDATURAS DE PERSONAS JOVENES,,MC
1,14,JALISCO,,,4,AMACUECA,,,REG_RP,PAN_PRI_PRD,1,PERLA VERONICA PINTO PINTO,2,,,PRD
1,14,JALISCO,,,4,AMACUECA,,,REG_RP,PAN_PRI_PRD,2,VICTOR PEDRO RODRIGUEZ JUAREZ,1,,,PRD
1,14,JALISCO,,,4,AMACUECA,,,REG_RP,PVEM_PT_MORENA_HAGAMOS_FUTURO,1,MARIA SOLEDAD OLIVARES MARQUEZ,2,,,MORENA
1,14,JALISCO,,,4,AMACUECA,,,REG_RP,PVEM_PT_MORENA_HAGAMOS_FUTURO,2,LEONIDES AGUILAR FLORES,1,,,MORENA
1,14,JALISCO,,,5,AMATITAN,,,PRES_MUN,MC,1,LIONEL PARTIDA ORTIZ,1,,,MC
1,14,JALISCO,,,5,AMATITAN,,,SIND_MR,MC,2,VANESSA ALEJANDRA COVARRUBIAS GONZALEZ,2,,,MC
1,14,JALISCO,,,5,AMATITAN,,,REG_MR,MC,3,YESSICA ANALY RIVERA HERRERA,2,,,MC
1,14,JALISCO,,,5,AMATITAN,,,REG_MR,MC,4,ISAIAS ADAME ALVARADO,1,,,MC
1,14,JALISCO,,,5,AMATITAN,,,REG_MR,MC,5,NORMA PULIDO LOPEZ,2,,,MC
1,14,JALISCO,,,5,AMATITAN,,,REG_MR,MC,6,VICENTE REAL OLIVARES,1,,,MC
1,14,JALISCO,,,5,AMATITAN,,,REG_MR,MC,7,CRUZ FEDERICO SANCHEZ LOPEZ,1,CANDIDATURAS DE PERSONAS JOVENES,,MC
1,14,JALISCO,,,5,AMATITAN,,,REG_RP,MORENA,1,JOSUE SAUL PEREZ OCAMPO,1,,,MORENA
1,14,JALISCO,,,5,AMATITAN,,,REG_RP,MORENA,2,LILIANA RAMIREZ RIVERA,2,,,MORENA
1,14,JALISCO,,,5,AMATITAN,,,REG_RP,MORENA,3,JAIME RODRIGUEZ LOPEZ,1,,,MORENA
1,14,JALISCO,,,5,AMATITAN,,,REG_RP,MORENA,4,KARLA DAIANA PARTIDA ONTIVEROS,2,CANDIDATURAS DE PERSONAS JOVENES,,MORENA
1,14,JALISCO,,,6,AMECA,,,PRES_MUN,PVEM_PT_MORENA_HAGAMOS_FUTURO,1,MARTHA CATALINA LOZA CASTRO,2,,,MORENA
1,14,JALISCO,,,6,AMECA,,,SIND_MR,PVEM_PT_MORENA_HAGAMOS_FUTURO,2,VICTOR MANUEL AMADOR RAMOS,1,,,MORENA
1,14,JALISCO,,,6,AMECA,,,REG_MR,PVEM_PT_MORENA_HAGAMOS_FUTURO,3,ESMERALDA RUELAS FERNANDEZ,2,,,MORENA
1,14,JALISCO,,,6,AMECA,,,REG_MR,PVEM_PT_MORENA_HAGAMOS_FUTURO,4,MIGUEL ALEJANDRO MENDOZA AMADOR,1,,,MORENA
1,14,JALISCO,,,6,AMECA,,,REG_MR,PVEM_PT_MORENA_HAGAMOS_FUTURO,5,ANA DEL CARMEN NARANJO AMBRIZ,2,,,MORENA
1,14,JALISCO,,,6,AMECA,,,REG_MR,PVEM_PT_MORENA_HAGAMOS_FUTURO,6,SERGIO HERNANDEZ TORRES,1,CANDIDATURAS DE PERSONAS JOVENES,,MORENA
1,14,JALISCO,,,6,AMECA,,,REG_MR,PVEM_PT_MORENA_HAGAMOS_FUTURO,7,CLAUDIA JUDITH LLANOS PEREZ,2,,,MORENA
1,14,JALISCO,,,6,AMECA,,,REG_MR,PVEM_PT_MORENA_HAGAMOS_FUTURO,8,RAFAEL ALVAREZ BERNAL,1,,,MORENA
1,14,JALISCO,,,6,AMECA,,,REG_MR,PVEM_PT_MORENA_HAGAMOS_FUTURO,9,VANESSA VELASCO CASTELLON,2,,,MORENA
1,14,JALISCO,,,6,AMECA,,,REG_RP,PAN_PRI_PRD,1,VERONICA JUDITH LOPEZ DIAZ,2,,,PRI
1,14,JALISCO,,,6,AMECA,,,REG_RP,MC,1,GABRIELA SERRANO JIMENEZ,2,CANDIDATURAS DE PERSONAS JOVENES,,MC
1,14,JALISCO,,,6,AMECA,,,REG_RP,MC,2,MARIA DEL REFUGIO DELGADILLO CURIEL,2,,,MC
1,14,JALISCO,,,6,AMECA,,,REG_RP,MC,3,ABELARDO RODRIGUEZ RICO,1,,,MC
1,14,JALISCO,,,6,AMECA,,,REG_RP,MC,4,LUZ MARIA RENTERIA SIGALA,2,,,MC
1,14,JALISCO,,,8,ARANDAS,,,PRES_MUN,PVEM_PT_MORENA_HAGAMOS_FUTURO,1,JOSE SOCORRO MARTINEZ VELAZQUEZ,1,,,FUTURO
1,14,JALISCO,,,8,ARANDAS,,,SIND_MR,PVEM_PT_MORENA_HAGAMOS_FUTURO,2,REINA MARIA CAMARENA RODRIGUEZ,2,,,FUTURO
1,14,JALISCO,,,8,ARANDAS,,,REG_MR,PVEM_PT_MORENA_HAGAMOS_FUTURO,3,ISRAEL MATIAS ALVAREZ VILLASEÑOR,1,CANDIDATURAS DE PERSONAS JOVENES,,FUTURO
1,14,JALISCO,,,8,ARANDAS,,,REG_MR,PVEM_PT_MORENA_HAGAMOS_FUTURO,4,ILEANA LOPEZ RAMIREZ,2,,,FUTURO
1,14,JALISCO,,,8,ARANDAS,,,REG_MR,PVEM_PT_MORENA_HAGAMOS_FUTURO,5,JOSE MARTIN JIMENEZ ALVIZO,1,,,FUTURO
1,14,JALISCO,,,8,ARANDAS,,,REG_MR,PVEM_PT_MORENA_HAGAMOS_FUTURO,6,GUADALUPE DE JESUS SAMOANO VALENZUELA,2,,,FUTURO
1,14,JALISCO,,,8,ARANDAS,,,REG_MR,PVEM_PT_MORENA_HAGAMOS_FUTURO,7,JAIME ANTONIO MARTINEZ HERNANDEZ,1,,,FUTURO
1,14,JALISCO,,,8,ARANDAS,,,REG_MR,PVEM_PT_MORENA_HAGAMOS_FUTURO,8,ANA KAREN LEON SANCHEZ,2,,,FUTURO
1,14,JALISCO,,,8,ARANDAS,,,REG_MR,PVEM_PT_MORENA_HAGAMOS_FUTURO,9,ARTURO LOZANO MOJICA,1,,,FUTURO
1,14,JALISCO,,,8,ARANDAS,,,REG_RP,PAN_PRI_PRD,1,MARIA ELENA LOPEZ LOZANO,2,,,PRI
1,14,JALISCO,,,8,ARANDAS,,,REG_RP,PAN_PRI_PRD,3,ANGELICA DEL ROCIO ANGEL VAZQUEZ,2,,,PRI
1,14,JALISCO,,,8,ARANDAS,,,REG_RP,MC,1,RICARDO CORDERO ,1,,,MC
1,14,JALISCO,,,8,ARANDAS,,,REG_RP,MC,2,MARCELA ALEJANDRA BARBA SANCHEZ,2,,,MC
1,14,JALISCO,,,8,ARANDAS,,,REG_RP,MC,3,NAUL ESTEBAN DOMINGUEZ GUERRA,1,,,MC
1,14,JALISCO,,,10,ATEMAJAC DE BRIZUELA,,,PRES_MUN,PVEM_PT_MORENA_HAGAMOS_FUTURO,1,VICTOR MANUEL VAZQUEZ BEAS,1,,,MORENA
1,14,JALISCO,,,10,ATEMAJAC DE BRIZUELA,,,REG_MR,PVEM_PT_MORENA_HAGAMOS_FUTURO,2,CLEOTILDE DE LA CRUZ GUTIERREZ,2,,,MORENA
1,14,JALISCO,,,10,ATEMAJAC DE BRIZUELA,,,REG_MR,PVEM_PT_MORENA_HAGAMOS_FUTURO,3,JUAN DE DIOS DE LA CRUZ DANIEL,1,,,MORENA
1,14,JALISCO,,,10,ATEMAJAC DE BRIZUELA,,,REG_MR,PVEM_PT_MORENA_HAGAMOS_FUTURO,4,HERMINIA SOLORZANO RAMOS,2,,,MORENA
1,14,JALISCO,,,10,ATEMAJAC DE BRIZUELA,,,SIND_MR,PVEM_PT_MORENA_HAGAMOS_FUTURO,5,JOSE EDUARDO MARTINEZ BARTOLO,1,CANDIDATURAS DE DISCAPACIDAD,,MORENA
1,14,JALISCO,,,10,ATEMAJAC DE BRIZUELA,,,REG_MR,PVEM_PT_MORENA_HAGAMOS_FUTURO,6,NORMA AZUCENA PEREZ MARTINEZ,2,CANDIDATURAS DE PERSONAS JOVENES,,MORENA
1,14,JALISCO,,,10,ATEMAJAC DE BRIZUELA,,,REG_MR,PVEM_PT_MORENA_HAGAMOS_FUTURO,7,JUAN MANUEL DE JESUS MENDOZA,1,,,MORENA
1,14,JALISCO,,,10,ATEMAJAC DE BRIZUELA,,,REG_RP,PAN_PRI_PRD,1,DANIELA DURAN DAVILA,2,,,PAN
1,14,JALISCO,,,10,ATEMAJAC DE BRIZUELA,,,REG_RP,PAN_PRI_PRD,2,J FELIX GUTIERREZ MEZA,1,,,PAN
1,14,JALISCO,,,10,ATEMAJAC DE BRIZUELA,,,REG_RP,MC,1,MA FELICITAS AGUILAR IBARRA,2,,,MC
1,14,JALISCO,,,10,ATEMAJAC DE BRIZUELA,,,REG_RP,MC,2,JESUS SEVERIANO PEREZ CAMPOS,1,CANDIDATURAS DE PERSONAS JOVENES,,MC
1,14,JALISCO,,,11,ATENGO,,,PRES_MUN,PVEM_PT_MORENA_HAGAMOS_FUTURO,1,CARLOS PELAYO GONZALEZ,1,,,HAGAMOS
1,14,JALISCO,,,11,ATENGO,,,REG_MR,PVEM_PT_MORENA_HAGAMOS_FUTURO,2,ARCELIA VALLEJO GARCIA,2,CANDIDATURAS DE PERSONAS JOVENES,,HAGAMOS
1,14,JALISCO,,,11,ATENGO,,,REG_MR,PVEM_PT_MORENA_HAGAMOS_FUTURO,3,SERGIO MIRANDA GARCIA,1,CANDIDATURAS DE LA DIVERSIDAD SEXUAL,,HAGAMOS
1,14,JALISCO,,,11,ATENGO,,,SIND_MR,PVEM_PT_MORENA_HAGAMOS_FUTURO,4,MARTHA ELENA CARDENAS GOMEZ,2,,,HAGAMOS
1,14,JALISCO,,,11,ATENGO,,,REG_MR,PVEM_PT_MORENA_HAGAMOS_FUTURO,5,ABEL ALEJANDRO ESTRADA TOPETE,1,,,HAGAMOS
1,14,JALISCO,,,11,ATENGO,,,REG_MR,PVEM_PT_MORENA_HAGAMOS_FUTURO,6,JUDITH ALEJANDRA ADOÑO ORGANISTA,2,,,HAGAMOS
1,14,JALISCO,,,11,ATENGO,,,REG_MR,PVEM_PT_MORENA_HAGAMOS_FUTURO,7,MACLOVIO VALLIN SEDANO,1,,,HAGAMOS
1,14,JALISCO,,,11,ATENGO,,,REG_RP,PAN_PRI_PRD,1,EDITH PONCE FIGUEROA,2,CANDIDATURAS DE PERSONAS JOVENES,,PRI
1,14,JALISCO,,,11,ATENGO,,,REG_RP,PAN_PRI_PRD,2,JESUS NATIVIDAD MORELOS OLMOS,1,,,PRI
1,14,JALISCO,,,11,ATENGO,,,REG_RP,PAN_PRI_PRD,3,CECILIA SUCEL GONZALEZ MEDINA,2,,,PRI
1,14,JALISCO,,,11,ATENGO,,,REG_RP,PAN_PRI_PRD,4,JOSE MORALES CARDENAS,1,,,PRI
1,14,JALISCO,,,12,ATENGUILLO,,,PRES_MUN,MC,1,ROSALIO VILLASEÑOR ALVAREZ,1,,,MC
1,14,JALISCO,,,12,ATENGUILLO,,,REG_MR,MC,2,MARTHA LETICIA HERNANDEZ MARTINEZ,2,,,MC
1,14,JALISCO,,,12,ATENGUILLO,,,REG_MR,MC,3,VALENTE RODRIGUEZ GUITRON,1,,,MC
1,14,JALISCO,,,12,ATENGUILLO,,,REG_MR,MC,4,LUGARDA PEÑA CURIEL,2,,,MC
1,14,JALISCO,,,12,ATENGUILLO,,,SIND_MR,MC,5,EDUARDO RUBIO ROBLES,1,CANDIDATURAS DE PERSONAS JOVENES,,MC
1,14,JALISCO,,,12,ATENGUILLO,,,REG_MR,MC,6,MARIA ELIAZER DIAZ RAMIREZ,2,,,MC
1,14,JALISCO,,,12,ATENGUILLO,,,REG_MR,MC,7,EMMANUEL ANDRADE HERNANDEZ,1,,,MC
1,14,JALISCO,,,12,ATENGUILLO,,,REG_RP,MORENA,1,NATALIA ELIZABETH SANTIAGO TORRES,2,,,MORENA
1,14,JALISCO,,,12,ATENGUILLO,,,REG_RP,MORENA,2,GILDARDO ANGEL FRANCO,1,,,MORENA
1,14,JALISCO,,,12,ATENGUILLO,,,REG_RP,MORENA,3,OLGA LUCRECIA DUEÑAS GOMEZ,2,,,MORENA
1,14,JALISCO,,,12,ATENGUILLO,,,REG_RP,MORENA,4,RENE ALONSO VILLASEÑOR ANAYA,1,,,MORENA
1,14,JALISCO,,,13,ATOTONILCO EL ALTO,,,PRES_MUN,PAN_PRI_PRD,1,MARTHA LILIANA PADILLA RAMIREZ,2,,,PRI
1,14,JALISCO,,,13,ATOTONILCO EL ALTO,,,REG_MR,PAN_PRI_PRD,2,ELISA DEL CARMEN HERNANDEZ FRANCO,2,,,PRI
1,14,JALISCO,,,13,ATOTONILCO EL ALTO,,,REG_MR,PAN_PRI_PRD,3,CESAR GAMALIEL ANGULO MELGOZA,1,,,PRI
1,14,JALISCO,,,13,ATOTONILCO EL ALTO,,,REG_MR,PAN_PRI_PRD,4,YESSICA CASANDRA GARCIA ARIAS,2,,,PRI
1,14,JALISCO,,,13,ATOTONILCO EL ALTO,,,REG_MR,PAN_PRI_PRD,5,CLAUDIA VAZQUEZ MARQUEZ,2,,,PRI
1,14,JALISCO,,,13,ATOTONILCO EL ALTO,,,REG_MR,PAN_PRI_PRD,6,MIGUEL DE JESUS ZERMEÑO CASTILLO,1,,,PRI
1,14,JALISCO,,,13,ATOTONILCO EL ALTO,,,SIND_MR,PAN_PRI_PRD,7,HUMBELINA DE JESUS GUZMAN BARBA,2,,,PRI
1,14,JALISCO,,,13,ATOTONILCO EL ALTO,,,REG_MR,PAN_PRI_PRD,8,MARGARITA DAMIAN MERCADO,2,,,PRI
1,14,JALISCO,,,13,ATOTONILCO EL ALTO,,,REG_MR,PAN_PRI_PRD,9,LEONARDO SEBASTIAN HERNANDEZ AVALOS,1,CANDIDATURAS DE PERSONAS JOVENES,,PRI
1,14,JALISCO,,,13,ATOTONILCO EL ALTO,,,REG_RP,MC,1,SOFIA STEFFI GARCIA NAVARRO,2,,,MC
1,14,JALISCO,,,13,ATOTONILCO EL ALTO,,,REG_RP,MC,2,ADRIANA OROZCO DE LA CRUZ,2,,,MC
1,14,JALISCO,,,13,ATOTONILCO EL ALTO,,,REG_RP,PVEM_PT_MORENA_HAGAMOS_FUTURO,1,LIZBETH CANDELARIA ANDRADE CASTAÑEDA,2,CANDIDATURAS DE PERSONAS JOVENES,,MORENA
1,14,JALISCO,,,13,ATOTONILCO EL ALTO,,,REG_RP,PVEM_PT_MORENA_HAGAMOS_FUTURO,2,RAFAEL EDUARDO BARRAGAN CASTILLO,1,,,MORENA
1,14,JALISCO,,,13,ATOTONILCO EL ALTO,,,REG_RP,PVEM_PT_MORENA_HAGAMOS_FUTURO,3,ALMA ROSA DELGADILLO VAZQUEZ,2,,,MORENA
1,14,JALISCO,,,14,ATOYAC,,,PRES_MUN,PAN_PRI_PRD,1,JUAN FRANCISCO OSORIO DE LA CURZ,1,,,PRI
1,14,JALISCO,,,14,ATOYAC,,,REG_MR,PAN_PRI_PRD,2,LAURA LORENA RODRIGUEZ RAMIREZ,2,,,PRI
1,14,JALISCO,,,14,ATOYAC,,,SIND_MR,PAN_PRI_PRD,3,LANDY DE JESUS ARECHIGA ZUÑIGA,1,,,PRI
1,14,JALISCO,,,14,ATOYAC,,,REG_MR,PAN_PRI_PRD,4,ZULEMA SARAI JIMENEZ RIVERA,2,,,PRI
1,14,JALISCO,,,14,ATOYAC,,,REG_MR,PAN_PRI_PRD,5,FELIPE DE JESUS RUIZ GONZALEZ,1,CANDIDATURAS DE PERSONAS JOVENES,,PRI
1,14,JALISCO,,,14,ATOYAC,,,REG_MR,PAN_PRI_PRD,6,MARIA IRMA RAMIREZ ALMEJO,2,,,PRI
1,14,JALISCO,,,14,ATOYAC,,,REG_MR,PAN_PRI_PRD,7,GUALBERTO ALEJANDRO RODRIGUEZ RIVERA,1,,,PRI
1,14,JALISCO,,,14,ATOYAC,,,REG_RP,MC,1,KARLA ALEJANDRA CRUZ SANCHEZ,2,,,MC
1,14,JALISCO,,,14,ATOYAC,,,REG_RP,MC,2,MANUEL ANTONIO PEÑA SOLORZANO,1,,,MC
1,14,JALISCO,,,14,ATOYAC,,,REG_RP,PVEM_PT_MORENA_HAGAMOS_FUTURO,1,GLORIA ELIZABETH TORRES RAMIREZ,2,,,HAGAMOS
1,14,JALISCO,,,14,ATOYAC,,,REG_RP,PVEM_PT_MORENA_HAGAMOS_FUTURO,2,HUMBERTO CRUZ CORONEL,1,,,HAGAMOS
1,14,JALISCO,,,15,AUTLAN DE NAVARRO,,,PRES_MUN,PAN_PRI_PRD,1,GUSTAVO SALVADOR ROBLES MARTINEZ,1,,,PRI
1,14,JALISCO,,,15,AUTLAN DE NAVARRO,,,REG_MR,PAN_PRI_PRD,2,YESSICA PATRICIA LIMON SOLTERO,2,,,PRI
1,14,JALISCO,,,15,AUTLAN DE NAVARRO,,,REG_MR,PAN_PRI_PRD,3,JOSE EMMANUEL PUENTE BERNABE,1,,,PRI
1,14,JALISCO,,,15,AUTLAN DE NAVARRO,,,SIND_MR,PAN_PRI_PRD,4,NELLY YALITZA LOPEZ MARDUEÑO,2,,,PRI
1,14,JALISCO,,,15,AUTLAN DE NAVARRO,,,REG_MR,PAN_PRI_PRD,5,CESAR DANIEL MEDINA CASILLAS,1,,,PRI
1,14,JALISCO,,,15,AUTLAN DE NAVARRO,,,REG_MR,PAN_PRI_PRD,6,MYRIAM LUJAN ESPINOZA,2,,,PRI
1,14,JALISCO,,,15,AUTLAN DE NAVARRO,,,REG_MR,PAN_PRI_PRD,7,JOSE PEDRO GARCIA CURIEL,1,CANDIDATURAS DE PERSONAS JOVENES,,PRI
1,14,JALISCO,,,15,AUTLAN DE NAVARRO,,,REG_MR,PAN_PRI_PRD,8,ROSA ESMERALDA ZOLORZANO GUTIERREZ,2,,,PRI
1,14,JALISCO,,,15,AUTLAN DE NAVARRO,,,REG_MR,PAN_PRI_PRD,9,SERGIO ALEJANDRO CONTRERAS LOPEZ,1,,,PRI
1,14,JALISCO,,,15,AUTLAN DE NAVARRO,,,REG_RP,HAGAMOS,2,SARAHI VIRIDIANA RODRIGUEZ CORDOBA,2,,,HAGAMOS
1,14,JALISCO,,,15,AUTLAN DE NAVARRO,,,REG_RP,MC,1,MARICELA PAEZ GUTIERREZ,2,,,MC
1,14,JALISCO,,,15,AUTLAN DE NAVARRO,,,REG_RP,MC,2,TOMAS ROBLES CASILLAS,1,,,MC
1,14,JALISCO,,,15,AUTLAN DE NAVARRO,,,REG_RP,MORENA,1,ANTONIA PINZON CHAVEZ,2,,,MORENA
1,14,JALISCO,,,15,AUTLAN DE NAVARRO,,,REG_RP,PVEM,1,FAUSTO MANCILLA MARTINEZ,1,,,PVEM
1,14,JALISCO,,,16,AYOTLAN,,,PRES_MUN,PVEM_PT_MORENA_HAGAMOS_FUTURO,1,GUILLERMO RODRIGUEZ ESCOTO,1,,,PVEM
1,14,JALISCO,,,16,AYOTLAN,,,REG_MR,PVEM_PT_MORENA_HAGAMOS_FUTURO,2,ARACELI GARCIA GARCIA,2,CANDIDATURAS DE PERSONAS JOVENES,,PVEM
1,14,JALISCO,,,16,AYOTLAN,,,REG_MR,PVEM_PT_MORENA_HAGAMOS_FUTURO,3,JOSE DE JESUS PARTIDA GARCIA,1,,,PVEM
1,14,JALISCO,,,16,AYOTLAN,,,REG_MR,PVEM_PT_MORENA_HAGAMOS_FUTURO,4,ANA MARIA ARROYO RODRIGUEZ,2,,,PVEM
1,14,JALISCO,,,16,AYOTLAN,,,REG_MR,PVEM_PT_MORENA_HAGAMOS_FUTURO,5,MARIO ALBERTO LICEA SANCHEZ,1,,,PVEM
1,14,JALISCO,,,16,AYOTLAN,,,REG_MR,PVEM_PT_MORENA_HAGAMOS_FUTURO,6,MARIA DEL ROCIO ROBLES TRUJILLO,2,,,PVEM
1,14,JALISCO,,,16,AYOTLAN,,,SIND_MR,PVEM_PT_MORENA_HAGAMOS_FUTURO,7,JOSE JUAN GONZALEZ AGUILAR,1,,,PVEM
1,14,JALISCO,,,16,AYOTLAN,,,REG_RP,PAN_PRI_PRD,1,IMELDA BERENICE GAITAN GARCIA,2,,,PRI
1,14,JALISCO,,,16,AYOTLAN,,,REG_RP,MC,1,RODOLFO HERNANDEZ SANCHEZ,1,,,MC
1,14,JALISCO,,,16,AYOTLAN,,,REG_RP,MC,2,CRISTINA RODRIGUEZ TORRES,2,,,MC
1,14,JALISCO,,,16,AYOTLAN,,,REG_RP,MC,4,ODELINDA COVARRUBIAS ESTRADA,2,,,MC
1,14,JALISCO,,,17,AYUTLA,,,PRES_MUN,PAN_PRI_PRD,1,OSWALDO ANTONIO DE LA CRUZ GARCIA,1,,,PAN
1,14,JALISCO,,,17,AYUTLA,,,REG_MR,PAN_PRI_PRD,2,NORMA ANGELICA SANTOS PELAYO,2,,,PAN
1,14,JALISCO,,,17,AYUTLA,,,SIND_MR,PAN_PRI_PRD,3,CHRISTIAN CURIEL ESPINOZA,1,,,PAN
1,14,JALISCO,,,17,AYUTLA,,,REG_MR,PAN_PRI_PRD,4,JOSEFINA MARISCAL FIGUEROA,2,,,PAN
1,14,JALISCO,,,17,AYUTLA,,,REG_MR,PAN_PRI_PRD,5,JOSE IGNACIO CHAVEZ BLANCO,1,CANDIDATURAS DE PERSONAS JOVENES,,PAN
1,14,JALISCO,,,17,AYUTLA,,,REG_MR,PAN_PRI_PRD,6,MARITZA MARISCAL GUZMAN,2,,,PAN
1,14,JALISCO,,,17,AYUTLA,,,REG_MR,PAN_PRI_PRD,7,FELIPE DE JESUS PELAYO MARTINEZ,1,,,PAN
1,14,JALISCO,,,17,AYUTLA,,,REG_RP,MC,1,VERONICA GABRIELA VARGAS CONTRERAS,2,,,MC
1,14,JALISCO,,,17,AYUTLA,,,REG_RP,MC,2,BRUNO RANGEL SANCHEZ,1,,,MC
1,14,JALISCO,,,17,AYUTLA,,,REG_RP,PVEM_PT_MORENA_HAGAMOS_FUTURO,1,GLORIA MIREYA CORONA CONTRERAS,2,,,MORENA
1,14,JALISCO,,,17,AYUTLA,,,REG_RP,PVEM_PT_MORENA_HAGAMOS_FUTURO,2,ROGELIO GONZALEZ RODRIGUEZ,1,,,MORENA
1,14,JALISCO,,,19,BOLAÑOS,,,PRES_MUN,PVEM_PT_MORENA_HAGAMOS_FUTURO,1,YUNIUR VAZQUEZ ROSALIO,1,CANDIDATURAS INDIGENAS,,HAGAMOS
1,14,JALISCO,,,19,BOLAÑOS,,,REG_MR,PVEM_PT_MORENA_HAGAMOS_FUTURO,2,ARACELI ROBLES DE LA CRUZ,2,CANDIDATURAS INDIGENAS,,HAGAMOS
1,14,JALISCO,,,19,BOLAÑOS,,,REG_MR,PVEM_PT_MORENA_HAGAMOS_FUTURO,3,JESUS HERNANDEZ GONZALEZ,1,CANDIDATURAS INDIGENAS,,HAGAMOS
1,14,JALISCO,,,19,BOLAÑOS,,,REG_MR,PVEM_PT_MORENA_HAGAMOS_FUTURO,4,MICAELA SANCHEZ BAUTISTA,2,CANDIDATURAS INDIGENAS,,HAGAMOS
1,14,JALISCO,,,19,BOLAÑOS,,,REG_MR,PVEM_PT_MORENA_HAGAMOS_FUTURO,5,HILARIO VILLEGAS BAUTISTA,1,,,HAGAMOS
1,14,JALISCO,,,19,BOLAÑOS,,,SIND_MR,PVEM_PT_MORENA_HAGAMOS_FUTURO,6,ERICA SALINAS GONZALEZ,2,,,HAGAMOS
1,14,JALISCO,,,19,BOLAÑOS,,,REG_MR,PVEM_PT_MORENA_HAGAMOS_FUTURO,7,VICTOR OMAR VAZQUEZ KLAC,1,CANDIDATURAS DE PERSONAS JOVENES,,HAGAMOS
1,14,JALISCO,,,19,BOLAÑOS,,,REG_RP,PAN_PRI_PRD,1,MANUEL VILLALOBOS ALVAREZ,1,,,PRD
1,14,JALISCO,,,19,BOLAÑOS,,,REG_RP,PAN_PRI_PRD,2,MARIA GUADALUPE GONZALEZ DE LA ROSA,2,CANDIDATURAS INDIGENAS,,PRD
1,14,JALISCO,,,19,BOLAÑOS,,,REG_RP,MC,1,DAVID CHINO CARRILLO,1,CANDIDATURAS INDIGENAS,,MC
1,14,JALISCO,,,19,BOLAÑOS,,,REG_RP,MC,2,SENAIDA GONZALEZ TORREZ,2,CANDIDATURAS INDIGENAS,,MC
1,14,JALISCO,,,20,CABO CORRIENTES,,,PRES_MUN,PVEM_PT_MORENA_HAGAMOS_FUTURO,1,JOAQUIN ROMERO BRAVO,1,,,PVEM
1,14,JALISCO,,,20,CABO CORRIENTES,,,REG_MR,PVEM_PT_MORENA_HAGAMOS_FUTURO,2,MARTHA LETICIA BAÑUELOS CORREA,2,,,PVEM
1,14,JALISCO,,,20,CABO CORRIENTES,,,REG_MR,PVEM_PT_MORENA_HAGAMOS_FUTURO,3,CARLOS RODRIGUEZ GONZALEZ,1,,,PVEM
1,14,JALISCO,,,20,CABO CORRIENTES,,,SIND_MR,PVEM_PT_MORENA_HAGAMOS_FUTURO,4,ALEIDA MAYANIN DIAZ RODRIGUEZ ,2,CANDIDATURAS DE PERSONAS JOVENES,,PVEM
1,14,JALISCO,,,20,CABO CORRIENTES,,,REG_MR,PVEM_PT_MORENA_HAGAMOS_FUTURO,5,MARIO HUMBERTO RODRIGUEZ ROMERO,1,,,PVEM
1,14,JALISCO,,,20,CABO CORRIENTES,,,REG_MR,PVEM_PT_MORENA_HAGAMOS_FUTURO,6,MARIA BELEN CHAVARIN PALACIO ,2,,,PVEM
1,14,JALISCO,,,20,CABO CORRIENTES,,,REG_MR,PVEM_PT_MORENA_HAGAMOS_FUTURO,7,JOSE ANTONIO PALOMERA GARCIA,1,,,PVEM
1,14,JALISCO,,,20,CABO CORRIENTES,,,REG_RP,MC,1,ESMERALDA URRUTIA ROMERO,2,,,MC
1,14,JALISCO,,,20,CABO CORRIENTES,,,REG_RP,MC,2,JUAN CARLOS OROZCO DE JESUS,1,CANDIDATURAS DE PERSONAS JOVENES,,MC
1,14,JALISCO,,,20,CABO CORRIENTES,,,REG_RP,MC,3,DORA MARIA GARCIA ORDOÑEZ,2,,,MC
1,14,JALISCO,,,20,CABO CORRIENTES,,,REG_RP,MC,4,LUIS RAMON RODRIGUEZ ,1,,,MC
1,14,JALISCO,,,117,CAÑADAS DE OBREGON,,,PRES_MUN,MC,1,JOSE RODRIGO ALVAREZ PADILLA,1,,,MC
1,14,JALISCO,,,117,CAÑADAS DE OBREGON,,,SIND_MR,MC,2,VERONICA GONZALEZ ROJAS,2,,,MC
1,14,JALISCO,,,117,CAÑADAS DE OBREGON,,,REG_MR,MC,3,ALBERTO PADILLA JIMENEZ,1,,,MC
1,14,JALISCO,,,117,CAÑADAS DE OBREGON,,,REG_MR,MC,4,CAROLINA GARCIA MURO,2,,,MC
1,14,JALISCO,,,117,CAÑADAS DE OBREGON,,,REG_MR,MC,5,HUGO PEREZ GOMEZ,1,CANDIDATURAS DE PERSONAS JOVENES,,MC
1,14,JALISCO,,,117,CAÑADAS DE OBREGON,,,REG_MR,MC,6,NORMA RODRIGUEZ LOPEZ,2,,,MC
1,14,JALISCO,,,117,CAÑADAS DE OBREGON,,,REG_MR,MC,7,J GUADALUPE AGREDANO ULLOA,1,,,MC
1,14,JALISCO,,,117,CAÑADAS DE OBREGON,,,REG_RP,PAN_PRI_PRD,1,MARIA CRUZ DELGADO HERNANDEZ,2,,,PAN
1,14,JALISCO,,,117,CAÑADAS DE OBREGON,,,REG_RP,PAN_PRI_PRD,2,PEDRO RAMIREZ MUÑOZ,1,,,PAN
1,14,JALISCO,,,117,CAÑADAS DE OBREGON,,,REG_RP,MORENA,1,MARIA DE LA LUZ VALLIN GONZALEZ,2,,,MORENA
1,14,JALISCO,,,117,CAÑADAS DE OBREGON,,,REG_RP,MORENA,2,LEONCIO JAUREGUI LUJANO,1,,,MORENA
1,14,JALISCO,,,21,CASIMIRO CASTILLO,,,PRES_MUN,PAN_PRI_PRD,1,GILBERTO PEREZ ENRIGUEZ,1,,,PRI
1,14,JALISCO,,,21,CASIMIRO CASTILLO,,,REG_MR,PAN_PRI_PRD,2,ROMINA MABEL ESPINOZA BOBADILLA,2,,,PRI
1,14,JALISCO,,,21,CASIMIRO CASTILLO,,,REG_MR,PAN_PRI_PRD,3,ISMAEL VEGA CORTEZ,1,,,PRI
1,14,JALISCO,,,21,CASIMIRO CASTILLO,,,REG_MR,PAN_PRI_PRD,4,CITLALLY ANAHI GOMEZ CORONA,2,CANDIDATURAS DE PERSONAS JOVENES,,PRI
1,14,JALISCO,,,21,CASIMIRO CASTILLO,,,REG_MR,PAN_PRI_PRD,5,JUAN MANUEL CAMACHO SANCHEZ,1,,,PRI
1,14,JALISCO,,,21,CASIMIRO CASTILLO,,,SIND_MR,PAN_PRI_PRD,6,STEFANIE HERNANDEZ PEREZ,2,,,PRI
1,14,JALISCO,,,21,CASIMIRO CASTILLO,,,REG_MR,PAN_PRI_PRD,7,MARTIN JAVIER ZERMEÑO RODRIGUEZ,1,,,PRI
1,14,JALISCO,,,21,CASIMIRO CASTILLO,,,REG_RP,MC,1,VERONICA LIZBETH REGALADO SANDOVAL,2,,,MC
1,14,JALISCO,,,21,CASIMIRO CASTILLO,,,REG_RP,PVEM_PT_MORENA_HAGAMOS_FUTURO,1,MA DEL ROSARIO RODRIGUEZ CAMPOS,2,,,HAGAMOS
1,14,JALISCO,,,21,CASIMIRO CASTILLO,,,REG_RP,PVEM_PT_MORENA_HAGAMOS_FUTURO,2,IGNACIO MENDOZA FLORES,1,,,HAGAMOS
1,14,JALISCO,,,21,CASIMIRO CASTILLO,,,REG_RP,PVEM_PT_MORENA_HAGAMOS_FUTURO,3,MARHA ALICIA RUELAS CARVAJAL,2,,,HAGAMOS
1,14,JALISCO,,,31,CHAPALA,,,PRES_MUN,PAN_PRI_PRD,1,ALEJANDRO DE JESUS AGUIRRE CURIEL,1,,,PAN
1,14,JALISCO,,,31,CHAPALA,,,REG_MR,PAN_PRI_PRD,2,MARIA EUGENIA OCHOA REAL,2,CANDIDATURAS DE PERSONAS JOVENES,,PAN
1,14,JALISCO,,,31,CHAPALA,,,REG_MR,PAN_PRI_PRD,3,JOSE MANUEL GUTIERREZ GALVEZ,1,,,PAN
1,14,JALISCO,,,31,CHAPALA,,,SIND_MR,PAN_PRI_PRD,4,LILIA ALVARADO MACIAS,2,,,PAN
