CIRCUNSCRIPCION,ID_ESTADO,NOMBRE_ESTADO,ID_DISTRITO_LOCAL,CABECERA_DISTRITAL_LOCAL,ID_MUNICIPIO,MUNICIPIO,ID_DEMARCACION_LOCAL,DEMARCACION_LOCAL,TIPO_DE_CANDIDATURA,NOMBRE_ACTOR_POLITICO,NUMERO_LISTA,PERSONA_CANDIDATA,IDENTIDAD_SEXO_GENERICA,ACCION_AFIRMATIVA,RUTA_CONSTANCIA,PARTIDO_POLITICO
1,14,JALISCO,,,44,HUEJUQUILLA EL ALTO,,,REG_MR,PVEM_PT_MORENA_HAGAMOS_FUTURO,6,ALONDRA INES VERA CRUZ,2,,,MORENA
1,14,JALISCO,,,44,HUEJUQUILLA EL ALTO,,,REG_MR,PVEM_PT_MORENA_HAGAMOS_FUTURO,7,WENSESLAO SIMENTAL GALAVIZ,1,,,MORENA
1,14,JALISCO,,,44,HUEJUQUILLA EL ALTO,,,REG_RP,PAN_PRI_PRD,1,GLORIA ELENA MORENO MUÑOZ,2,,,PRI
1,14,JALISCO,,,44,HUEJUQUILLA EL ALTO,,,REG_RP,PAN_PRI_PRD,2,DAVID RAMIREZ FERNANDEZ,1,,,PRI
1,14,JALISCO,,,44,HUEJUQUILLA EL ALTO,,,REG_RP,MC,1,TERESA VICTORIO REYES,2,CANDIDATURAS DE PERSONAS JOVENES,,MC
1,14,JALISCO,,,44,HUEJUQUILLA EL ALTO,,,REG_RP,MC,2,JUAN MADERA MARTINEZ,1,,,MC
1,14,JALISCO,,,46,IXTLAHUACAN DE LOS MEMBRILLOS,,,PRES_MUN,PAN_PRI_PRD,1,JOSE HERIBERTO GARCIA MURILLO,1,,,PRI
1,14,JALISCO,,,46,IXTLAHUACAN DE LOS MEMBRILLOS,,,SIND_MR,PAN_PRI_PRD,2,BLANCA MIREYA TRUJILLO ROCHIN,2,,,PRI
1,14,JALISCO,,,46,IXTLAHUACAN DE LOS MEMBRILLOS,,,REG_MR,PAN_PRI_PRD,3,JOSE RODRIGO GARCIA ZARAGOZA,1,CANDIDATURAS DE PERSONAS JOVENES,,PRI
1,14,JALISCO,,,46,IXTLAHUACAN DE LOS MEMBRILLOS,,,REG_MR,PAN_PRI_PRD,4,MARTHA ALICIA GONZALEZ MEDINA,2,,,PRI
1,14,JALISCO,,,46,IXTLAHUACAN DE LOS MEMBRILLOS,,,REG_MR,PAN_PRI_PRD,5,MARCO ANTONIO DIAZ CARRAZCO,1,,,PRI
1,14,JALISCO,,,46,IXTLAHUACAN DE LOS MEMBRILLOS,,,REG_MR,PAN_PRI_PRD,6,MARAYM YOTZABEL GONZALEZ ALVAREZ,2,,,PRI
1,14,JALISCO,,,46,IXTLAHUACAN DE LOS MEMBRILLOS,,,REG_MR,PAN_PRI_PRD,7,DAVID ALEJANDRO MARTINEZ ASCENCIO,1,,,PRI
1,14,JALISCO,,,46,IXTLAHUACAN DE LOS MEMBRILLOS,,,REG_MR,PAN_PRI_PRD,8,NAYELI BERENICE MERCADO FLORES,2,,,PRI
1,14,JALISCO,,,46,IXTLAHUACAN DE LOS MEMBRILLOS,,,REG_MR,PAN_PRI_PRD,9,ANGEL BERNARDO SILAHUA,1,,,PRI
1,14,JALISCO,,,46,IXTLAHUACAN DE LOS MEMBRILLOS,,,REG_RP,MC,1,CELIA PEREZ VACA,2,,,MC
1,14,JALISCO,,,46,IXTLAHUACAN DE LOS MEMBRILLOS,,,REG_RP,MORENA,1,ANA LIVIER CONTRERAS MENDOZA,2,,,MORENA
1,14,JALISCO,,,46,IXTLAHUACAN DE LOS MEMBRILLOS,,,REG_RP,MORENA,2,CARLOS JOSE ROCHA ,1,,,MORENA
1,14,JALISCO,,,46,IXTLAHUACAN DE LOS MEMBRILLOS,,,REG_RP,MORENA,3,ADELAIDA ROSALES MENDOZA,2,,,MORENA
1,14,JALISCO,,,46,IXTLAHUACAN DE LOS MEMBRILLOS,,,REG_RP,PVEM,1,ALMA ROSALIA LOPEZ VALADEZ,2,,,PVEM
1,14,JALISCO,,,47,IXTLAHUACAN DEL RIO,,,PRES_MUN,MORENA,1,LEONCIO GUZMAN GONZALEZ,1,,,MORENA
1,14,JALISCO,,,47,IXTLAHUACAN DEL RIO,,,SIND_MR,MORENA,2,JHOANA HERENDIRA ABUNDIZ CARVAJAL,2,,,MORENA
1,14,JALISCO,,,47,IXTLAHUACAN DEL RIO,,,REG_MR,MORENA,3,SANTIAGO FLORES GUTIERREZ,1,,,MORENA
1,14,JALISCO,,,47,IXTLAHUACAN DEL RIO,,,REG_MR,MORENA,4,VERONICA DE ALBA CARRANZA,2,,,MORENA
1,14,JALISCO,,,47,IXTLAHUACAN DEL RIO,,,REG_MR,MORENA,5,NESTOR MARTIN GARCIA VERGARA,1,,,MORENA
1,14,JALISCO,,,47,IXTLAHUACAN DEL RIO,,,REG_MR,MORENA,6,MONICA DEYANIRA HERNANDEZ REA,2,CANDIDATURAS DE PERSONAS JOVENES,,MORENA
1,14,JALISCO,,,47,IXTLAHUACAN DEL RIO,,,REG_MR,MORENA,7,RAMIRO MACIAS ORNELAS,1,,,MORENA
1,14,JALISCO,,,47,IXTLAHUACAN DEL RIO,,,REG_RP,PAN_PRI_PRD,2,ANA DELIA NARANJO RODRIGUEZ,2,,,PRI
1,14,JALISCO,,,47,IXTLAHUACAN DEL RIO,,,REG_RP,MC,1,GABRIEL HARO OCAMPO,1,,,MC
1,14,JALISCO,,,47,IXTLAHUACAN DEL RIO,,,REG_RP,MC,2,ADRIANA MARLEM ABUNDIS RENTERIA,2,,,MC
1,14,JALISCO,,,47,IXTLAHUACAN DEL RIO,,,REG_RP,PVEM,1,BLAZ RODRIGUEZ DIAZ,1,,,PVEM
1,14,JALISCO,,,48,JALOSTOTITLAN,,,PRES_MUN,MC,1,JUDITH MACIAS RAMIREZ,2,,,MC
1,14,JALISCO,,,48,JALOSTOTITLAN,,,REG_MR,MC,2,LAURA AVILA JIMENEZ,2,CANDIDATURAS DE PERSONAS JOVENES,,MC
1,14,JALISCO,,,48,JALOSTOTITLAN,,,REG_MR,MC,3,OCTAVIO GONZALEZ ZERMEÑO,1,,,MC
1,14,JALISCO,,,48,JALOSTOTITLAN,,,REG_MR,MC,4,ANA MARIA MACIAS PEREZ,2,,,MC
1,14,JALISCO,,,48,JALOSTOTITLAN,,,REG_MR,MC,5,JORGE ALONSO HERNANDEZ SANTILLAN,1,,,MC
1,14,JALISCO,,,48,JALOSTOTITLAN,,,REG_MR,MC,6,GRICELDA LOPEZ PEREZ,2,,,MC
1,14,JALISCO,,,48,JALOSTOTITLAN,,,SIND_MR,MC,7,CRISTIAN IVAN LOZANO FLORES,1,,,MC
1,14,JALISCO,,,48,JALOSTOTITLAN,,,REG_RP,PAN_PRI_PRD,1,RAUL SOTO RAMIREZ,1,,,PRI
1,14,JALISCO,,,48,JALOSTOTITLAN,,,REG_RP,PAN_PRI_PRD,2,BLANCA ARACELY ROMO GONZALEZ,2,,,PRI
1,14,JALISCO,,,48,JALOSTOTITLAN,,,REG_RP,PAN_PRI_PRD,3,ARTURO GONZALEZ PEREZ,1,,,PRI
1,14,JALISCO,,,48,JALOSTOTITLAN,,,REG_RP,PVEM_PT_MORENA_HAGAMOS_FUTURO,2,LORENA HERNANDEZ PEREZ,1,,,MORENA
1,14,JALISCO,,,49,JAMAY,,,PRES_MUN,PAN_PRI_PRD,1,CESAR CELESTINO MOLINA SAHAGUN,1,,,PRD
1,14,JALISCO,,,49,JAMAY,,,REG_MR,PAN_PRI_PRD,2,MA GUADALUPE CASTILLO GODINEZ,2,,,PRD
1,14,JALISCO,,,49,JAMAY,,,REG_MR,PAN_PRI_PRD,3,RAMON VELASCO SAHAGUN,1,,,PRD
1,14,JALISCO,,,49,JAMAY,,,REG_MR,PAN_PRI_PRD,4,MARIA DE LOS ANGELES JIMENEZ LOPEZ,2,,,PRD
1,14,JALISCO,,,49,JAMAY,,,REG_MR,PAN_PRI_PRD,5,LUIS ENRIQUE TAMAYO CEJA,1,,,PRD
1,14,JALISCO,,,49,JAMAY,,,SIND_MR,PAN_PRI_PRD,6,VERONICA ELIZABETH FLORES SOTELO,2,CANDIDATURAS DE PERSONAS JOVENES,,PRD
1,14,JALISCO,,,49,JAMAY,,,REG_MR,PAN_PRI_PRD,7,ALEJANDRO DE ALBA CARMONA,1,,,PRD
1,14,JALISCO,,,49,JAMAY,,,REG_RP,MC,1,JUAN LUIS AGUILAR GARCIA,1,,,MC
1,14,JALISCO,,,49,JAMAY,,,REG_RP,MC,2,AZUCENA VELASCO GARCIA,2,CANDIDATURAS DE PERSONAS JOVENES,,MC
1,14,JALISCO,,,49,JAMAY,,,REG_RP,MC,3,ARTURO GODINEZ ORTEGA,1,,,MC
1,14,JALISCO,,,49,JAMAY,,,REG_RP,PVEM_PT_MORENA_HAGAMOS_FUTURO,1,ADRIANA ESMERALDA TORRES CASTELLANOS,2,,,MORENA
1,14,JALISCO,,,50,JESUS MARIA,,,PRES_MUN,PAN_PRI_PRD,1,OLIVIA SEVILLA LOPEZ,2,,,PAN
1,14,JALISCO,,,50,JESUS MARIA,,,SIND_MR,PAN_PRI_PRD,2,HECTOR GILBERTO LOPEZ SEVILLA,1,,,PAN
1,14,JALISCO,,,50,JESUS MARIA,,,REG_MR,PAN_PRI_PRD,3,REBECA CAMARENA MELENDEZ,2,,,PAN
1,14,JALISCO,,,50,JESUS MARIA,,,REG_MR,PAN_PRI_PRD,4,MAXIMILIANO CAMARENA MARTINEZ,1,,,PAN
1,14,JALISCO,,,50,JESUS MARIA,,,REG_MR,PAN_PRI_PRD,5,CLAUDIA OÑATE HUERTA,2,,,PAN
1,14,JALISCO,,,50,JESUS MARIA,,,REG_MR,PAN_PRI_PRD,6,JOSE LEON TORRES,1,,,PAN
1,14,JALISCO,,,50,JESUS MARIA,,,REG_MR,PAN_PRI_PRD,7,ALEJANDRA PACHECO JAIME,2,CANDIDATURAS DE PERSONAS JOVENES,,PAN
1,14,JALISCO,,,50,JESUS MARIA,,,REG_RP,MC,1,PABLO DOMINGUEZ PLATA,1,,,MC
1,14,JALISCO,,,50,JESUS MARIA,,,REG_RP,PVEM_PT_MORENA_HAGAMOS_FUTURO,1,VERONICA GUADALUPE GUZMAN RAMIREZ,2,,,PVEM
1,14,JALISCO,,,50,JESUS MARIA,,,REG_RP,PVEM_PT_MORENA_HAGAMOS_FUTURO,2,EDER GUSTAVO ROMERO ROMO,1,,,PVEM
1,14,JALISCO,,,50,JESUS MARIA,,,REG_RP,PVEM_PT_MORENA_HAGAMOS_FUTURO,3,MARTINA LOPEZ MELENDEZ,2,,,PVEM
1,14,JALISCO,,,51,JILOTLAN DE LOS DOLORES,,,PRES_MUN,PAN,1,HISEL GONZALEZ MENDOZA,2,CANDIDATURAS DE PERSONAS JOVENES,,PAN
1,14,JALISCO,,,51,JILOTLAN DE LOS DOLORES,,,SIND_MR,PAN,2,MARIO SANTIAGO SANDOVAL ROSALES,1,,,PAN
1,14,JALISCO,,,51,JILOTLAN DE LOS DOLORES,,,REG_MR,PAN,3,YOCELIN HEREDIA CADENAS,2,,,PAN
1,14,JALISCO,,,51,JILOTLAN DE LOS DOLORES,,,REG_MR,PAN,4,FERNANDO GUILTRON GARCIA,1,,,PAN
1,14,JALISCO,,,51,JILOTLAN DE LOS DOLORES,,,REG_MR,PAN,5,LORENA ERIKA NAVARRO ARROYO,2,,,PAN
1,14,JALISCO,,,51,JILOTLAN DE LOS DOLORES,,,REG_MR,PAN,6,HERIBERTO DOMINGO OROZCO SANCHEZ,1,,,PAN
1,14,JALISCO,,,51,JILOTLAN DE LOS DOLORES,,,REG_MR,PAN,7,MARITZA JACQUELINE SANCHEZ LOPEZ,2,,,PAN
1,14,JALISCO,,,51,JILOTLAN DE LOS DOLORES,,,REG_RP,MC,1,HUBER ORTEGA PADILLA,1,,,MC
1,14,JALISCO,,,51,JILOTLAN DE LOS DOLORES,,,REG_RP,MC,2,ALEJANDRA HINOSTROZA ESQUIVEL,2,CANDIDATURAS DE PERSONAS JOVENES,,MC
1,14,JALISCO,,,51,JILOTLAN DE LOS DOLORES,,,REG_RP,MC,3,LEONARDO VALENCIA VALENCIA,1,,,MC
1,14,JALISCO,,,51,JILOTLAN DE LOS DOLORES,,,REG_RP,PVEM_PT_MORENA_HAGAMOS_FUTURO,1,JUAN PABLO PANDURO SOTO,1,,,HAGAMOS
1,14,JALISCO,,,52,JOCOTEPEC,,,PRES_MUN,PVEM_PT_MORENA_HAGAMOS_FUTURO,1,HUGO DAVID GARCIA VARGAS,1,,,FUTURO
1,14,JALISCO,,,52,JOCOTEPEC,,,REG_MR,PVEM_PT_MORENA_HAGAMOS_FUTURO,2,MARISOL CONTRERAS DURAN,2,,,FUTURO
1,14,JALISCO,,,52,JOCOTEPEC,,,SIND_MR,PVEM_PT_MORENA_HAGAMOS_FUTURO,3,RICARDO PONCE OROZCO,1,,,FUTURO
1,14,JALISCO,,,52,JOCOTEPEC,,,REG_MR,PVEM_PT_MORENA_HAGAMOS_FUTURO,4,BERENICE CUEVAS VARGAS,2,,,FUTURO
1,14,JALISCO,,,52,JOCOTEPEC,,,REG_MR,PVEM_PT_MORENA_HAGAMOS_FUTURO,5,FRANCISCO CASTILLO PEREZ,1,,,FUTURO
1,14,JALISCO,,,52,JOCOTEPEC,,,REG_MR,PVEM_PT_MORENA_HAGAMOS_FUTURO,6,CELINA MILAGROS CAMARENA SERRANO,2,,,FUTURO
1,14,JALISCO,,,52,JOCOTEPEC,,,REG_MR,PVEM_PT_MORENA_HAGAMOS_FUTURO,7,JOSE LUIS LEDEZMA ALMEIDA,1,,,FUTURO
1,14,JALISCO,,,52,JOCOTEPEC,,,REG_RP,PAN_PRI_PRD,1,FABIAN OLMEDO NAVARRO,1,,,PAN
1,14,JALISCO,,,52,JOCOTEPEC,,,REG_RP,MC,1,MARIA DOLORES LOPEZ JARA,2,CANDIDATURAS DE LA DIVERSIDAD SEXUAL,,MC
1,14,JALISCO,,,52,JOCOTEPEC,,,REG_RP,MC,2,MIGUEL IBARRA GARAVITO,1,,,MC
1,14,JALISCO,,,52,JOCOTEPEC,,,REG_RP,MC,3,NANCY ANGELICA PEREZ LUPERCIO,2,,,MC
1,14,JALISCO,,,53,JUANACATLAN,,,PRES_MUN,PVEM_PT_MORENA_HAGAMOS_FUTURO,1,ANA ROSA VERGARA ANGEL,2,,,PT
1,14,JALISCO,,,53,JUANACATLAN,,,REG_MR,PVEM_PT_MORENA_HAGAMOS_FUTURO,2,JUAN ANTONIO GARCIA CHOLICO,1,,,PT
1,14,JALISCO,,,53,JUANACATLAN,,,REG_MR,PVEM_PT_MORENA_HAGAMOS_FUTURO,3,IRMA NAYELI MARQUEZ MEZA,2,,,PT
1,14,JALISCO,,,53,JUANACATLAN,,,SIND_MR,PVEM_PT_MORENA_HAGAMOS_FUTURO,4,NOE ADEMAR RODRIGUEZ ZAVALA,1,,,PT
1,14,JALISCO,,,53,JUANACATLAN,,,REG_MR,PVEM_PT_MORENA_HAGAMOS_FUTURO,5,ALMA ROSA VENEGAS GARCIA,2,,,PT
1,14,JALISCO,,,53,JUANACATLAN,,,REG_MR,PVEM_PT_MORENA_HAGAMOS_FUTURO,6,ALFREDO VAZQUEZ ROSALES,1,,,PT
1,14,JALISCO,,,53,JUANACATLAN,,,REG_MR,PVEM_PT_MORENA_HAGAMOS_FUTURO,7,KAREN ALEJANDRA ALVAREZ ALVAREZ,2,CANDIDATURAS DE PERSONAS JOVENES,,PT
1,14,JALISCO,,,53,JUANACATLAN,,,REG_RP,PAN_PRI_PRD,1,FRANCISCO DE LA CERDA SUAREZ,1,,,PAN
1,14,JALISCO,,,53,JUANACATLAN,,,REG_RP,PAN_PRI_PRD,2,OFELIA LUQUE MUÑOZ,2,,,PAN
1,14,JALISCO,,,53,JUANACATLAN,,,REG_RP,MC,1,SUSANA MELENDEZ VELAZQUEZ,2,,,MC
1,14,JALISCO,,,53,JUANACATLAN,,,REG_RP,MC,2,ALBERTO MURGUIA VACA,1,,,MC
1,14,JALISCO,,,54,JUCHITLAN,,,PRES_MUN,PAN_PRI_PRD,1,SILVIA DENIZ COBIAN OSORIO,2,,,PRI
1,14,JALISCO,,,54,JUCHITLAN,,,REG_MR,PAN_PRI_PRD,2,JUAN PABLO COVARRUBIAS RANGEL,1,CANDIDATURAS DE PERSONAS JOVENES,,PRI
1,14,JALISCO,,,54,JUCHITLAN,,,REG_MR,PAN_PRI_PRD,3,ALEJANDRA NOEMI GONZALEZ ROBLES,2,,,PRI
1,14,JALISCO,,,54,JUCHITLAN,,,REG_MR,PAN_PRI_PRD,4,ROMALDO MARTINEZ PALACIO,1,,,PRI
1,14,JALISCO,,,54,JUCHITLAN,,,REG_MR,PAN_PRI_PRD,5,MARIA LIDIA MARISCAL CAMACHO,2,,,PRI
1,14,JALISCO,,,54,JUCHITLAN,,,SIND_MR,PAN_PRI_PRD,6,ISIDRO MANZANO LOPEZ,1,,,PRI
1,14,JALISCO,,,54,JUCHITLAN,,,REG_MR,PAN_PRI_PRD,7,MARICELA VEGA AGUILA,2,,,PRI
1,14,JALISCO,,,54,JUCHITLAN,,,REG_RP,MC,1,MARITZA ISABEL HERNANDEZ OSORIO,2,,,MC
1,14,JALISCO,,,54,JUCHITLAN,,,REG_RP,PVEM_PT_MORENA_HAGAMOS_FUTURO,1,FRANKLIN ALEXANDER MONTOYA MEJIA,1,,,HAGAMOS
1,14,JALISCO,,,54,JUCHITLAN,,,REG_RP,PVEM_PT_MORENA_HAGAMOS_FUTURO,2,MARICELA COVARRUBIAS GUTIERREZ,2,,,HAGAMOS
1,14,JALISCO,,,54,JUCHITLAN,,,REG_RP,PVEM_PT_MORENA_HAGAMOS_FUTURO,3,FRANCISCO JAVIER ALCALA VILLASEÑOR,1,,,HAGAMOS
1,14,JALISCO,,,18,LA BARCA,,,PRES_MUN,PAN_PRI_PRD,1,RICARDO HERNANDEZ BECERRA,1,,,PRI
1,14,JALISCO,,,18,LA BARCA,,,REG_MR,PAN_PRI_PRD,2,ANA LILIA BECERRA ROMAN,2,,,PRI
1,14,JALISCO,,,18,LA BARCA,,,REG_MR,PAN_PRI_PRD,3,HECTOR SALVADOR OCEGUERA MACIAS,1,,,PRI
1,14,JALISCO,,,18,LA BARCA,,,REG_MR,PAN_PRI_PRD,4,ANA SOFIA PEREZ GARCIA,2,CANDIDATURAS DE PERSONAS JOVENES,,PRI
1,14,JALISCO,,,18,LA BARCA,,,REG_MR,PAN_PRI_PRD,5,RAUL ROBERTO RUEDAS BARAJAS,1,,,PRI
1,14,JALISCO,,,18,LA BARCA,,,SIND_MR,PAN_PRI_PRD,6,MIRIAM PEREZ BRISEÑO,2,,,PRI
1,14,JALISCO,,,18,LA BARCA,,,REG_MR,PAN_PRI_PRD,7,JUAN MANUEL VILLANUEVA MENDOZA,1,,,PRI
1,14,JALISCO,,,18,LA BARCA,,,REG_MR,PAN_PRI_PRD,8,MA GUADALUPE SILVA CERDA,2,,,PRI
1,14,JALISCO,,,18,LA BARCA,,,REG_MR,PAN_PRI_PRD,9,SERGIO GARCIA ISLAS,1,,,PRI
1,14,JALISCO,,,18,LA BARCA,,,REG_RP,PVEM_PT_MORENA_HAGAMOS_FUTURO,1,JUAN FRANCISCO GARCIA VELEZ,1,,,FUTURO
1,14,JALISCO,,,18,LA BARCA,,,REG_RP,PVEM_PT_MORENA_HAGAMOS_FUTURO,2,MARIA GUADALUPE ROJAS GARCIA,2,,,FUTURO
1,14,JALISCO,,,18,LA BARCA,,,REG_RP,PVEM_PT_MORENA_HAGAMOS_FUTURO,3,MARTIN JOSUE TEJEDA MARTINEZ,1,,,FUTURO
1,14,JALISCO,,,18,LA BARCA,,,REG_RP,MC,4,JOSEFINA MORENO CERDA,2,CANDIDATURAS DE DISCAPACIDAD,,MC
1,14,JALISCO,,,18,LA BARCA,,,REG_RP,MC,2,LOURDES ASENETH CORTES GUTIERREZ,2,,,MC
1,14,JALISCO,,,45,LA HUERTA,,,PRES_MUN,PAN_PRI_PRD,1,LUIS ARIAS MADRIGAL,1,,,PRD
1,14,JALISCO,,,45,LA HUERTA,,,REG_MR,PAN_PRI_PRD,2,ALEJANDRA MORFIN VEGA,2,,,PRD
1,14,JALISCO,,,45,LA HUERTA,,,REG_MR,PAN_PRI_PRD,3,JOSE GUADALUPE CHAVARIN HERNANDEZ,1,,,PRD
1,14,JALISCO,,,45,LA HUERTA,,,REG_MR,PAN_PRI_PRD,4,GRECIA DELGADILLO MURILLO,2,CANDIDATURAS DE PERSONAS JOVENES,,PRD
1,14,JALISCO,,,45,LA HUERTA,,,REG_MR,PAN_PRI_PRD,5,ARMANDO OROZCO VAZQUEZ,1,,,PRD
1,14,JALISCO,,,45,LA HUERTA,,,SIND_MR,PAN_PRI_PRD,6,MARIBEL CAPRISTO ,2,,,PRD
1,14,JALISCO,,,45,LA HUERTA,,,REG_MR,PAN_PRI_PRD,7,ALONSO ISAIAS TEJEDA PADILLA,1,,,PRD
1,14,JALISCO,,,45,LA HUERTA,,,REG_RP,MC,1,XCARLETTHE ELIZABETH MAGAÑA OLMEDO,2,,,MC
1,14,JALISCO,,,45,LA HUERTA,,,REG_RP,MC,2,JESUS FLORES SAHAGUN,1,,,MC
1,14,JALISCO,,,45,LA HUERTA,,,REG_RP,PVEM_PT_MORENA_HAGAMOS_FUTURO,1,FRANCISCO JAVIER SUAREZ DELGADO ,1,,,MORENA
1,14,JALISCO,,,45,LA HUERTA,,,REG_RP,PVEM_PT_MORENA_HAGAMOS_FUTURO,2,SELENE CANDELARIA MORENO LOPEZ ,2,CANDIDATURAS DE PERSONAS JOVENES,,MORENA
1,14,JALISCO,,,59,LA MANZANILLA DE LA PAZ,,,PRES_MUN,PVEM,1,HECTOR GONZALO DIAZ DIAZ,1,,,PVEM
1,14,JALISCO,,,59,LA MANZANILLA DE LA PAZ,,,REG_MR,PVEM,2,ANALY AGUILAR ESPINOZA,2,CANDIDATURAS DE PERSONAS JOVENES,,PVEM
1,14,JALISCO,,,59,LA MANZANILLA DE LA PAZ,,,REG_MR,PVEM,3,MIGUEL ALEJANDRO PRECIADO MENDOZA,1,,,PVEM
1,14,JALISCO,,,59,LA MANZANILLA DE LA PAZ,,,REG_MR,PVEM,4,MARIA GUADALUPE PLASCENCIA ARREGUIN,2,,,PVEM
1,14,JALISCO,,,59,LA MANZANILLA DE LA PAZ,,,REG_MR,PVEM,5,GUSTAVO CARDENAS PANTOJA,1,,,PVEM
1,14,JALISCO,,,59,LA MANZANILLA DE LA PAZ,,,SIND_MR,PVEM,6,SAHARAY VILLANUEVA AGUILAR,2,,,PVEM
1,14,JALISCO,,,59,LA MANZANILLA DE LA PAZ,,,REG_MR,PVEM,7,JOSE GUADALUPE SANCHEZ TORRES,1,,,PVEM
1,14,JALISCO,,,59,LA MANZANILLA DE LA PAZ,,,REG_RP,MC,1,BLANCA ESTELA ALVAREZ CHAVEZ,2,,,MC
1,14,JALISCO,,,59,LA MANZANILLA DE LA PAZ,,,REG_RP,MC,2,MIGUEL ANGEL MAYA DIAZ,1,,,MC
1,14,JALISCO,,,59,LA MANZANILLA DE LA PAZ,,,REG_RP,MC,3,ALONDRA DE JESUS AGUILAR CARDENAS,2,CANDIDATURAS DE PERSONAS JOVENES,,MC
1,14,JALISCO,,,59,LA MANZANILLA DE LA PAZ,,,REG_RP,MC,4,LUIS ANGEL SILVA MARTINEZ,1,,,MC
1,14,JALISCO,,,55,LAGOS DE MORENO,,,PRES_MUN,MC,1,EDGAR ALFREDO GONZALEZ CHAVEZ,1,,,MC
1,14,JALISCO,,,55,LAGOS DE MORENO,,,REG_MR,MC,2,MARCELA PADILLA DE ANDA,2,,,MC
1,14,JALISCO,,,55,LAGOS DE MORENO,,,REG_MR,MC,3,FERNANDO ANTONIO ALCANTARA GONZALEZ,1,CANDIDATURAS DE PERSONAS JOVENES,,MC
1,14,JALISCO,,,55,LAGOS DE MORENO,,,REG_MR,MC,4,NANCY ARACELI GOMEZ MARQUEZ,2,,,MC
1,14,JALISCO,,,55,LAGOS DE MORENO,,,REG_MR,MC,5,VICTOR ATILANO GOMEZ,1,,,MC
1,14,JALISCO,,,55,LAGOS DE MORENO,,,REG_MR,MC,6,CLAUDIA ELIZABETH HERNANDEZ MACIAS,2,,,MC
1,14,JALISCO,,,55,LAGOS DE MORENO,,,REG_MR,MC,7,JOSE IGNACIO ANGEL CERVANTES,1,,,MC
1,14,JALISCO,,,55,LAGOS DE MORENO,,,REG_MR,MC,8,YARITZA SOFIA GOMEZ SOTO,2,,,MC
1,14,JALISCO,,,55,LAGOS DE MORENO,,,SIND_MR,MC,9,ADAN MENDOZA MEDINA,1,,,MC
1,14,JALISCO,,,55,LAGOS DE MORENO,,,REG_MR,MC,10,ITHZEL DANAE LARA MARTINEZ,2,,,MC
1,14,JALISCO,,,55,LAGOS DE MORENO,,,REG_RP,PAN_PRI_PRD,1,ROMELIA MUÑOZ FLORES,2,,,PRI
1,14,JALISCO,,,55,LAGOS DE MORENO,,,REG_RP,PAN_PRI_PRD,2,JOSE BRIZUELA LOPEZ,1,,,PRI
1,14,JALISCO,,,55,LAGOS DE MORENO,,,REG_RP,PVEM_PT_MORENA_HAGAMOS_FUTURO,1,MARCO ANTONIO GONZALEZ ORTIZ,1,,,HAGAMOS
1,14,JALISCO,,,55,LAGOS DE MORENO,,,REG_RP,PVEM_PT_MORENA_HAGAMOS_FUTURO,2,ANA LAURA DELGADILLO MARQUEZ,2,,,HAGAMOS
1,14,JALISCO,,,55,LAGOS DE MORENO,,,REG_RP,PVEM_PT_MORENA_HAGAMOS_FUTURO,3,FRANCISCO JAVIER ESTRADA BARRAGAN,1,,,HAGAMOS
1,14,JALISCO,,,55,LAGOS DE MORENO,,,REG_RP,PVEM_PT_MORENA_HAGAMOS_FUTURO,4,ANEKEN ALVAREZ THOMSEN,2,CANDIDATURAS DE PERSONAS JOVENES,,HAGAMOS
1,14,JALISCO,,,57,MAGDALENA,,,PRES_MUN,PAN_PRI_PRD,1,MARCO TREJO TELLEZ GIRON,1,,,PRI
1,14,JALISCO,,,57,MAGDALENA,,,REG_MR,PAN_PRI_PRD,2,CRISTINA DEL PUEBLITO ROMERO CARRANZA,2,CANDIDATURAS DE PERSONAS JOVENES,,PRI
1,14,JALISCO,,,57,MAGDALENA,,,REG_MR,PAN_PRI_PRD,3,SANTIAGO RUIZ HERRERA,1,,,PRI
1,14,JALISCO,,,57,MAGDALENA,,,SIND_MR,PAN_PRI_PRD,4,CELINA DEL CARMEN PONCE LOPEZ,2,,,PRI
1,14,JALISCO,,,57,MAGDALENA,,,REG_MR,PAN_PRI_PRD,5,MARCO ANTONIO RODRIGUEZ MORALES,1,,,PRI
1,14,JALISCO,,,57,MAGDALENA,,,REG_MR,PAN_PRI_PRD,6,MARISOL NUÑEZ CARO,2,,,PRI
1,14,JALISCO,,,57,MAGDALENA,,,REG_MR,PAN_PRI_PRD,7,CARLOS FERNANDO CORTEZ DIAZ,1,CANDIDATURAS DE DISCAPACIDAD,,PRI
1,14,JALISCO,,,57,MAGDALENA,,,REG_RP,MC,1,HILDA CRISTINA ORNELAS CASTAÑEDA,2,,,MC
1,14,JALISCO,,,57,MAGDALENA,,,REG_RP,MC,2,MARINA ARACELI MARTINEZ VALLEJO,2,,,MC
1,14,JALISCO,,,57,MAGDALENA,,,REG_RP,MC,3,CRUZ ANDRES VILLEGAS ESCOBEDO,1,,,MC
1,14,JALISCO,,,57,MAGDALENA,,,REG_RP,PVEM_PT_MORENA_HAGAMOS_FUTURO,1,MARTHA PALACIOS CASTAÑEDA,2,,,MORENA
1,14,JALISCO,,,60,MASCOTA,,,PRES_MUN,MORENA,1,MARCO ANTONIO RUBIO LOPEZ,1,,,MORENA
1,14,JALISCO,,,60,MASCOTA,,,REG_MR,MORENA,2,RUTH VIRIDIANA DUEÑAS TORRES,2,,,MORENA
1,14,JALISCO,,,60,MASCOTA,,,REG_MR,MORENA,3,OSCAR RUBEN LOPEZ PADILLA,1,,,MORENA
1,14,JALISCO,,,60,MASCOTA,,,REG_MR,MORENA,4,KARLA VERONICA ARREOLA DIAZ,2,,,MORENA
1,14,JALISCO,,,60,MASCOTA,,,REG_MR,MORENA,5,JOSE VICTORIANO PEÑA ULLOA,1,,,MORENA
1,14,JALISCO,,,60,MASCOTA,,,REG_MR,MORENA,6,SILVIA GUADALUPE ROJAS OROZCO,2,,,MORENA
1,14,JALISCO,,,60,MASCOTA,,,SIND_MR,MORENA,7,RODRIGO GARCIA LOPEZ,1,CANDIDATURAS DE PERSONAS JOVENES,,MORENA
1,14,JALISCO,,,60,MASCOTA,,,REG_RP,MC,1,GRACIELA CIBRIAN GUERRA,2,,,MC
1,14,JALISCO,,,60,MASCOTA,,,REG_RP,MC,2,FABIAN ARIAS AYON,1,,,MC
1,14,JALISCO,,,60,MASCOTA,,,REG_RP,PVEM,1,GEMMA VERONICA RODRIGUEZ LOPEZ,2,,,PVEM
1,14,JALISCO,,,60,MASCOTA,,,REG_RP,PVEM,2,NICOLAS BRISEÑO LOPEZ,1,,,PVEM
1,14,JALISCO,,,61,MAZAMITLA,,,PRES_MUN,PAN_PRI_PRD,1,AMANDA ALBARRAN RAMOS,2,,,PRI
1,14,JALISCO,,,61,MAZAMITLA,,,REG_MR,PAN_PRI_PRD,2,MIGUEL IGNACIO OROZCO BARRAGAN,1,,,PRI
1,14,JALISCO,,,61,MAZAMITLA,,,REG_MR,PAN_PRI_PRD,3,SANDRA LUZ VALENCIA MACIAS,2,,,PRI
1,14,JALISCO,,,61,MAZAMITLA,,,SIND_MR,PAN_PRI_PRD,4,JOSE ANTONIO CHAVEZ VARGAS,1,,,PRI
1,14,JALISCO,,,61,MAZAMITLA,,,REG_MR,PAN_PRI_PRD,5,SANDRA AIDE RAMIREZ ARTEAGA,2,CANDIDATURAS DE PERSONAS JOVENES,,PRI
1,14,JALISCO,,,61,MAZAMITLA,,,REG_MR,PAN_PRI_PRD,6,SAMUEL CHAVEZ MATA,1,,,PRI
1,14,JALISCO,,,61,MAZAMITLA,,,REG_MR,PAN_PRI_PRD,7,TERESITA MARTINEZ CHAVEZ,2,,,PRI
1,14,JALISCO,,,61,MAZAMITLA,,,REG_RP,MC,1,ALONDRA GRACIELA MAGAÑA CONTRERAS,2,CANDIDATURAS DE PERSONAS JOVENES,,MC
1,14,JALISCO,,,61,MAZAMITLA,,,REG_RP,MC,2,JESUS ZEPEDA ZEPEDA,1,,,MC
1,14,JALISCO,,,61,MAZAMITLA,,,REG_RP,MC,3,FABIOLA MARTINEZ MAGAÑA,2,,,MC
1,14,JALISCO,,,61,MAZAMITLA,,,REG_RP,MC,4,SALVADOR ZAMBRANO ZEPEDA,1,,,MC
1,14,JALISCO,,,62,MEXTICACAN,,,PRES_MUN,PVEM_PT_MORENA_HAGAMOS_FUTURO,1,JAZMIN CELENNE GONZALEZ LOPEZ,2,,,MORENA
1,14,JALISCO,,,62,MEXTICACAN,,,SIND_MR,PVEM_PT_MORENA_HAGAMOS_FUTURO,2,JOAQUIN ALONSO SANTANA TAMAYO,1,,,MORENA
1,14,JALISCO,,,62,MEXTICACAN,,,REG_MR,PVEM_PT_MORENA_HAGAMOS_FUTURO,3,ELENA CARDENAS MAYORAL,2,,,MORENA
1,14,JALISCO,,,62,MEXTICACAN,,,REG_MR,PVEM_PT_MORENA_HAGAMOS_FUTURO,4,J REFUGIO PEREZ VILLALOBOS,1,,,MORENA
1,14,JALISCO,,,62,MEXTICACAN,,,REG_MR,PVEM_PT_MORENA_HAGAMOS_FUTURO,5,ELISA SANDOVAL DIAZ,2,,,MORENA
1,14,JALISCO,,,62,MEXTICACAN,,,REG_MR,PVEM_PT_MORENA_HAGAMOS_FUTURO,6,NESTOR ISLAS ELIZALDE,1,CANDIDATURAS DE PERSONAS JOVENES,,MORENA
1,14,JALISCO,,,62,MEXTICACAN,,,REG_MR,PVEM_PT_MORENA_HAGAMOS_FUTURO,7,MA DEL ROSARIO MACIAS PEREZ,2,,,MORENA
1,14,JALISCO,,,62,MEXTICACAN,,,REG_RP,PAN_PRI_PRD,1,JOSE DE JESUS MARTINEZ SANDOVAL,1,,,PRD
1,14,JALISCO,,,62,MEXTICACAN,,,REG_RP,PAN_PRI_PRD,2,MA DE JESUS IÑIGUEZ SEPULVEDA,2,,,PRD
1,14,JALISCO,,,62,MEXTICACAN,,,REG_RP,MC,1,EDELMIRA VELASCO MERCADO,2,,,MC
1,14,JALISCO,,,62,MEXTICACAN,,,REG_RP,MC,2,TOMAS LOMELI GONZALEZ,1,,,MC
1,14,JALISCO,,,63,MEZQUITIC,,,PRES_MUN,PAN_PRI_PRD,1,TOMAS TORRES ALVAREZ,1,CANDIDATURAS DE PERSONAS JOVENES,,PAN
1,14,JALISCO,,,63,MEZQUITIC,,,SIND_MR,PAN_PRI_PRD,2,JULIA CARRILLO HERNANDEZ,2,CANDIDATURAS INDIGENAS,,PAN
1,14,JALISCO,,,63,MEZQUITIC,,,REG_MR,PAN_PRI_PRD,3,CELESTINO CARRILLO TORRES,1,CANDIDATURAS INDIGENAS,,PAN
1,14,JALISCO,,,63,MEZQUITIC,,,REG_MR,PAN_PRI_PRD,4,MATILDE CHIVARRA DE LA CRUZ,2,CANDIDATURAS INDIGENAS,,PAN
1,14,JALISCO,,,63,MEZQUITIC,,,REG_MR,PAN_PRI_PRD,5,ARMANDO CARRILLO DE LA CRUZ,1,CANDIDATURAS INDIGENAS,,PAN
1,14,JALISCO,,,63,MEZQUITIC,,,REG_MR,PAN_PRI_PRD,6,REYNA ELIZABETH COSIO LOPEZ,2,CANDIDATURAS INDIGENAS,,PAN
1,14,JALISCO,,,63,MEZQUITIC,,,REG_MR,PAN_PRI_PRD,7,UVALDO RENTERIA REGINO,1,CANDIDATURAS INDIGENAS,,PAN
1,14,JALISCO,,,63,MEZQUITIC,,,REG_RP,MC,1,ARTURO DE LA CRUZ CARRILLO,1,CANDIDATURAS INDIGENAS,,MC
1,14,JALISCO,,,63,MEZQUITIC,,,REG_RP,PVEM_PT_MORENA_HAGAMOS_FUTURO,1,SAMUEL SALVADOR ORTIZ,1,CANDIDATURAS INDIGENAS,,MORENA
1,14,JALISCO,,,63,MEZQUITIC,,,REG_RP,PVEM_PT_MORENA_HAGAMOS_FUTURO,2,NORA LUCIA FLETES NAVARRO,2,,,MORENA
1,14,JALISCO,,,63,MEZQUITIC,,,REG_RP,PVEM_PT_MORENA_HAGAMOS_FUTURO,3,CLAUDIA DE LA TORRE CARRILLO,2,CANDIDATURAS INDIGENAS,,MORENA
1,14,JALISCO,,,64,MIXTLAN,,,PRES_MUN,PAN_PRI_PRD,1,JOSE MIGUEL MORELOS SANCHEZ,1,,,PRI
1,14,JALISCO,,,64,MIXTLAN,,,REG_MR,PAN_PRI_PRD,2,MARIA DEL CARMEN MARTINEZ PEÑA,2,,,PRI
1,14,JALISCO,,,64,MIXTLAN,,,REG_MR,PAN_PRI_PRD,3,PEDRO IVAN ALVAREZ LOPEZ,1,CANDIDATURAS DE PERSONAS JOVENES,,PRI
1,14,JALISCO,,,64,MIXTLAN,,,REG_MR,PAN_PRI_PRD,4,LUCILA GONZALEZ LOPEZ,2,,,PRI
1,14,JALISCO,,,64,MIXTLAN,,,REG_MR,PAN_PRI_PRD,5,HECTOR TOPETE PEÑA,1,,,PRI
1,14,JALISCO,,,64,MIXTLAN,,,REG_MR,PAN_PRI_PRD,6,SONIA NAYELI TOPETE RAMOS,2,,,PRI
1,14,JALISCO,,,64,MIXTLAN,,,SIND_MR,PAN_PRI_PRD,7,MARIA GUADALUPE GONZALEZ RAMIREZ,2,,,PRI
1,14,JALISCO,,,64,MIXTLAN,,,REG_RP,MC,1,YESENIA DUEÑAS QUINTOR,2,,,MC
1,14,JALISCO,,,64,MIXTLAN,,,REG_RP,PVEM_PT_MORENA_HAGAMOS_FUTURO,1,JOSE ABEL TOPETE CURIEL,1,,,PVEM
1,14,JALISCO,,,64,MIXTLAN,,,REG_RP,PVEM_PT_MORENA_HAGAMOS_FUTURO,2,JOSEFINA ORTEGA DUEÑAS,2,,,PVEM
1,14,JALISCO,,,64,MIXTLAN,,,REG_RP,PVEM_PT_MORENA_HAGAMOS_FUTURO,3,ULISER ARRIZON DIAZ,1,,,PVEM
1,14,JALISCO,,,65,OCOTLAN,,,PRES_MUN,MC,1,DEYSI NALLELY ANGEL HERNANDEZ,2,CANDIDATURAS DE PERSONAS JOVENES,,MC
1,14,JALISCO,,,65,OCOTLAN,,,REG_MR,MC,2,IGNACIO GOMEZ ORNELAS,1,,,MC
1,14,JALISCO,,,65,OCOTLAN,,,REG_MR,MC,3,ALEJANDRA CONTRERAS HERNANDEZ,2,,,MC
1,14,JALISCO,,,65,OCOTLAN,,,REG_MR,MC,4,MANUEL GUTIERREZ MUÑOZ,1,,,MC
1,14,JALISCO,,,65,OCOTLAN,,,REG_MR,MC,5,ANA MARIA CHAPA GARZA,2,,,MC
1,14,JALISCO,,,65,OCOTLAN,,,SIND_MR,MC,6,ROGELIO GARCIA CASTRO,1,,,MC
1,14,JALISCO,,,65,OCOTLAN,,,REG_MR,MC,7,BERTHA ALICIA CASTELLANOS SALCEDO,2,,,MC
1,14,JALISCO,,,65,OCOTLAN,,,REG_MR,MC,8,EDWIN GILBERTO FONSECA TORRES,1,,,MC
1,14,JALISCO,,,65,OCOTLAN,,,REG_MR,MC,9,SILVIA ILIANA VILLARRUEL GUTIERREZ,2,,,MC
1,14,JALISCO,,,65,OCOTLAN,,,REG_MR,MC,10,CRISTIAN DANIEL SALAS BRAVO,1,,,MC
1,14,JALISCO,,,65,OCOTLAN,,,REG_RP,PAN_PRI_PRD,1,NORMA MARIANA NAVARRO GUTIERREZ,2,,,PRI
1,14,JALISCO,,,65,OCOTLAN,,,REG_RP,PAN_PRI_PRD,2,MARISOL VILLA NAPOLES,2,,,PRI
1,14,JALISCO,,,65,OCOTLAN,,,REG_RP,MORENA,1,MARCELA MARTINEZ LEAL,2,,,MORENA
1,14,JALISCO,,,65,OCOTLAN,,,REG_RP,MORENA,2,JOSUE AVILA MORENO,1,,,MORENA
1,14,JALISCO,,,65,OCOTLAN,,,REG_RP,PT,1,JOSE ALBERTO AGUILA TORRES,1,CANDIDATURAS DE PERSONAS JOVENES,,PT
1,14,JALISCO,,,65,OCOTLAN,,,REG_RP,PVEM,1,RAUL SANCHEZ JIMENEZ,1,,,PVEM
1,14,JALISCO,,,66,OJUELOS DE JALISCO,,,PRES_MUN,MC,1,JUAN CARLOS JASSO ROMO,1,,,MC
1,14,JALISCO,,,66,OJUELOS DE JALISCO,,,REG_MR,MC,2,DIANA ELIZABETH LLAMAS RODRIGUEZ,2,,,MC
1,14,JALISCO,,,66,OJUELOS DE JALISCO,,,SIND_MR,MC,3,EFREN DAVILA GONZALEZ,1,,,MC
1,14,JALISCO,,,66,OJUELOS DE JALISCO,,,REG_MR,MC,4,KARINA RAFAELA HERNANDEZ DE LUNA,2,CANDIDATURAS DE PERSONAS JOVENES,,MC
1,14,JALISCO,,,66,OJUELOS DE JALISCO,,,REG_MR,MC,5,ARMANDO ALFEREZ HERNANDEZ,1,,,MC
1,14,JALISCO,,,66,OJUELOS DE JALISCO,,,REG_MR,MC,6,MA ELENA SILVA AGUIÑAGA,2,,,MC
1,14,JALISCO,,,66,OJUELOS DE JALISCO,,,REG_MR,MC,7,TERESA DE JESUS ALONSO ESPARZA,2,,,MC
1,14,JALISCO,,,66,OJUELOS DE JALISCO,,,REG_RP,PAN_PRI_PRD,1,JULIO CESAR ESCALANTE MARMOLEJO,1,,,PRI
1,14,JALISCO,,,66,OJUELOS DE JALISCO,,,REG_RP,PAN_PRI_PRD,2,MARTHA RODRIGUEZ GONZALEZ,2,,,PRI
1,14,JALISCO,,,66,OJUELOS DE JALISCO,,,REG_RP,PAN_PRI_PRD,3,DIEGO GOMEZ BRIONES,1,,,PRI
1,14,JALISCO,,,66,OJUELOS DE JALISCO,,,REG_RP,MORENA,1,FRANCISCO GOMAR LOPEZ TORRES,1,,,MORENA
1,14,JALISCO,,,67,PIHUAMO,,,PRES_MUN,MC,1,ANTONIO JORGE ALEJANDRO SOTO FLORES,1,,,MC
1,14,JALISCO,,,67,PIHUAMO,,,REG_MR,MC,2,PATRIA ANGELICA BAUTISTA MORFIN,2,,,MC
1,14,JALISCO,,,67,PIHUAMO,,,REG_MR,MC,3,ABEL LARIOS JIMENEZ,1,,,MC
1,14,JALISCO,,,67,PIHUAMO,,,REG_MR,MC,4,ELENA RINCON CUEVAS,2,,,MC
1,14,JALISCO,,,67,PIHUAMO,,,REG_MR,MC,5,MARIO GONZALEZ SERRANO,1,,,MC
1,14,JALISCO,,,67,PIHUAMO,,,SIND_MR,MC,6,DALIA LIZBETH SILVA CASTELLANOS,2,CANDIDATURAS DE LA DIVERSIDAD SEXUAL,,MC
1,14,JALISCO,,,67,PIHUAMO,,,REG_MR,MC,7,JESUS EDUARDO CANO LOMELI,1,CANDIDATURAS DE PERSONAS JOVENES,,MC
1,14,JALISCO,,,67,PIHUAMO,,,REG_RP,PAN_PRI_PRD,1,JOSE ANTONIO CARDENAS CARRAZCO,1,,,PRI
1,14,JALISCO,,,67,PIHUAMO,,,REG_RP,PAN_PRI_PRD,2,MIRIAM GUADALUPE SUAREZ VEGA,2,CANDIDATURAS DE PERSONAS JOVENES,,PRI
1,14,JALISCO,,,67,PIHUAMO,,,REG_RP,PAN_PRI_PRD,3,JOSE SANCHEZ RANGEL,1,,,PRI
1,14,JALISCO,,,67,PIHUAMO,,,REG_RP,MORENA,1,MONICA LAURA MONTES GODINEZ,2,,,MORENA
1,14,JALISCO,,,68,PONCITLAN,,,PRES_MUN,MC,1,ARTURO ISRRAEL ASCENCIO GOMEZ,1,,,MC
1,14,JALISCO,,,68,PONCITLAN,,,REG_MR,MC,2,BRENDA LEONOR HERNANDEZ GARCIA,2,CANDIDATURAS DE PERSONAS JOVENES,,MC
1,14,JALISCO,,,68,PONCITLAN,,,SIND_MR,MC,3,OMAR MAURICIO MONTEON CONTRERAS,1,,,MC
1,14,JALISCO,,,68,PONCITLAN,,,REG_MR,MC,4,MARLENY ANAHI LOZANO FRANCO,2,,,MC
1,14,JALISCO,,,68,PONCITLAN,,,REG_MR,MC,5,JOSE DE JESUS LOMELI HERNANDEZ,1,,,MC
1,14,JALISCO,,,68,PONCITLAN,,,REG_MR,MC,6,MARICARMEN MUÑOZ FLORES,2,CANDIDATURAS DE DISCAPACIDAD,,MC
1,14,JALISCO,,,68,PONCITLAN,,,REG_MR,MC,7,ANTENOR ENCISO SANTIAGO,1,,,MC
1,14,JALISCO,,,68,PONCITLAN,,,REG_MR,MC,8,HONORINA HITZEL DUEÑAS MONTES,2,,,MC
1,14,JALISCO,,,68,PONCITLAN,,,REG_MR,MC,9,J GUADALUPE DE JESUS URCINO,1,,,MC
