CIRCUNSCRIPCION,ID_ESTADO,NOMBRE_ESTADO,ID_DISTRITO_LOCAL,CABECERA_DISTRITAL_LOCAL,ID_MUNICIPIO,MUNICIPIO,ID_DEMARCACION_LOCAL,DEMARCACION_LOCAL,TIPO_DE_CANDIDATURA,NOMBRE_ACTOR_POLITICO,NUMERO_LISTA,PERSONA_CANDIDATA,IDENTIDAD_SEXO_GENERICA,ACCION_AFIRMATIVA,RUTA_CONSTANCIA,PARTIDO_POLITICO
,5,COAHUILA,,,21,NADADORES,,,REG_MR,PRI_PRD_UDC,4,MARIO ALBERTO VAZQUEZ IBARRA,1,,,PRI
,5,COAHUILA,,,21,NADADORES,,,REG_MR,PRI_PRD_UDC,5,ROSA ELIA DELGADO GARCIA,2,,,PRI
,5,COAHUILA,,,21,NADADORES,,,REG_MR,PRI_PRD_UDC,6,GILBERTO IBARRA CAMPOS,1,,,PRI
,5,COAHUILA,,,21,NADADORES,,,REG_MR,PRI_PRD_UDC,7,GABRIELA VALDEZ REYES,2,,,PRI
,5,COAHUILA,,,21,NADADORES,,,SIND_RP,PT_MORENA,8,RAUL QUINTERO REYES,1,,,PT
,5,COAHUILA,,,21,NADADORES,,,REG_RP,MORENA,9,NORMA ALICIA VILLARREAL REYES,2,,,MORENA
,5,COAHUILA,,,21,NADADORES,,,REG_RP,PAN,10,FRANCISCO MARTIN CERVANTES MORENO,1,,,PAN
,5,COAHUILA,,,22,NAVA,,,PRES_MUN,PT_MORENA,1,IVAN OCHOA RODRIGUEZ,1,,,MORENA
,5,COAHUILA,,,22,NAVA,,,SIND_MR,PT_MORENA,2,ADELA RIVAS GONZALEZ,2,,,PT
,5,COAHUILA,,,22,NAVA,,,REG_MR,PT_MORENA,3,MAXIMIANO TOBAR GUADALAJARA,1,,,MORENA
,5,COAHUILA,,,22,NAVA,,,REG_MR,PT_MORENA,4,KARLA BERENICE MALDONADO GOMEZ,2,,,MORENA
,5,COAHUILA,,,22,NAVA,,,REG_MR,PT_MORENA,5,JUAN FERNANDO PAREDES BLANCO,1,,,MORENA
,5,COAHUILA,,,22,NAVA,,,REG_MR,PT_MORENA,6,CLAUDIA ARACELY VEGA CISNEROS,2,,,MORENA
,5,COAHUILA,,,22,NAVA,,,REG_MR,PT_MORENA,7,FIDEL CORONEL NAJERA,1,,,PT
,5,COAHUILA,,,22,NAVA,,,REG_MR,PT_MORENA,8,MARIA DE JESUS ALVAREZ ARELLANO,2,,,PT
,5,COAHUILA,,,22,NAVA,,,REG_MR,PT_MORENA,9,OSCAR DUARTE RODRIGUEZ,1,,,PT
,5,COAHUILA,,,22,NAVA,,,SIND_RP,PRI_PRD_UDC,10,HUMBERTO RANGEL RINCON,1,,,PRI
,5,COAHUILA,,,22,NAVA,,,REG_RP,PRI,11,MARIA DEL PILAR VALENZUELA GALLARDO,2,,,PRI
,5,COAHUILA,,,22,NAVA,,,REG_RP,PRI,12,PEDRO DAMIAN LOPEZ TREVIÑO,1,,,PRI 
,5,COAHUILA,,,22,NAVA,,,REG_RP,PRI,13,OLGA VERONICA GONZALEZ RAMIREZ,2,,,PRI 
,5,COAHUILA,,,22,NAVA,,,REG_RP,PRI,14,NOELIA ANGELES MORENO,2,,,PRI
,5,COAHUILA,,,23,OCAMPO,,,PRES_MUN,PRI_PRD_UDC,1,ADRIANA VALDEZ LOPEZ,2,,,PRI
,5,COAHUILA,,,23,OCAMPO,,,SIND_MR,PRI_PRD_UDC,2,FERNANDO ORTIZ TRIANA,1,,,PRI
,5,COAHUILA,,,23,OCAMPO,,,REG_MR,PRI_PRD_UDC,3,MARIA DEL ROSARIO BERNAL RODRIGUEZ,2,,,PRI
,5,COAHUILA,,,23,OCAMPO,,,REG_MR,PRI_PRD_UDC,4,EDGAR ALEJANDRO RAMOS MARTINEZ,1,,,PRI
,5,COAHUILA,,,23,OCAMPO,,,REG_MR,PRI_PRD_UDC,5,ATHSIRI CATALINA HERNANDEZ RODRIGUEZ,2,,,PRI
,5,COAHUILA,,,23,OCAMPO,,,REG_MR,PRI_PRD_UDC,6,JESUS ARTURO RODRIGUEZ CORDERO,1,,,PRD
,5,COAHUILA,,,23,OCAMPO,,,REG_MR,PRI_PRD_UDC,7,KAREN YAZMIN TORRES BAÑUELOS,2,,,PRI
,5,COAHUILA,,,23,OCAMPO,,,REG_MR,PRI_PRD_UDC,8,AXEL RODOLFO CONTRERAS DE LEON,1,,,PRI
,5,COAHUILA,,,23,OCAMPO,,,REG_MR,PRI_PRD_UDC,9,ROSALINDA GUIA PORTILLO,2,,,PRI
,5,COAHUILA,,,23,OCAMPO,,,SIND_RP,PT_MORENA,10,HECTOR RAUL RIVAS DE LA CRUZ,1,Candidaturas de personas mayores,,MORENA
,5,COAHUILA,,,23,OCAMPO,,,REG_RP,MORENA,11,ARTURO MEDRANO DE LEON,1,Candidaturas de personas mayores,,MORENA
,5,COAHUILA,,,23,OCAMPO,,,REG_RP,PAN,12,MARIA FRANCISCA VAZQUEZ RODRIGUEZ,2,,,PAN
,5,COAHUILA,,,23,OCAMPO,,,REG_RP,PT,13,DORA ALICIA PEÑA MUÑIZ,2,,,PT
,5,COAHUILA,,,23,OCAMPO,,,REG_RP,MORENA,14,ESPERANZA PATLAN TUKER,2,Candidaturas de personas mayores,,MORENA
,5,COAHUILA,,,24,PARRAS,,,PRES_MUN,PRI_PRD_UDC,1,FERNANDO OROZCO LARA,1,,,PRI
,5,COAHUILA,,,24,PARRAS,,,SIND_MR,PRI_PRD_UDC,2,KAREN LUCERO SEGURA PADILLA,2,,,PRI
,5,COAHUILA,,,24,PARRAS,,,REG_MR,PRI_PRD_UDC,3,FERNANDO ESTEBAN GONZALEZ VAZQUEZ,1,,,PRI
,5,COAHUILA,,,24,PARRAS,,,REG_MR,PRI_PRD_UDC,4,RAQUEL CANO RODRIGUEZ,2,,,PRI
,5,COAHUILA,,,24,PARRAS,,,REG_MR,PRI_PRD_UDC,5,JOSE DE JESUS ALVAREZ GARCIA,1,,,UDC
,5,COAHUILA,,,24,PARRAS,,,REG_MR,PRI_PRD_UDC,6,KARELLY MARISOL MORALES VAZQUEZ,2,,,PRI
,5,COAHUILA,,,24,PARRAS,,,REG_MR,PRI_PRD_UDC,7,JESUS DURAN SAMANIEGO,1,,,PRD
,5,COAHUILA,,,24,PARRAS,,,REG_MR,PRI_PRD_UDC,8,NORMA ANGELICA PUENTE MONSIVAIS,2,,,PRI
,5,COAHUILA,,,24,PARRAS,,,REG_MR,PRI_PRD_UDC,9,RENE LOZANO GARCIA,1,,,PRI
,5,COAHUILA,,,24,PARRAS,,,SIND_RP,MORENA,10,JOSE TRINIDAD GARCIA LOPEZ,1,,,MORENA
,5,COAHUILA,,,24,PARRAS,,,REG_RP,MORENA,11,KARLA MIREYA ORTA RANGEL,2,,,MORENA
,5,COAHUILA,,,24,PARRAS,,,REG_RP,PT,12,ANA NANCY VELEZ PEREZ,2,,,PT
,5,COAHUILA,,,24,PARRAS,,,REG_RP,MC,13,ADRIANA GUADALUPE CALDERA APARICIO,2,,,MC
,5,COAHUILA,,,24,PARRAS,,,REG_RP,MORENA,14,ENRIQUE ADRIAN MEJIA PEREZ,1,Candidaturas de la diversidad sexual,,MORENA
,5,COAHUILA,,,25,PIEDRAS NEGRAS,,,PRES_MUN,PT_MORENA,1,CARLOS JACOBO RODRIGUEZ GONZALEZ,1,,,MORENA
,5,COAHUILA,,,25,PIEDRAS NEGRAS,,,SIND_MR,PT_MORENA,2,ROCIO JULIETA CORTEZ ARZOLA,2,,,PT
,5,COAHUILA,,,25,PIEDRAS NEGRAS,,,REG_MR,PT_MORENA,3,RICARDO MUZQUIZ RODRIGUEZ,1,,,MORENA
,5,COAHUILA,,,25,PIEDRAS NEGRAS,,,REG_MR,PT_MORENA,4,SONIA ANEL PEREZ DE HOYOS,2,,,MORENA
,5,COAHUILA,,,25,PIEDRAS NEGRAS,,,REG_MR,PT_MORENA,5,CESAR DAVILA QUINTERO,1,,,MORENA
,5,COAHUILA,,,25,PIEDRAS NEGRAS,,,REG_MR,PT_MORENA,6,YANETTE ALAYNE GONZALEZ MORALES,2,,,MORENA
,5,COAHUILA,,,25,PIEDRAS NEGRAS,,,REG_MR,PT_MORENA,7,JUAN CARLOS HERNANDEZ INFANTE,1,,,MORENA
,5,COAHUILA,,,25,PIEDRAS NEGRAS,,,REG_MR,PT_MORENA,8,ERIKA VANESSA GALLEGOS FLORES,2,,,MORENA
,5,COAHUILA,,,25,PIEDRAS NEGRAS,,,REG_MR,PT_MORENA,9,ISMAEL GALLO HERNANDEZ,1,,,MORENA
,5,COAHUILA,,,25,PIEDRAS NEGRAS,,,REG_MR,PT_MORENA,10,ZOILA MARISOL GUAJARDO MARTINEZ,2,,,PT
,5,COAHUILA,,,25,PIEDRAS NEGRAS,,,REG_MR,PT_MORENA,11,ALEJO GONZALEZ DEL BOSQUE,1,,,PT
,5,COAHUILA,,,25,PIEDRAS NEGRAS,,,REG_MR,PT_MORENA,12,ZAHRA ELIA KANAGUSIKO CALDERON,2,,,PT
,5,COAHUILA,,,25,PIEDRAS NEGRAS,,,REG_MR,PT_MORENA,13,JUAN CARLOS ALVAREZ GARCIA,1,,,PT
,5,COAHUILA,,,25,PIEDRAS NEGRAS,,,SIND_RP,PRI _ PRD _ UDC,14,GUILLERMO ARTURO SANCHEZ GARCIA,1,,,PRI
,5,COAHUILA,,,25,PIEDRAS NEGRAS,,,REG_RP,PRI,15,JUANITA AZUCENA MOYEDA IBARRA,2,,,PRI
,5,COAHUILA,,,25,PIEDRAS NEGRAS,,,REG_RP,MC,16,JOSE ANTONIO ALBA GALVAN,1,,,MC
,5,COAHUILA,,,25,PIEDRAS NEGRAS,,,REG_RP,PRI,17,EMMANUEL FLORES FARIAS,1,,,PRI
,5,COAHUILA,,,25,PIEDRAS NEGRAS,,,REG_RP,PRI,18,SUSANA CAMARILLO BORREGO,2,,,PRI
,5,COAHUILA,,,25,PIEDRAS NEGRAS,,,REG_RP,PRI,19,ANA MARIA TREVIÑO CERVANTES,2,,,PRI
,5,COAHUILA,,,25,PIEDRAS NEGRAS,,,REG_RP,PRI,20,CAROLINA MONZON RAMON,2,,,PRI
,5,COAHUILA,,,26,PROGRESO,,,PRES_MUN,PRI_PRD_UDC,1,FEDERICO QUINTANILLA ARANA,1,,,PRI
,5,COAHUILA,,,26,PROGRESO,,,SIND_MR,PRI_PRD_UDC,2,SILVIA DOMINGUEZ QUINTERO,2,,,PRI
,5,COAHUILA,,,26,PROGRESO,,,REG_MR,PRI_PRD_UDC,3,ARACELI CEDILLO SANCHEZ,2,,,PRI
,5,COAHUILA,,,26,PROGRESO,,,REG_MR,PRI_PRD_UDC,4,CARLOTA GUADALUPE GARCIA CORONADO,2,,,PRI
,5,COAHUILA,,,26,PROGRESO,,,REG_MR,PRI_PRD_UDC,5,SONIA LIZBETH RODRIGUEZ CARDONA,2,,,PRD
,5,COAHUILA,,,26,PROGRESO,,,REG_MR,PRI_PRD_UDC,6,OSMARA SARAHI CERDA SIFUENTES,2,,,PRI
,5,COAHUILA,,,26,PROGRESO,,,REG_MR,PRI_PRD_UDC,7,JUVENTINO ROCHA ALVAREZ,1,,,PRI
,5,COAHUILA,,,26,PROGRESO,,,SIND_RP,PT_MORENA,8,NORA ELIA RODRIGUEZ RIVAS,2,,,MORENA
,5,COAHUILA,,,26,PROGRESO,,,REG_RP,MORENA,9,CESAR DANIEL DE LA GARZA HERRERA,1,,,MORENA
,5,COAHUILA,,,26,PROGRESO,,,REG_RP,PT,10,JESUS TORRES CASTILLO,1,,,PT
,5,COAHUILA,,,27,RAMOS ARIZPE,,,PRES_MUN,PRI_PRD_UDC,1,TOMAS FAUSTO GUTIERREZ MERINO,1,,,PRI
,5,COAHUILA,,,27,RAMOS ARIZPE,,,SIND_MR,PRI_PRD_UDC,2,CLAUDIA ELIZABETH REYES MENDEZ,2,,,PRI
,5,COAHUILA,,,27,RAMOS ARIZPE,,,REG_MR,PRI_PRD_UDC,3,IGNACIO MARTINEZ TORRES,1,,,PRI
,5,COAHUILA,,,27,RAMOS ARIZPE,,,REG_MR,PRI_PRD_UDC,4,ANA LUCIA DE LOURDES CAVAZOS CUELLAR,2,,,PRI
,5,COAHUILA,,,27,RAMOS ARIZPE,,,REG_MR,PRI_PRD_UDC,5,TERESO AGUSTIN MEDINA LOPEZ,1,,,PRI
,5,COAHUILA,,,27,RAMOS ARIZPE,,,REG_MR,PRI_PRD_UDC,6,MARIA ADELAIDA GUTIERREZ ROMO,2,,,PRI
,5,COAHUILA,,,27,RAMOS ARIZPE,,,REG_MR,PRI_PRD_UDC,7,JOSE TRINIDAD PEREZ NAVARRO,1,,,PRD
,5,COAHUILA,,,27,RAMOS ARIZPE,,,REG_MR,PRI_PRD_UDC,8,DULCE MARIA PEREZ ESPINOZA,2,,,UDC
,5,COAHUILA,,,27,RAMOS ARIZPE,,,REG_MR,PRI_PRD_UDC,9,RUDYY ANTONY ACIEL NIETO VELAZQUEZ,1,Candidaturas de la diversidad sexual,,PRI
,5,COAHUILA,,,27,RAMOS ARIZPE,,,REG_MR,PRI_PRD_UDC,10,MARIA DEL CARMEN GAMEZ ESTRADA,2,,,PRI
,5,COAHUILA,,,27,RAMOS ARIZPE,,,REG_MR,PRI_PRD_UDC,11,PEDRO HUSSEIN AGUIRRE FIGUEROA,1,,,PRI
,5,COAHUILA,,,27,RAMOS ARIZPE,,,REG_MR,PRI_PRD_UDC,12,CELESTE BERENICE FLORES JARAMILLO,2,,,PRI
,5,COAHUILA,,,27,RAMOS ARIZPE,,,REG_MR,PRI_PRD_UDC,13,ANTONIO DE JESUS TREJO RODRIGUEZ,1,,,PRI
,5,COAHUILA,,,27,RAMOS ARIZPE,,,SIND_RP,PT_MORENA,14,MELINA ARACELI REYNA CORONADO,2,,,MORENA
,5,COAHUILA,,,27,RAMOS ARIZPE,,,REG_RP,MORENA,15,JUAN SANCHEZ MARTINEZ,1,,,MORENA
,5,COAHUILA,,,27,RAMOS ARIZPE,,,REG_RP,PVEM,16,GLORIA ARELI FLORES OYERVIDES,2,,,PVEM
,5,COAHUILA,,,27,RAMOS ARIZPE,,,REG_RP,PT,17,ESTHELA FLORES HERRERA,1,Candidaturas de la diversidad sexual,,PT
,5,COAHUILA,,,27,RAMOS ARIZPE,,,REG_RP,PAN,18,JUAN MIGUEL OZUNA GARCIA,1,,,PAN
,5,COAHUILA,,,27,RAMOS ARIZPE,,,REG_RP,MORENA,19,LIZBETH OGAZON NAVA,2,,,MORENA
,5,COAHUILA,,,27,RAMOS ARIZPE,,,REG_RP,PVEM,20,ALEJANDRO MARTINEZ ALVAREZ,1,,,PVEM
,5,COAHUILA,,,28,SABINAS,,,PRES_MUN,PVEM,1,JOSE FELICIANO DIAZ IRIBARREN,1,,,PVEM
,5,COAHUILA,,,28,SABINAS,,,SIND_MR,PVEM,2,BRENDA SELENE CARRILLO CARRILLO,2,,,PVEM
,5,COAHUILA,,,28,SABINAS,,,REG_MR,PVEM,3,ALVARO JAIME ARELLANO,1,,,PVEM
,5,COAHUILA,,,28,SABINAS,,,REG_MR,PVEM,4,FLOR ESTELA MARTINEZ GAMEZ,2,,,PVEM
,5,COAHUILA,,,28,SABINAS,,,REG_MR,PVEM,5,GREGORIO GARZA BALLI,1,,,PVEM
,5,COAHUILA,,,28,SABINAS,,,REG_MR,PVEM,6,LUZ MARIA BAUTISTA PADILLA,2,,,PVEM
,5,COAHUILA,,,28,SABINAS,,,REG_MR,PVEM,7,RUBEN GARCIA DURAN,1,,,PVEM
,5,COAHUILA,,,28,SABINAS,,,REG_MR,PVEM,8,ADELAIDA VALDES VENEGAS,2,,,PVEM
,5,COAHUILA,,,28,SABINAS,,,REG_MR,PVEM,9,JESUS FILIBERTO BARAJAS LOZANO,1,,,PVEM
,5,COAHUILA,,,28,SABINAS,,,REG_MR,PVEM,10,AUDELIA NAVARRO VILLANUEVA,2,,,PVEM
,5,COAHUILA,,,28,SABINAS,,,REG_MR,PVEM,11,JUAN FRANCISCO RANGEL SANCHEZ,1,,,PVEM
,5,COAHUILA,,,28,SABINAS,,,REG_MR,PVEM,12,ARACELI IBARRA PONCE,2,,,PVEM
,5,COAHUILA,,,28,SABINAS,,,REG_MR,PVEM,13,GUILLERMO MALDONADO BARBOZA,1,,,PVEM
,5,COAHUILA,,,28,SABINAS,,,SIND_RP,PRI_PRD_UDC,14,VICTOR HUGO RIVERA CASTELLANOS,1,,,PRI
,5,COAHUILA,,,28,SABINAS,,,REG_RP,PRI,15,MARIA DEL PILAR ARIZPE GARCIA,2,,,PRI
,5,COAHUILA,,,28,SABINAS,,,REG_RP,MORENA,16,ELIZABETH FERNANDEZ CAMACHO,2,,,MORENA
,5,COAHUILA,,,28,SABINAS,,,REG_RP,UDC,17,ZULMMA VERENICE GUERRERO CAZARES,2,,,UDC
,5,COAHUILA,,,28,SABINAS,,,REG_RP,MC,18,REMBERTO GUADALUPE HERNANDEZ CARDENAS,1,,,MC
,5,COAHUILA,,,28,SABINAS,,,REG_RP,PRD,19,ANNA LYDIA MONTEMAYOR RODRIGUEZ,2,,,PRD
,5,COAHUILA,,,28,SABINAS,,,REG_RP,PRI,20,JOSE ANTONIO MORALES AVENA,1,,,PRI
,5,COAHUILA,,,29,SACRAMENTO,,,PRES_MUN,PRI_PRD_UDC,1,ANDREA WENDOLIN OVALLE REYNA,2,,,PRI
,5,COAHUILA,,,29,SACRAMENTO,,,SIND_MR,PRI_PRD_UDC,2,ROBERTO CARLOS VELASCO IRUEGAS,1,,,PRI
,5,COAHUILA,,,29,SACRAMENTO,,,REG_MR,PRI_PRD_UDC,3,LETICIA DEYANIRA MONTALVO REYES,2,,,PRI
,5,COAHUILA,,,29,SACRAMENTO,,,REG_MR,PRI_PRD_UDC,4,RUBEN BULMARO DE LA PAZ LOREDO,1,,,PRI
,5,COAHUILA,,,29,SACRAMENTO,,,REG_MR,PRI_PRD_UDC,5,YANET ROMO MORENO,2,,,PRI
,5,COAHUILA,,,29,SACRAMENTO,,,REG_MR,PRI_PRD_UDC,6,RODOLFO SALAZAR GONZALEZ,1,,,PRI
,5,COAHUILA,,,29,SACRAMENTO,,,REG_MR,PRI_PRD_UDC,7,BRENDA LETICIA ZAPATA VALADES,2,,,PRD
,5,COAHUILA,,,29,SACRAMENTO,,,SIND_RP,MC,8,ROSITA REYNA FLORES,2,,,MC
,5,COAHUILA,,,29,SACRAMENTO,,,REG_RP,MC,9,JAIME MORENO NAVARRO,1,,,MC
,5,COAHUILA,,,29,SACRAMENTO,,,REG_RP,MORENA,10,YAJAIRA IUSIRI REYNA RAMOS,2,,,MORENA
,5,COAHUILA,,,30,SALTILLO,,,PRES_MUN,PRI_PRD_UDC,1,JAVIER DIAZ GONZALEZ,1,,,PRI
,5,COAHUILA,,,30,SALTILLO,,,SIND_MR,PRI_PRD_UDC,2,MARIA DEL MAR ARROYO PEART,2,,,PRI
,5,COAHUILA,,,30,SALTILLO,,,REG_MR,PRI_PRD_UDC,3,MARIO ALBERTO MATA QUINTERO,1,,,PRI
,5,COAHUILA,,,30,SALTILLO,,,REG_MR,PRI_PRD_UDC,4,MARIA DE JESUS MARTINEZ LOPEZ,2,,,PRI
,5,COAHUILA,,,30,SALTILLO,,,REG_MR,PRI_PRD_UDC,5,JULIAN EDUARDO MEDRANO AGUIRRE,1,,,PRI
,5,COAHUILA,,,30,SALTILLO,,,REG_MR,PRI_PRD_UDC,6,ANDREA ALEJANDRA AVILES AGUIRRE,2,,,PRD
,5,COAHUILA,,,30,SALTILLO,,,REG_MR,PRI_PRD_UDC,7,JUAN CARLOS VILLAREAL GARZA,2,,,PRI
,5,COAHUILA,,,30,SALTILLO,,,REG_MR,PRI_PRD_UDC,8,LUCIA DEL CARMEN DAVILA FLORES,2,,,UDC
,5,COAHUILA,,,30,SALTILLO,,,REG_MR,PRI_PRD_UDC,9,EDUARDO MORELOS JIMENEZ,1,,,PRI
,5,COAHUILA,,,30,SALTILLO,,,REG_MR,PRI_PRD_UDC,10,BLANCA ESTELA HERRERA PAISANO,2,,,PRI
,5,COAHUILA,,,30,SALTILLO,,,REG_MR,PRI_PRD_UDC,11,HUGO ALBERTO RABAGO MAR,1,,,PRI
,5,COAHUILA,,,30,SALTILLO,,,REG_MR,PRI_PRD_UDC,12,YAJAIRA MARGARITA BRIONES AGUILAR,2,,,PRI
,5,COAHUILA,,,30,SALTILLO,,,REG_MR,PRI_PRD_UDC,13,CARLOS GERARDO KALIONCHIS REYES,1,,,PRI
,5,COAHUILA,,,30,SALTILLO,,,SIND_RP,MORENA,14,JOSE ROBERTO GABRIEL MARTINEZ SALINAS,1,Candidaturas de personas mayores,,MORENA
,5,COAHUILA,,,30,SALTILLO,,,REG_RP,MORENA,15,JUDITH ALEJANDRA SALAZAR MEJORADO,2,,,MORENA
,5,COAHUILA,,,30,SALTILLO,,,REG_RP,MC,16,MITCHELL EMMANUEL MARQUEZ DE LUNA,1,,,MC
,5,COAHUILA,,,30,SALTILLO,,,REG_RP,PAN,17,AMAL LIZZETT ESPER SERUR,2,,,PAN
,5,COAHUILA,,,30,SALTILLO,,,REG_RP,MORENA,18,KARLA DANIELA RAMOS MACIAS,2,,,MORENA
,5,COAHUILA,,,30,SALTILLO,,,REG_RP,MORENA,19,RICARDO ANTONIO TREVIÑO SALINAS,1,,,MORENA
,5,COAHUILA,,,30,SALTILLO,,,REG_RP,MORENA,20,ROSAURA MONROY BECERRIL,2,,,MORENA
,5,COAHUILA,,,31,SAN BUENAVENTURA,,,PRES_MUN,PRI_PRD_UDC,1,HUGO IVAN LOZANO SANCHEZ,1,,,PRI
,5,COAHUILA,,,31,SAN BUENAVENTURA,,,SIND_MR,PRI_PRD_UDC,2,ANA IRMA RAMIREZ TERRAZAS,2,,,PRI
,5,COAHUILA,,,31,SAN BUENAVENTURA,,,REG_MR,PRI_PRD_UDC,3,JESUS JAVIER FLORES RODRIGUEZ,1,,,PRI
,5,COAHUILA,,,31,SAN BUENAVENTURA,,,REG_MR,PRI_PRD_UDC,4,GLORIA LETICIA CASTELLANOS RIOS,2,,,PRI
,5,COAHUILA,,,31,SAN BUENAVENTURA,,,REG_MR,PRI_PRD_UDC,5,ARMANDO CONTRERAS GARZA,1,,,PRI
,5,COAHUILA,,,31,SAN BUENAVENTURA,,,REG_MR,PRI_PRD_UDC,6,HETCIRY SULEYKY ORTIZ ALMANZA,2,,,PRD
,5,COAHUILA,,,31,SAN BUENAVENTURA,,,REG_MR,PRI_PRD_UDC,7,HUGO LEONEL VALERO IBARRA,1,,,PRI
,5,COAHUILA,,,31,SAN BUENAVENTURA,,,REG_MR,PRI_PRD_UDC,8,MARIA LUISA GARCIA MENDEZ,2,,,PRI
,5,COAHUILA,,,31,SAN BUENAVENTURA,,,REG_MR,PRI_PRD_UDC,9,FRANCISCO GONZALEZ PEREZ,1,,,PRI
,5,COAHUILA,,,31,SAN BUENAVENTURA,,,SIND_RP,PT_MORENA,10,JAVIER ANTONIO FLORES REYES,1,,,PT
,5,COAHUILA,,,31,SAN BUENAVENTURA,,,REG_RP,MORENA,11,CARMEN NICTHE MOLINA SOTO,2,,,MORENA
,5,COAHUILA,,,31,SAN BUENAVENTURA,,,REG_RP,PAN,12,ROSA MARIA GUAJARDO HERNANDEZ,2,,,PAN
,5,COAHUILA,,,31,SAN BUENAVENTURA,,,REG_RP,PT,13,MARTHA CARDONA CONTRERAS,2,,,PT
,5,COAHUILA,,,31,SAN BUENAVENTURA,,,REG_RP,MORENA,14,JOSE MARTIN CORTEZ LOPEZ,1,,,MORENA
,5,COAHUILA,,,32,SAN JUAN DE SABINAS,,,PRES_MUN,PRI_PRD_UDC,1,OSCAR RIOS RAMIREZ,1,,,PRI
,5,COAHUILA,,,32,SAN JUAN DE SABINAS,,,SIND_MR,PRI_PRD_UDC,2,YOLANDA GARZA GONZALEZ,2,,,PRI
,5,COAHUILA,,,32,SAN JUAN DE SABINAS,,,REG_MR,PRI_PRD_UDC,3,ULISES CARDENAS HERRERA,1,,,PRI
,5,COAHUILA,,,32,SAN JUAN DE SABINAS,,,REG_MR,PRI_PRD_UDC,4,ADRIANA GUADALUPE HERNANDEZ AGUILAR,2,,,PRI
,5,COAHUILA,,,32,SAN JUAN DE SABINAS,,,REG_MR,PRI_PRD_UDC,5,AGUSTIN JAIME RICO MONTELONGO,1,,,PRI
,5,COAHUILA,,,32,SAN JUAN DE SABINAS,,,REG_MR,PRI_PRD_UDC,6,LORENA PATRICIA SAENZ MENCHACA,2,,,PRD
,5,COAHUILA,,,32,SAN JUAN DE SABINAS,,,REG_MR,PRI_PRD_UDC,7,JOSE LUIS RODRIGUEZ ORTIZ,1,,,PRI
,5,COAHUILA,,,32,SAN JUAN DE SABINAS,,,REG_MR,PRI_PRD_UDC,8,ANA MARGARITA CERNA PALACIOS,2,,,PRI
,5,COAHUILA,,,32,SAN JUAN DE SABINAS,,,REG_MR,PRI_PRD_UDC,9,JESUS ARNOLDO AGUIÑAGA MORIN,1,,,PRI
,5,COAHUILA,,,32,SAN JUAN DE SABINAS,,,SIND_RP,PT,10,CRISTINA YANETH HARO GONZALEZ,2,,,PT
,5,COAHUILA,,,32,SAN JUAN DE SABINAS,,,REG_RP,PT,11,JESUS ALONSO Z'CRUZ DE LA GARZA,1,,,PT
,5,COAHUILA,,,32,SAN JUAN DE SABINAS,,,REG_RP,MORENA,12,JOSE LUIS OLVERA SOLIS,1,,,MORENA
,5,COAHUILA,,,32,SAN JUAN DE SABINAS,,,REG_RP,PT,13,JENNIFER KAROLINA FLORES CARIELO,2,,,PT
,5,COAHUILA,,,32,SAN JUAN DE SABINAS,,,REG_RP,MORENA,14,CLAUDIA YADIRA CHAVEZ AGUIRRE,2,,,MORENA
,5,COAHUILA,,,33,SAN PEDRO,,,PRES_MUN,PRI_PRD_UDC,1,BRENDA CECILIA GUERECA HERNANDEZ,2,,,PRI
,5,COAHUILA,,,33,SAN PEDRO,,,SIND_MR,PRI_PRD_UDC,2,HECTOR JAVIER MARTINEZ BARRAZA,1,,,PRD
,5,COAHUILA,,,33,SAN PEDRO,,,REG_MR,PRI_PRD_UDC,3,MARIA GUADALUPE FLORES PADILLA,2,,,PRI
,5,COAHUILA,,,33,SAN PEDRO,,,REG_MR,PRI_PRD_UDC,4,JOSE NATIVIDAD NAVARRO MORALES,1,,,PRI
,5,COAHUILA,,,33,SAN PEDRO,,,REG_MR,PRI_PRD_UDC,5,LUISA GONZALEZ GONZALEZ,2,,,PRI
,5,COAHUILA,,,33,SAN PEDRO,,,REG_MR,PRI_PRD_UDC,6,RAFAEL GARCIA RAMIREZ,1,,,PRI
,5,COAHUILA,,,33,SAN PEDRO,,,REG_MR,PRI_PRD_UDC,7,ROSA MARIA HERNANDEZ LARA,2,,,PRD
,5,COAHUILA,,,33,SAN PEDRO,,,REG_MR,PRI_PRD_UDC,8,JORGE ANTONIO COLLAZO OLIVARES,1,,,PRI
,5,COAHUILA,,,33,SAN PEDRO,,,REG_MR,PRI_PRD_UDC,9,CLAUDIA IRENE FLORES CASTILLO,2,,,UDC
,5,COAHUILA,,,33,SAN PEDRO,,,REG_MR,PRI_PRD_UDC,10,LUIS CARLOS ABDALA MILAN,1,,,PRI
,5,COAHUILA,,,33,SAN PEDRO,,,REG_MR,PRI_PRD_UDC,11,MARIA CRISTINA ESCOBAR SANTANA,2,,,PRI
,5,COAHUILA,,,33,SAN PEDRO,,,REG_MR,PRI_PRD_UDC,12,JORGE ARTURO BABUN MORENO,1,,,PRI
,5,COAHUILA,,,33,SAN PEDRO,,,REG_MR,PRI_PRD_UDC,13,IRIS CERVANTES VEGA,2,,,PRI
,5,COAHUILA,,,33,SAN PEDRO,,,SIND_RP,PT_MORENA,14,GLORIA MATA ALBA,2,Candidaturas de personas mayores,,MORENA
,5,COAHUILA,,,33,SAN PEDRO,,,REG_RP,MORENA,15,DIANA CECILIA FERNANDEZ ROSALES,2,,,MORENA
,5,COAHUILA,,,33,SAN PEDRO,,,REG_RP,PVEM,16,PATRICIA ORALIA GRADO FALCON,2,,,PVEM
,5,COAHUILA,,,33,SAN PEDRO,,,REG_RP,CI,17,JULIO CESAR DE LA CRUZ CORPUS,1,,,CI
,5,COAHUILA,,,33,SAN PEDRO,,,REG_RP,MORENA,18,OTHO ALFREDO GUERRERO ACOSTA,1,,,MORENA
,5,COAHUILA,,,33,SAN PEDRO,,,REG_RP,PVEM,19,JESUS FERNANDO MILAN FERNANDEZ,1,,,PVEM
,5,COAHUILA,,,33,SAN PEDRO,,,REG_RP,CI,20,MARIA ARACELY ROSALES MEDRANO,2,,,CI
,5,COAHUILA,,,34,SIERRA MOJADA,,,PRES_MUN,PRI_PRD_UDC,1,ELIAS PORTILLO VASQUEZ,1,,,PRD
,5,COAHUILA,,,34,SIERRA MOJADA,,,SIND_MR,PRI_PRD_UDC,2,PATRICIA AMANDA DELGADO MORALES,2,,,PRI
,5,COAHUILA,,,34,SIERRA MOJADA,,,REG_MR,PRI_PRD_UDC,3,RAMON CARMONA GUERRERO,1,,,PRI
,5,COAHUILA,,,34,SIERRA MOJADA,,,REG_MR,PRI_PRD_UDC,4,CINDY ELIZABETH LUJAN MOLINAR,2,,,PRI
,5,COAHUILA,,,34,SIERRA MOJADA,,,REG_MR,PRI_PRD_UDC,5,MARIA DE LOS ANGELES MARQUEZ DURAN,2,,,PRD
,5,COAHUILA,,,34,SIERRA MOJADA,,,REG_MR,PRI_PRD_UDC,6,ALEJANDRA GRANADOS RAMIREZ,2,,,PRI
,5,COAHUILA,,,34,SIERRA MOJADA,,,REG_MR,PRI_PRD_UDC,7,MERCED MOLINAR PIÑA,1,,,PRI
,5,COAHUILA,,,34,SIERRA MOJADA,,,SIND_RP,PT_MORENA,8,MARIA ELENA TREVIÑO NAJERA,2,,,MORENA
,5,COAHUILA,,,34,SIERRA MOJADA,,,REG_RP,PAN,9,ESVEN LICON LUJAN,1,,,PAN
,5,COAHUILA,,,34,SIERRA MOJADA,,,REG_RP,PT,10,EDGAR RAMON TAVAREZ OLIVAS,1,,,PT
,5,COAHUILA,,,35,TORREON,,,PRES_MUN,PRI_PRD_UDC,1,ROMAN ALBERTO CEPEDA GONZALEZ,1,,,PRI
,5,COAHUILA,,,35,TORREON,,,SIND_MR,PRI_PRD_UDC,2,NATALIA GUADALUPE FERNANDEZ MARTINEZ,2,,,PRI
,5,COAHUILA,,,35,TORREON,,,REG_MR,PRI_PRD_UDC,3,LUIS JORGE CUERDA SERNA,1,,,PRI
,5,COAHUILA,,,35,TORREON,,,REG_MR,PRI_PRD_UDC,4,JENNIFER MIROSHLAVA MUÑOZ RIVAS,2,,,PRI
,5,COAHUILA,,,35,TORREON,,,REG_MR,PRI_PRD_UDC,5,ROBERTO BERNAL GOMEZ,1,,,PRI
,5,COAHUILA,,,35,TORREON,,,REG_MR,PRI_PRD_UDC,6,XIMENA VILLARREAL BLAKE,2,,,PRI
,5,COAHUILA,,,35,TORREON,,,REG_MR,PRI_PRD_UDC,7,OMAR MORALES RODRIGUEZ,1,,,UDC
,5,COAHUILA,,,35,TORREON,,,REG_MR,PRI_PRD_UDC,8,GRACIELA GUADALUPE MARTINEZ BARRAZA,2,,,PRD
,5,COAHUILA,,,35,TORREON,,,REG_MR,PRI_PRD_UDC,9,MARIO CEPEDA RAMIREZ,1,,,PRI
,5,COAHUILA,,,35,TORREON,,,REG_MR,PRI_PRD_UDC,10,KARLA LILIANA CENTENO FELIX,2,,,PRI
,5,COAHUILA,,,35,TORREON,,,REG_MR,PRI_PRD_UDC,11,DIEGO ONTIVEROS RENTERIA,1,,,PRI
,5,COAHUILA,,,35,TORREON,,,REG_MR,PRI_PRD_UDC,12,DORA ELIA SALINAS DURAN,2,,,PRI
,5,COAHUILA,,,35,TORREON,,,REG_MR,PRI_PRD_UDC,13,RAUL FABIAN RUELAS NAVARRO,1,,,PRI
,5,COAHUILA,,,35,TORREON,,,SIND_RP,PT_MORENA,14,MARIA DEL SOCORRO AGUILAR PEREZ,2,,,MORENA
,5,COAHUILA,,,35,TORREON,,,REG_RP,MORENA,15,GABRIEL FRANCISCO PEDRO,1,,,MORENA
,5,COAHUILA,,,35,TORREON,,,REG_RP,PT,16,LUIS ALBERTO ORTIZ ZORRILLA,1,Candidaturas de personas jovenes,,PT
,5,COAHUILA,,,35,TORREON,,,REG_RP,PAN,17,SERGIO LARA GALVAN,1,,,PAN
,5,COAHUILA,,,35,TORREON,,,REG_RP,MORENA,18,ZAZIL PACHECO PEREZ,2,,,MORENA
,5,COAHUILA,,,35,TORREON,,,REG_RP,MORENA,19,ARIANA NEIROLI CERVANTES ZAMARRON,2,,,MORENA
,5,COAHUILA,,,35,TORREON,,,REG_RP,MORENA,20,MARIA FERNANDA GONZALEZ APONTE,2,,,MORENA
,5,COAHUILA,,,36,VIESCA,,,PRES_MUN,PT_MORENA,1,JORGE ALONSO VELEZ SANDOVAL,1,,,MORENA
,5,COAHUILA,,,36,VIESCA,,,SIND_MR,PT_MORENA,2,CILBIA MELCHOR VELEZ,2,,,PT
,5,COAHUILA,,,36,VIESCA,,,REG_MR,PT_MORENA,3,BULMARO RAMOS ROMERO,1,,,MORENA
,5,COAHUILA,,,36,VIESCA,,,REG_MR,PT_MORENA,4,CLAUDIA JUDITH ALVARADO MORALES,2,,,MORENA
,5,COAHUILA,,,36,VIESCA,,,REG_MR,PT_MORENA,5,ENRIQUE GUILLERMO GUZMAN DE LA ROSA,1,,,MORENA
,5,COAHUILA,,,36,VIESCA,,,REG_MR,PT_MORENA,6,PERLA FABIOLA BADILLO GARZA,2,,,MORENA
,5,COAHUILA,,,36,VIESCA,,,REG_MR,PT_MORENA,7,ADAN RIVERA SALAS,1,,,MORENA
,5,COAHUILA,,,36,VIESCA,,,REG_MR,PT_MORENA,8,LAURA FRANSISCA AGUILAR TABARES,2,,,PT
,5,COAHUILA,,,36,VIESCA,,,REG_MR,PT_MORENA,9,SERGIO MURUAGA GONZALEZ,1,,,PT
,5,COAHUILA,,,36,VIESCA,,,SIND_RP,PRI_PRD_UDC,10,MARIA GABRIELA GONZALEZ GONZALEZ,2,,,PRI
,5,COAHUILA,,,36,VIESCA,,,REG_RP,PRI,11,MARIA DEL SOCORRO GONZALEZ RODRIGUEZ,2,,,PRI
,5,COAHUILA,,,36,VIESCA,,,REG_RP,PRI,12,SANTIAGO ADAME AGUILERA,1,,,PRI
,5,COAHUILA,,,36,VIESCA,,,REG_RP,PRI,13,JUANA MENDOZA YESCAS,2,,,PRI 
,5,COAHUILA,,,36,VIESCA,,,REG_RP,PRI,14,JOSE LUIS SOTO FABELA,1,Candidaturas de la diversidad sexual,,PRI 
,5,COAHUILA,,,37,VILLA UNION,,,PRES_MUN,PRI_PRD_UDC,1,MARIO HUMBERTO GONZALEZ VELA,1,,,PRI
,5,COAHUILA,,,37,VILLA UNION,,,SIND_MR,PRI_PRD_UDC,2,LINDA MERCEDES CASTRO SALDAÑA,2,,,PRI
,5,COAHUILA,,,37,VILLA UNION,,,REG_MR,PRI_PRD_UDC,3,ALEJANDRO ELIZONDO PEREZ,1,,,PRI
,5,COAHUILA,,,37,VILLA UNION,,,REG_MR,PRI_PRD_UDC,4,YAZMIN RAMIREZ DEL VALLE,2,,,UDC
,5,COAHUILA,,,37,VILLA UNION,,,REG_MR,PRI_PRD_UDC,5,EDGAR DANIEL HERNANDEZ COBIOS,1,,,PRD
,5,COAHUILA,,,37,VILLA UNION,,,REG_MR,PRI_PRD_UDC,6,ARACELY MARTINEZ MARTINEZ,2,,,PRI
,5,COAHUILA,,,37,VILLA UNION,,,REG_MR,PRI_PRD_UDC,7,PORFIRIO MARES CASTILLO,1,,,PRI
,5,COAHUILA,,,37,VILLA UNION,,,SIND_RP,PT_MORENA,8,VICTOR MANUEL VARGAS CASTELLANO,1,,,PT
,5,COAHUILA,,,37,VILLA UNION,,,REG_RP,MORENA,9,DULCE ESMERALDA PEREZ TREVIÑO,2,,,MORENA
,5,COAHUILA,,,37,VILLA UNION,,,REG_RP,PT,10,NANCY NAVIL QUINTERO MARES,2,,,PT
,5,COAHUILA,,,38,ZARAGOZA,,,PRES_MUN,PT,1,EVELIO VARA RIVERA,1,,,PT
,5,COAHUILA,,,38,ZARAGOZA,,,SIND_MR,PT,2,GABRIELA SANCHEZ FLORES,2,,,PT
,5,COAHUILA,,,38,ZARAGOZA,,,REG_MR,PT,3,COSME DIONICIO MALDONADO MARTINEZ,1,,,PT
,5,COAHUILA,,,38,ZARAGOZA,,,REG_MR,PT,4,LIZETH LIRA MONTALVO,2,,,PT
,5,COAHUILA,,,38,ZARAGOZA,,,REG_MR,PT,5,AMANDO VILLARREAL VELA,1,,,PT
,5,COAHUILA,,,38,ZARAGOZA,,,REG_MR,PT,6,DIANA ISELA GOMEZ LIRA,2,,,PT
,5,COAHUILA,,,38,ZARAGOZA,,,REG_MR,PT,7,CESARIO SAUCEDO ENCINAS,1,Candidaturas de personas mayores,,PT
,5,COAHUILA,,,38,ZARAGOZA,,,REG_MR,PT,8,BRENDA YADIRA SANCHEZ PEREZ,2,,,PT
,5,COAHUILA,,,38,ZARAGOZA,,,REG_MR,PT,9,JUAN ANTONIO GUERRERO RAMOS,1,,,PT
,5,COAHUILA,,,38,ZARAGOZA,,,SIND_RP,PRI_PRD_UDC,10,RAYMUNDO AVALOS FABELA,1,,,PRI
,5,COAHUILA,,,38,ZARAGOZA,,,REG_RP,PRI,11,CRISTINA ALICIA DE LUNA PEREZ,2,,,PRI
,5,COAHUILA,,,38,ZARAGOZA,,,REG_RP,MC,12,CARLOS ERNESTO SANTANA GUERRERO,1,,,MC
,5,COAHUILA,,,38,ZARAGOZA,,,REG_RP,PRD,13,ALEJANDRA YADIRA JIMENEZ CORONADO,2,,,PRD
,5,COAHUILA,,,38,ZARAGOZA,,,REG_RP,UDC,14,MIRIAM IBETH DOMINGUEZ GONZALEZ,2,Candidaturas de la diversidad sexual,,UDC
