CIRCUNSCRIPCION,ID_ESTADO,NOMBRE_ESTADO,ID_DISTRITO_LOCAL,CABECERA_DISTRITAL_LOCAL,ID_MUNICIPIO,MUNICIPIO,ID_DEMARCACION_LOCAL,DEMARCACION_LOCAL,TIPO_DE_CANDIDATURA,NOMBRE_ACTOR_POLITICO,NUMERO_LISTA,PERSONA_CANDIDATA,IDENTIDAD_SEXO_GENERICA,ACCION AFIRMATIVA,RUTA_CONSTANCIA,PARTIDO_POLITICO
2,1,AGUASCALIENTES,1,RINCON DE ROMOS,,,,,DIP_LOC_MR,PAN_PRI_PRD,1,AMISADAI MANUEL CASTORENA ROMO,1,,,PAN
2,1,AGUASCALIENTES,2,VILLA JUAREZ,,,,,DIP_LOC_MR,PAN_PRI_PRD,1,MA. GUADALUPE MENDOZA MEDRANO,2,,,PAN
2,1,AGUASCALIENTES,3,PABELLON DE ARTEAGA,,,,,DIP_LOC_MR,PAN_PRI_PRD,1,HERIBERTO GALLEGOS SERNA,1,,,PRD
2,1,AGUASCALIENTES,4,SAN FRANCISCO DE LOS ROMO,,,,,DIP_LOC_MR,PAN_PRI_PRD,1,BEATRIZ MONTOYA HERNANDEZ,2,,,PAN
2,1,AGUASCALIENTES,5,AGUASCALIENTES,,,,,DIP_LOC_MR,PAN_PRI_PRD,1,HUMBERTO JAVIER MONTERO DE ALBA,1,,,PAN
2,1,AGUASCALIENTES,6,AGUASCALIENTES,,,,,DIP_LOC_MR,PAN_PRI_PRD,1,LUIS SALVADOR ALCALA DURAN,1,,,PAN
2,1,AGUASCALIENTES,7,JESUS MARIA,,,,,DIP_LOC_MR,PAN_PRI_PRD,1,LAURA PATRICIA PONCE LUNA,2,,,PAN
2,1,AGUASCALIENTES,8,CALVILLO,,,,,DIP_LOC_MR,PAN_PRI_PRD,1,ADAN VALDIVIA LOPEZ,1,,,PAN
2,1,AGUASCALIENTES,9,AGUASCALIENTES,,,,,DIP_LOC_MR,PAN_PRI_PRD,1,ALMA HILDA MEDINA MACIAS,2,CANDIDATURAS DE DISCAPACIDAD,,PAN
2,1,AGUASCALIENTES,10,AGUASCALIENTES,,,,,DIP_LOC_MR,PAN_PRI_PRD,1,NANCY JEANETTE GUTIERREZ RUVALCABA,2,,,PAN
2,1,AGUASCALIENTES,11,AGUASCALIENTES,,,,,DIP_LOC_MR,PAN_PRI_PRD,1,ARLETTE IVETTE MUNOZ CERVANTES,2,,,PAN
2,1,AGUASCALIENTES,12,AGUASCALIENTES,,,,,DIP_LOC_MR,PAN_PRI_PRD,1,LUCIA DE LEON URSUA,2,,,PRI
2,1,AGUASCALIENTES,13,AGUASCALIENTES,,,,,DIP_LOC_MR,PAN_PRI_PRD,1,JEDSABEL SANCHEZ MONTES,2,,,PAN
2,1,AGUASCALIENTES,14,AGUASCALIENTES,,,,,DIP_LOC_MR,PAN_PRI_PRD,1,RODRIGO CERVANTES MEDINA,1,,,PAN
2,1,AGUASCALIENTES,15,AGUASCALIENTES,,,,,DIP_LOC_MR,PAN_PRI_PRD,1,LUIS GUADALUPE LEON MENDEZ,3,CANDIDATURAS DE LA DIVERSIDAD SEXUAL,,PAN
2,1,AGUASCALIENTES,16,AGUASCALIENTES,,,,,DIP_LOC_MR,PAN_PRI_PRD,1,EMANUELLE SANCHEZ NAJERA,1,,,PRD
2,1,AGUASCALIENTES,17,AGUASCALIENTES,,,,,DIP_LOC_MR,PAN_PRI_PRD,1,SALVADOR MAXIMILIANO RAMIREZ HERNANDEZ,1,,,PAN
2,1,AGUASCALIENTES,18,AGUASCALIENTES,,,,,DIP_LOC_MR,PAN_PRI_PRD,1,MIRNA RUBIELA MEDINA RUVALCABA,2,,,PAN
2,1,AGUASCALIENTES,,,,,,,DIP_LOC_RP,MORENA,1,FERNANDO ALFEREZ  BARBOSA,1,CANDIDATURAS DE DISCAPACIDAD,,MORENA
2,1,AGUASCALIENTES,,,,,,,DIP_LOC_RP,MORENA,2,MIRIAM YASZU MUNOZ  MARQUEZ,2,,,MORENA
2,1,AGUASCALIENTES,,,,,,,DIP_LOC_RP,MORENA,3,JOSE TRINIDAD ROMO  MARIN,1,,,MORENA
2,1,AGUASCALIENTES,,,,,,,DIP_LOC_RP,MC,4,DANIELA MIYUKY LOPEZ  MUNOZ,2,,,MC
2,1,AGUASCALIENTES,,,,,,,DIP_LOC_RP,PVEM,5,GENNY JANETH LOPEZ  VALENZUELA,2,CANDIDATURAS DE DISCAPACIDAD,,PVEM
2,1,AGUASCALIENTES,,,,,,,DIP_LOC_RP,MORENA,6,ANA LAURA GOMEZ  CALZADA,2,,,MORENA
2,1,AGUASCALIENTES,,,,,,,DIP_LOC_RP,MORENA,7,AURORA VANEGAS  MARTINEZ,2,CANDIDATURAS DE DISCAPACIDAD,,MORENA
2,1,AGUASCALIENTES,,,,,,,DIP_LOC_RP,MORENA,8,RODRIGO IVAN GONZALEZ  MIRELES,3,,,MORENA
2,1,AGUASCALIENTES,,,,,,,DIP_LOC_RP,MORENA,9,IRMA REZA  DE LA CRUZ,2,,,MORENA
2,1,AGUASCALIENTES,,,1,AGUASCALIENTES,,,PRES_MUN,PAN_PRI_PRD,1,LEONARDO MONTANEZ  CASTRO,1,,,PAN_PRI_PRD
2,1,AGUASCALIENTES,,,1,AGUASCALIENTES,,,SIND_MR,PAN_PRI_PRD,1,YADIRA AZUCENA SALAS  AGUILAR,2,,,PAN_PRI_PRD
2,1,AGUASCALIENTES,,,1,AGUASCALIENTES,,,SIND_MR,PAN_PRI_PRD,2,OCTAVIO ALBERTO OZUNA,1,CANDIDATURAS DE LA DIVERSIDAD SEXUAL,,PAN_PRI_PRD
2,1,AGUASCALIENTES,,,1,AGUASCALIENTES,,,REG_MR,PAN_PRI_PRD,1,MARTHA ELISA GONZALEZ  ESTRADA,2,,,PAN_PRI_PRD
2,1,AGUASCALIENTES,,,1,AGUASCALIENTES,,,REG_MR,PAN_PRI_PRD,2,ALFREDO MARTIN CERVANTES GARCIA,1,,,PAN_PRI_PRD
2,1,AGUASCALIENTES,,,1,AGUASCALIENTES,,,REG_MR,PAN_PRI_PRD,3,ALEJANDRA OROZCO RAMIREZ,2,,,PAN_PRI_PRD
2,1,AGUASCALIENTES,,,1,AGUASCALIENTES,,,REG_MR,PAN_PRI_PRD,4,JUAN ANTONIO GONZALEZ GUERRERO,1,,,PAN_PRI_PRD
2,1,AGUASCALIENTES,,,1,AGUASCALIENTES,,,REG_MR,PAN_PRI_PRD,5,LESLIE SULLYANNETT ATILANO TAPIA,2,,,PAN_PRI_PRD
2,1,AGUASCALIENTES,,,1,AGUASCALIENTES,,,REG_MR,PAN_PRI_PRD,6,JUAN MANUEL GOMEZ MORALES,1,,,PAN_PRI_PRD
2,1,AGUASCALIENTES,,,1,AGUASCALIENTES,,,REG_MR,PAN_PRI_PRD,7,CINDY RUVALCABA DE LOERA,2,,,PAN_PRI_PRD
2,1,AGUASCALIENTES,,,1,AGUASCALIENTES,,,REG_RP,MORENA,1,MARTHA CECILIA MARQUEZ ALVARADO,2,,,MORENA
2,1,AGUASCALIENTES,,,1,AGUASCALIENTES,,,REG_RP,MC,2,GUSTAVO ADOLFO GRANADOS CORZO,1,,,MC
2,1,AGUASCALIENTES,,,1,AGUASCALIENTES,,,REG_RP,MORENA,3,GILBERTO GUTIERREZ LARA,1,,,MORENA
2,1,AGUASCALIENTES,,,1,AGUASCALIENTES,,,REG_RP,MORENA,4,LIZETTE IVON GONZALEZ MARTINEZ,2,,,MORENA
2,1,AGUASCALIENTES,,,1,AGUASCALIENTES,,,REG_RP,MC,5,KARLA ARELY ESPINOZA ESPARZA,2,,,MC
2,1,AGUASCALIENTES,,,1,AGUASCALIENTES,,,REG_RP,MORENA,6,ABDEL ALEJANDRO LUEVANO NUNEZ,1,,,MORENA
2,1,AGUASCALIENTES,,,1,AGUASCALIENTES,,,REG_RP,MC,7,JUAN CARLOS ESPINOZA ESPARZA,1,,,MC
2,1,AGUASCALIENTES,,,2,ASIENTOS,,,PRES_MUN,PAN_PRI_PRD,1,JOSE MANUEL GONZALEZ MOTA,1,,,PAN_PRI_PRD
2,1,AGUASCALIENTES,,,2,ASIENTOS,,,SIND_MR,PAN_PRI_PRD,1,EVA MACIAS MACIAS,2,,,PAN_PRI_PRD
2,1,AGUASCALIENTES,,,2,ASIENTOS,,,REG_MR,PAN_PRI_PRD,1,FERNANDO MEDINA MEDINA,1,,,PAN_PRI_PRD
2,1,AGUASCALIENTES,,,2,ASIENTOS,,,REG_MR,PAN_PRI_PRD,2,DIANA KARINA VAZQUEZ LOPEZ,2,,,PAN_PRI_PRD
2,1,AGUASCALIENTES,,,2,ASIENTOS,,,REG_MR,PAN_PRI_PRD,3,ABEL VELAZQUEZ CALVILLO,1,,,PAN_PRI_PRD
2,1,AGUASCALIENTES,,,2,ASIENTOS,,,REG_MR,PAN_PRI_PRD,4,ALMA ARACELY RANGEL PADILLA,2,,,PAN_PRI_PRD
2,1,AGUASCALIENTES,,,2,ASIENTOS,,,REG_RP,MORENA,1,MA. DE JESUS TORRES RAMIREZ,2,,,MORENA
2,1,AGUASCALIENTES,,,2,ASIENTOS,,,REG_RP,MC,2,MERCEDES MONSERRAT MORFIN NEGRETE,2,,,MC
2,1,AGUASCALIENTES,,,2,ASIENTOS,,,REG_RP,MORENA,3,LUIS ARTURO ORTEGA HERNANDEZ,1,,,MORENA
2,1,AGUASCALIENTES,,,2,ASIENTOS,,,REG_RP,MORENA,4,DULCE MARIA DEL ROSARIO GUARDADO RAMIREZ,2,,,MORENA
2,1,AGUASCALIENTES,,,3,CALVILLO,,,PRES_MUN,PAN_PRI_PRD,1,DANIEL ROMO URRUTIA,1,,,PAN_PRI_PRD
2,1,AGUASCALIENTES,,,3,CALVILLO,,,SIND_MR,PAN_PRI_PRD,1,ZENAIDA MUNOZ MEDINA,2,CANDIDATURAS DE DISCAPACIDAD,,PAN_PRI_PRD
2,1,AGUASCALIENTES,,,3,CALVILLO,,,REG_MR,PAN_PRI_PRD,1,JOSE ALFREDO DE LARA HERNANDEZ,1,,,PAN_PRI_PRD
2,1,AGUASCALIENTES,,,3,CALVILLO,,,REG_MR,PAN_PRI_PRD,2,ANA ISABEL DIAZ MARTINEZ,2,CANDIDATURAS DE LA DIVERSIDAD SEXUAL,,PAN_PRI_PRD
2,1,AGUASCALIENTES,,,3,CALVILLO,,,REG_MR,PAN_PRI_PRD,3,JORGE ALBERTO GALLARDO CARBAJAL,1,,,PAN_PRI_PRD
2,1,AGUASCALIENTES,,,3,CALVILLO,,,REG_MR,PAN_PRI_PRD,4,GABRIELA SERNA MARTINEZ,2,CANDIDATURAS DE DISCAPACIDAD,,PAN_PRI_PRD
2,1,AGUASCALIENTES,,,3,CALVILLO,,,REG_RP,MORENA,1,ESMERALDA PERALTA RAMIREZ,2,,,MORENA
2,1,AGUASCALIENTES,,,3,CALVILLO,,,REG_RP,PVEM,2,MARIA CRISTINA VELASCO VALLE,2,,,PVEM
2,1,AGUASCALIENTES,,,3,CALVILLO,,,REG_RP,MC,3,MARTHA XIMENA DE LEON BELLOSO,2,CANDIDATURAS DE LA DIVERSIDAD SEXUAL,,MC
2,1,AGUASCALIENTES,,,3,CALVILLO,,,REG_RP,MORENA,4,OMAR ALEJANDRO MORALES LOPEZ,1,,,MORENA
2,1,AGUASCALIENTES,,,4,COSIO,,,PRES_MUN,CAND_IND1,1,FRANCISCO JAVIER DOMINGUEZ  LOPEZ,1,,,CAND_IND1
2,1,AGUASCALIENTES,,,4,COSIO,,,SIND_MR,CAND_IND1,1,CLAUDIA GUADALUPE ESPARZA  CORTES,2,,,CAND_IND1
2,1,AGUASCALIENTES,,,4,COSIO,,,REG_MR,CAND_IND1,1,JULIO CESAR LOPEZ  JACOBO,1,,,CAND_IND1
2,1,AGUASCALIENTES,,,4,COSIO,,,REG_MR,CAND_IND1,2,YEIMI ESMITH MARTINEZ  LOPEZ,2,,,CAND_IND1
2,1,AGUASCALIENTES,,,4,COSIO,,,REG_MR,CAND_IND1,3,MIGUEL CARDONA  RODRIGUEZ,1,,,CAND_IND1
2,1,AGUASCALIENTES,,,4,COSIO,,,REG_RP,MC,1,LUZ MARIA PADILLA DE LUNA,2,,,MC
2,1,AGUASCALIENTES,,,4,COSIO,,,REG_RP,PAN,2,GRICELDA DIAZ LUEVANO,2,,,PAN
2,1,AGUASCALIENTES,,,4,COSIO,,,REG_RP,PRI,3,JULIA ESMERALDA CARDONA NAVA,2,,,PRI
2,1,AGUASCALIENTES,,,5,JESUS MARIA,,,PRES_MUN,PAN_PRI_PRD,1,CESAR FERNANDO MEDINA CERVANTES,1,,,PAN_PRI_PRD
2,1,AGUASCALIENTES,,,5,JESUS MARIA,,,SIND_MR,PAN_PRI_PRD,1,BEATRIZ LOPEZ JIMENEZ,2,,,PAN_PRI_PRD
2,1,AGUASCALIENTES,,,5,JESUS MARIA,,,REG_MR,PAN_PRI_PRD,1,BENJAMIN DE LUNA MARTINEZ,1,,,PAN_PRI_PRD
2,1,AGUASCALIENTES,,,5,JESUS MARIA,,,REG_MR,PAN_PRI_PRD,2,LAURA ALEJANDRA VALADEZ PONCE,2,CANDIDATURAS DE DISCAPACIDAD,,PAN_PRI_PRD
2,1,AGUASCALIENTES,,,5,JESUS MARIA,,,REG_MR,PAN_PRI_PRD,3,GERARDO ALFONSO GUTIERREZ GOMEZ,1,,,PAN_PRI_PRD
2,1,AGUASCALIENTES,,,5,JESUS MARIA,,,REG_MR,PAN_PRI_PRD,4,MARIA DOLORES ADAME MACIAS,2,,,PAN_PRI_PRD
2,1,AGUASCALIENTES,,,5,JESUS MARIA,,,REG_RP,MORENA,1,MARIA DEL CARMEN GONZALEZ POSADAS,2,,,MORENA
2,1,AGUASCALIENTES,,,5,JESUS MARIA,,,REG_RP,MC,2,WALTER SCHADTLER CONTRERAS,1,CANDIDATURAS DE PERSONAS MAYORES,,MC
2,1,AGUASCALIENTES,,,5,JESUS MARIA,,,REG_RP,PVEM,3,OMAR ISRAEL CAMARILLO ,1,CANDIDATURAS DE DISCAPACIDAD,,PVEM
2,1,AGUASCALIENTES,,,5,JESUS MARIA,,,REG_RP,MORENA,4,GUDELIA MARES RAMIREZ,2,,,MORENA
2,1,AGUASCALIENTES,,,6,PABELLON DE ARTEAGA,,,PRES_MUN,PAN_PRI_PRD,1,LUCERO ESPINOZA VAZQUEZ,2,,,PAN_PRI_PRD
2,1,AGUASCALIENTES,,,6,PABELLON DE ARTEAGA,,,SIND_MR,PAN_PRI_PRD,1,ARTURO DE LUNA PRIETO,1,,,PAN_PRI_PRD
2,1,AGUASCALIENTES,,,6,PABELLON DE ARTEAGA,,,REG_MR,PAN_PRI_PRD,1,CINDY VIANEY MUNOZ HERRADA,2,,,PAN_PRI_PRD
2,1,AGUASCALIENTES,,,6,PABELLON DE ARTEAGA,,,REG_MR,PAN_PRI_PRD,2,IRVING FERNANDO SUAREZ CHAVEZ,1,,,PAN_PRI_PRD
2,1,AGUASCALIENTES,,,6,PABELLON DE ARTEAGA,,,REG_MR,PAN_PRI_PRD,3,ELENA ESTEFANIA SANTANA GUERRERO,2,,,PAN_PRI_PRD
2,1,AGUASCALIENTES,,,6,PABELLON DE ARTEAGA,,,REG_MR,PAN_PRI_PRD,4,CLAUDIA GABRIELA AMBRIZ ORTIZ,2,,,PAN_PRI_PRD
2,1,AGUASCALIENTES,,,6,PABELLON DE ARTEAGA,,,REG_RP,MORENA,1,EDITH HORNEDO ROMO,2,,,MORENA
2,1,AGUASCALIENTES,,,6,PABELLON DE ARTEAGA,,,REG_RP,PVEM,2,CUAUHTEMOC ESCOBEDO TEJADA,1,,,PVEM
2,1,AGUASCALIENTES,,,6,PABELLON DE ARTEAGA,,,REG_RP,MC,3,JUAN CARLOS ALBA MUNOZ,1,CANDIDATURAS DE DISCAPACIDAD,,MC
2,1,AGUASCALIENTES,,,6,PABELLON DE ARTEAGA,,,REG_RP,PT,4,GALISMA ELIZABETH MORENO SERRANO,2,,,PT
2,1,AGUASCALIENTES,,,7,RINCON DE ROMOS,,,PRES_MUN,MORENA,1,ERICK MURO SANCHEZ,1,,,MORENA
2,1,AGUASCALIENTES,,,7,RINCON DE ROMOS,,,SIND_MR,MORENA,1,MARIA AZUCENA PALOS URRUTIA,2,,,MORENA
2,1,AGUASCALIENTES,,,7,RINCON DE ROMOS,,,REG_MR,MORENA,1,ROBERTO AXEL ARMENDARIZ SILVA,1,,,MORENA
2,1,AGUASCALIENTES,,,7,RINCON DE ROMOS,,,REG_MR,MORENA,2,ELISA MARCELA FIGUEROA TREVINO,2,CANDIDATURAS DE LA DIVERSIDAD SEXUAL,,MORENA
2,1,AGUASCALIENTES,,,7,RINCON DE ROMOS,,,REG_MR,MORENA,3,SILVIA CECILIA PEREZ PALACIOS,2,,,MORENA
2,1,AGUASCALIENTES,,,7,RINCON DE ROMOS,,,REG_MR,MORENA,4,JOSE ALBERTO PADILLA CASTANEDA,1,,,MORENA
2,1,AGUASCALIENTES,,,7,RINCON DE ROMOS,,,REG_RP,PAN,1,YADIRA CASTORENA PINA,2,,,PAN
2,1,AGUASCALIENTES,,,7,RINCON DE ROMOS,,,REG_RP,CAND_IND2,2,PEDRO MARMOLEJO GARCIA,1,,,CAND_IND2
2,1,AGUASCALIENTES,,,7,RINCON DE ROMOS,,,REG_RP,MC,3,CESAR MAURICIO PALMA ZAPATA,1,,,MC
2,1,AGUASCALIENTES,,,7,RINCON DE ROMOS,,,REG_RP,PRI,4,LAURA PATRICIA ROMO CASTORENA,2,,,PRI
2,1,AGUASCALIENTES,,,8,SAN JOSE DE GRACIA,,,PRES_MUN,PAN_PRI_PRD,1,LAURA ARACELI GONZALEZ REYES,2,,,PAN_PRI_PRD
2,1,AGUASCALIENTES,,,8,SAN JOSE DE GRACIA,,,SIND_MR,PAN_PRI_PRD,1,VICENTE VENTURA ANAYA,1,CANDIDATURAS DE LA DIVERSIDAD SEXUAL,,PAN_PRI_PRD
2,1,AGUASCALIENTES,,,8,SAN JOSE DE GRACIA,,,REG_MR,PAN_PRI_PRD,1,SARA ADRIANA LUEVANO AGUAYO,2,,,PAN_PRI_PRD
2,1,AGUASCALIENTES,,,8,SAN JOSE DE GRACIA,,,REG_MR,PAN_PRI_PRD,2,EFRAIN HERNANDEZ GARCIA,1,,,PAN_PRI_PRD
2,1,AGUASCALIENTES,,,8,SAN JOSE DE GRACIA,,,REG_MR,PAN_PRI_PRD,3,JANETT ZOITSA LOPEZ QUIROZ,2,,,PAN_PRI_PRD
2,1,AGUASCALIENTES,,,8,SAN JOSE DE GRACIA,,,REG_RP,MC,1,MARIANA JANETH MEDINA PALOS,2,,,MC
2,1,AGUASCALIENTES,,,8,SAN JOSE DE GRACIA,,,REG_RP,MORENA,2,JUANA IMELDA LLAMAS TAVAREZ,2,,,MORENA
2,1,AGUASCALIENTES,,,8,SAN JOSE DE GRACIA,,,REG_RP,MC,3,MARTIN SANCHEZ SANTOS,1,,,MC
2,1,AGUASCALIENTES,,,9,TEPEZALA,,,PRES_MUN,PAN_PRI_PRD,1,LETICIA OLIVARES JIMENEZ,2,,,PAN_PRI_PRD
2,1,AGUASCALIENTES,,,9,TEPEZALA,,,SIND_MR,PAN_PRI_PRD,1,J. JESUS LOMELI POSADA,1,,,PAN_PRI_PRD
2,1,AGUASCALIENTES,,,9,TEPEZALA,,,REG_MR,PAN_PRI_PRD,1,ROSA ESTHELA FLORES VAZQUEZ,2,,,PAN_PRI_PRD
2,1,AGUASCALIENTES,,,9,TEPEZALA,,,REG_MR,PAN_PRI_PRD,2,ROBERTO LOPEZ TORALES,1,,,PAN_PRI_PRD
2,1,AGUASCALIENTES,,,9,TEPEZALA,,,REG_MR,PAN_PRI_PRD,3,IMELDA BERNAL MARMOLEJO,2,CANDIDATURAS DE DISCAPACIDAD,,PAN_PRI_PRD
2,1,AGUASCALIENTES,,,9,TEPEZALA,,,REG_RP,MORENA,1,LANIER MACIAS VAZQUEZ,1,,,MORENA
2,1,AGUASCALIENTES,,,9,TEPEZALA,,,REG_RP,MC,2,KARLA ADILENE BELTRAN GUTIERREZ,2,,,MC
2,1,AGUASCALIENTES,,,9,TEPEZALA,,,REG_RP,MORENA,3,CASANDRA GUADALUPE DELGADO DELGADILLO,2,,,MORENA
2,1,AGUASCALIENTES,,,10,SAN FRANCISCO DE LOS ROMO,,,PRES_MUN,PAN_PRI_PRD,1,MARGARITA GALLEGOS SOTO,2,,,PAN_PRI_PRD
2,1,AGUASCALIENTES,,,10,SAN FRANCISCO DE LOS ROMO,,,SIND_MR,PAN_PRI_PRD,1,TALCO ROMO MIRELES,1,,,PAN_PRI_PRD
2,1,AGUASCALIENTES,,,10,SAN FRANCISCO DE LOS ROMO,,,REG_MR,PAN_PRI_PRD,1,CLAUDIA LETICIA GARCIA GONZALEZ,2,,,PAN_PRI_PRD
2,1,AGUASCALIENTES,,,10,SAN FRANCISCO DE LOS ROMO,,,REG_MR,PAN_PRI_PRD,2,EDGAR RAUL RAMIREZ RUELAS,1,,,PAN_PRI_PRD
2,1,AGUASCALIENTES,,,10,SAN FRANCISCO DE LOS ROMO,,,REG_MR,PAN_PRI_PRD,3,KARINA IVETTE EUDAVE DELGADO,2,CANDIDATURAS DE LA DIVERSIDAD SEXUAL,,PAN_PRI_PRD
2,1,AGUASCALIENTES,,,10,SAN FRANCISCO DE LOS ROMO,,,REG_MR,PAN_PRI_PRD,4,JAVIER HERNANDEZ PARGA,1,,,PAN_PRI_PRD
2,1,AGUASCALIENTES,,,10,SAN FRANCISCO DE LOS ROMO,,,REG_RP,MORENA,1,JAVIER DE JESUS MARTINEZ NERI,1,CANDIDATURAS DE LA DIVERSIDAD SEXUAL,,MORENA
2,1,AGUASCALIENTES,,,10,SAN FRANCISCO DE LOS ROMO,,,REG_RP,MC,2,OCTAVIO RAMIREZ GALLEGOS,1,,,MC
2,1,AGUASCALIENTES,,,10,SAN FRANCISCO DE LOS ROMO,,,REG_RP,MORENA,3,MARIA FERNANDA MARTINEZ DE LA CRUZ,2,CANDIDATURAS DE LA DIVERSIDAD SEXUAL,,MORENA
2,1,AGUASCALIENTES,,,10,SAN FRANCISCO DE LOS ROMO,,,REG_RP,MORENA,4,ANA LILIA GUTIERREZ DELGADO,2,,,MORENA
2,1,AGUASCALIENTES,,,11,EL LLANO,,,PRES_MUN,MORENA,1,JORGE DELGADO IBARRA,1,,,MORENA
2,1,AGUASCALIENTES,,,11,EL LLANO,,,SIND_MR,MORENA,1,MA. DEL RUBI AGUILAR ESPARZA,2,,,MORENA
2,1,AGUASCALIENTES,,,11,EL LLANO,,,REG_MR,MORENA,1,MONICA PATRICIA HIGUERA AGUILAR,2,,,MORENA
2,1,AGUASCALIENTES,,,11,EL LLANO,,,REG_MR,MORENA,2,ANA MARIA MAGALY BARBA NAVARRETE,2,,,MORENA
2,1,AGUASCALIENTES,,,11,EL LLANO,,,REG_MR,MORENA,3,JOSE ANTONIO RODRIGUEZ DAVILA,1,,,MORENA
2,1,AGUASCALIENTES,,,11,EL LLANO,,,REG_RP,PT,1,RICARDO PEDROZA ORTEGA,1,,,PT
2,1,AGUASCALIENTES,,,11,EL LLANO,,,REG_RP,PAN,2,MARISOL HERRERA ORTIZ,2,,,PAN
2,1,AGUASCALIENTES,,,11,EL LLANO,,,REG_RP,PRI,3,CELESTE STYVALY MARTINEZ RAMOS,2,,,PRI
